employee_name,first_matched_job_title,employee_name_clean,location,year_stored
"Avella, Prof. Dr. Felice-Alfredo",Professor Fakultät Wirtschaft,Felice-Alfredo Avella,karlsruhe,2021
"Berkling, Ph.D., Prof. Kay Margarethe",Professorin Fakultät Technik,Kay Margarethe Berkling,karlsruhe,2021
"Bonaudo,  Patricia",akademische Mitarbeiterin im Bereich „Lerntechnologien und Digitalisierung“,Patricia Bonaudo,karlsruhe,2021
"Brandstetter,  Christian",akademischer Mitarbeiter im Bereich Entrepreneurial Education,Christian Brandstetter,karlsruhe,2021
"Braun, Prof. Dr. Heinrich",Leiter Studiengang Informatik Fachliche Beratung Master Informatik Wissenschaftliche Leitung Master Informatik,Heinrich Braun,karlsruhe,2021
"Brunner,  Marina",akademische Mitarbeiterin im Bereich Lerntechnologien und Digitalisierung,Marina Brunner,karlsruhe,2021
"Buske, Prof. Dr. Antje",Professorin Fakultät Wirtschaft,Antje Buske,karlsruhe,2021
"Dannenmayer, Prof. Bernd",Professor Fakultät Wirtschaft,Bernd Dannenmayer,karlsruhe,2021
"Ehlers, Prof. Dr. Ulf-Daniel",Professor Fakultät Wirtschaft,Ulf-Daniel Ehlers,karlsruhe,2021
"Eigbrecht,  Laura",akademische Mitarbeiterin im Bereich „Lerntechnologien und Digitalisierung“,Laura Eigbrecht,karlsruhe,2021
"Erb, Prof. Dr. Jürgen",Professor Fakultät Technik,Jürgen Erb,karlsruhe,2021
"Franken, Prof. Dr. Birgit",Professorin Fakultät Wirtschaft,Birgit Franken,karlsruhe,2021
"Freytag, Prof. Dr. Thomas",Professor Fakultät Wirtschaft Wissenschaftlicher Leiter International Office,Thomas Freytag,karlsruhe,2021
"Ganninger, Prof. Dr. Aline",Professorin Fakultät Technik,Aline Ganninger,karlsruhe,2021
"Geier,  Nicole",Akademische Mitarbeiterin (Lerntechnologie und Digitalisierung),Nicole Geier,karlsruhe,2021
"Grün, Prof. Dr. Markus",Professor Fakultät Wirtschaft,Markus Grün,karlsruhe,2021
"Haas, Prof. Martin",Professor Fakultät Technik,Martin Haas,karlsruhe,2021
"Harms, Prof. Dr. Torsten",Professor Fakultät Wirtschaft,Torsten Harms,karlsruhe,2021
"Heck,  Regina",Akademische Mitarbeiterin im Studiengang Angewandte Hebammenwissenschaft,Regina Heck,karlsruhe,2021
"Heinemann,  Sonja",Akademische Mitarbeiterin im Studiengang Angewandte Hebammenwissenschaft,Sonja Heinemann,karlsruhe,2021
"Heinz,  Aneta","Wissenschaftliche Mitarbeiterin im IPF-Projekt „Weiterbildungsstrategien in der IT-Branche“, Projekt Z",Aneta Heinz,karlsruhe,2021
"Klink, Prof. Dr. Stefan",Professor Fakultät WirtschaftFachliche Beratung zum Master Wirtschaftsinformatik,Stefan Klink,karlsruhe,2021
"Kopra-Schäfer, Prof. Dr. Monika",Professorin Fakultät Technik,Monika Kopra-Schäfer,karlsruhe,2021
"Korbmann,  Monika",Aakademische Mitarbeiterin im Projekt 3D-ThermoCell,Monika Korbmann,karlsruhe,2021
"Kühn, Prof. Dr.-Ing. Ralf",Professor Fakultät Technik,Ralf Kühn,karlsruhe,2021
"Kunze,  Katharina",Akademische Mitarbeiterin (Lerntechnologie und Digitalisierung),Katharina Kunze,karlsruhe,2021
"Landwehr-Zloch, Prof. Dr. Sabine",Professorin Fakultät Wirtschaft,Sabine Landwehr-Zloch,karlsruhe,2021
"Lauer, Prof. Dr. Silvia",Professorin Fakultät TechnikLeiterin Multimedia Lernzentrum / Sprachenzentrum,Silvia Lauer,karlsruhe,2021
"Lausen, Prof. Dr. Ralph",Professor Fakultät Technik,Ralph Lausen,karlsruhe,2021
"Lautenschlager,  Evelyn",Akademische Mitarbeiterin im Fachbereich Gesundheit,Evelyn Lautenschlager,karlsruhe,2021
"Lee, Prof. Dr. Andrew",Professor Fakultät Wirtschaft,Andrew Lee,karlsruhe,2021
"Lennerts, Prof. Dr. Silke",Professor Fakultät Wirtschaft,Silke Lennerts,karlsruhe,2021
"Marschall,  Tanja",Akademische Mitarbeiterin im Fachbereich Gesundheit,Tanja Marschall,karlsruhe,2021
"Möbius, Prof. Dr. Christian",Professor Fakultät Wirtschaft,Christian Möbius,karlsruhe,2021
"Müller, Prof. Dr. Margitte",Studiengangsleiterin,Margitte Müller,karlsruhe,2021
"Nick, Prof. Dr. Albrecht",Leiter Studiengang Maschinenbau Wissenschaftlicher Leiter International Office,Albrecht Nick,karlsruhe,2021
"Oberschmidt, Prof. Dr.-Ing. Gerald",Professor Fakultät Technik Fachliche Beratung Master Elektrotechnik und Integrated Engineering Wissenschaftliche Leitung Master Elektrotechnik,Gerald Oberschmidt,karlsruhe,2021
"Paulsen, Prof. Dr. Pay-Uwe",Professor Fakultät Wirtschaft,Pay-Uwe Paulsen,karlsruhe,2021
"Reinhard,  Stefan",Akademischer Mitarbeiter im Projekt ExGra,Stefan Reinhard,karlsruhe,2021
"Reitze, Prof. Dr. Clemens",Professor Fakultät Technik,Clemens Reitze,karlsruhe,2021
"Röthig, Prof. Dr. Jürgen",Professor Fakultät Technik,Jürgen Röthig,karlsruhe,2021
"Schindler, Prof. Dr. Darius",Professor Fakultät WirtschaftJustiziar,Darius Schindler,karlsruhe,2021
"Schmitt,  Wibke",akademische Mitarbeiterin im Projekt BioPCM,Wibke Schmitt,karlsruhe,2021
"Schorr, Prof. Dr. Dietmar",Leiter Studiengang MaschinenbauWissenschaftliche Leitung Master MaschinenbauFachliche Beratung Master Maschinenbau und Wirtschaftsingenieurwesen,Dietmar Schorr,karlsruhe,2021
"Schwär,  Florian",wissenschaftlicher Mitarbeiter bei Herrn Prof. Kauffmann,Florian Schwär,karlsruhe,2021
"Tometten-Iseke, Prof. Dr. Anneliese",Professorin im Studiengang Angewandte Hebammenwissenschaft,Anneliese Tometten-Iseke,karlsruhe,2021
"Volkmann,  Anna",Akademische Mitarbeiterin im Studiengang Angewandte Hebammenwissenschaft,Anna Volkmann,karlsruhe,2021
"Walter,  Lukas",als akademischer Mitarbeiter im Projekt PolyProg bei Herrn Prof. Kauffmann,Lukas Walter,karlsruhe,2021
"Weber, Prof. Dr. Andreas",Professor Fakultät Wirtschaft,Andreas Weber,karlsruhe,2021
"Wuttke-Hilke,  Iris",Akademische Mitarbeiterin Fakultät Wirtschaft - Industrie,Iris Wuttke-Hilke,karlsruhe,2021
"Zeller,  Tanja",Akademische Mitarbeiterin im Studiengang Physician Assistant,Tanja Zeller,karlsruhe,2021
"Zimmerman, Prof. Dr. Eric",Professor Fakultät Technik,Eric Zimmerman,karlsruhe,2021
"Zimmermann, Prof. Dr. Ruth-Caroline",Professorin Fakultät Wirtschaft,Ruth-Caroline Zimmermann,karlsruhe,2021
