AUTHOR_NAME,PUB_TITLE,PUB_YEAR,PUB_AUTHORS,PUB_PUBLISHER,PUB_CITATIONS,UPDATED
Hannah Böhrk,Transpiration cooling experiments on a CMC wall segment in a supersonic hot gas channel,2018,"['D Prokein', ' C Dittert', ' H Böhrk…']", International …,7.0,2022-03-04
Hannah Böhrk,Electrical resistivity measurement of carbon-fiber-reinforced ceramic matrix composite under thermo-mechanical load,2013,"['H Böhrk', ' P Leschinski', ' T Reimer']", Composites science and technology,11.0,2022-03-04
Hannah Böhrk,Flowfield and pressure decay analysis of porous cones,2017,"['C Dittert', ' M Selzer', ' H Böhrk']", AIAA Journal,10.0,2022-03-04
Hannah Böhrk,Thermophysical properties of Almahata Sitta meteorites (asteroid 2008 TC3) for high‐fidelity entry modeling,2017,"['S Loehle', ' P Jenniskens', ' H Böhrk…']", … & Planetary Science,8.0,2022-03-04
Hannah Böhrk,Electrostatic probe and camera measurements for modeling the iMPD SIMP-LEX,2007,"['A Nawaz', ' U Bauder', ' H Böhrk', ' G Herdrich…']", AIAA/ASME/SAE …,13.0,2022-03-04
Hannah Böhrk,A porous flow control element for pulsed plasma thrusters,2012,"['H Böhrk', ' M Lau', ' G Herdrich', ' H Hald', ' HP Röser']", CEAS Space Journal,7.0,2022-03-04
Hannah Böhrk,Surface heat flux determination of transpiration cooled c/c by the application of non-integer system identification,2016,"['S Schweikert', ' S Löhle', ' M Selzer', ' H Böhrk…']", Changes,5.0,2022-03-04
Hannah Böhrk,FinEx–Fin Experiment on HIFiRE-5,2011,"['H Böhrk', ' S Löhle', ' U Fuchs', ' H Elsäßer…']", Symposium on …,5.0,2022-03-04
Hannah Böhrk,Three-dimensional thermal analysis of the HIFiRE-5 ceramic fin,2012,"['S Löhle', ' H Böhrk', ' U Fuchs', ' B Kraetzig…']",,11.0,2022-03-04
Hannah Böhrk,Concept of the Heat Balance of the Transpiration-Cooled Heat Shield Experiment AKTIV on SHEFEX II,2009,"['H Böhrk', ' M Kuhn', ' H Weihs ']",,5.0,2022-03-04
Hannah Böhrk,Efficiency Analysis of a Two-Stage Hybrid Electric Thruster,2008,"['H Böhrk', ' M Auweter']",,5.0,2022-03-04
Hannah Böhrk,Arcjet stage investigation and inductive hydrogen heating in the TIHTUS engine,2005,"['H Böhrk', ' D Petkow', ' G Herdrich…']", … ,4.0,2022-03-04
Hannah Böhrk,10 Heat flux reduction by transpiration-cooling of CMCs for space applications,2017,['H Böhrk'], Adv Compos Mater: Properties and Applications …,2.0,2022-03-04
Hannah Böhrk,Heat Flux Measurement in the Two-Stage Hybrid Electric Thruster TIHTUS,2009,"['H Böhrk', ' T Rödiger', ' M Auweter']",,3.0,2022-03-04
Hannah Böhrk,[HTML][HTML] Characterisation of electrical resistance for CMC materials up to 2000 K,2018,"['T Stäbler', ' H Böhrk', ' H Voggenreiter']", Composites Part A: Applied Science …,2.0,2022-03-04
Hannah Böhrk,Time resolved quantitative imaging of charring in materials at temperatures above 1000 K,2016,"['H Böhrk', ' R Jemmali']", Review of Scientific Instruments,2.0,2022-03-04
Hannah Böhrk,Experimental and numerical analysis of SHEFEX-II,2013,"['T Barth', ' R Gehre', ' T Eggers', ' JM Schramm…']", New Results in …,2.0,2022-03-04
Hannah Böhrk,Concept of the Transpiration Cooling Experiment on SHEFEXII,2008,"['H Böhrk', ' M Kuhn', ' H Weihs ']",,7.0,2022-03-04
Hannah Böhrk,Experimental investigation of the plasma jet generated by ATTILA,2004,"['H Böhrk', ' M Auweter']",Kurtz,2.0,2022-03-04
Hannah Böhrk,Heat Balance of a Transpiration-Cooled Ceramic Combustion Chamber,2010,"['H Böhrk', ' A Herbertz', ' M Ortelt ']",,6.0,2022-03-04
Hannah Böhrk,Zur induktiven Nachheizung einer Überschallwasserstoffströmung,2009,['H Böhrk '],,5.0,2022-03-04
Hannah Böhrk,Characterisation of Electrical Resistance for CMC Materials up to 1200° C,2016,"['T Stäbler', ' H Böhrk', ' H Voggenreiter ']",,1.0,2022-03-04
Hannah Böhrk,Innovative Cooling for Rocket Combustion Chambers,2021,"['J Peichl', ' A Schwab', ' M Selzer', ' H Böhrk…']", … under High Thermal …,,2022-03-04
Hannah Böhrk,Design of a transpiration cooled sharp leading edge for SHEFEX III,2015,"['C Dittert', ' H Böhrk', ' H Elsässer ']",,3.0,2022-03-04
Hannah Böhrk,In-Situ Ablation Experiments of Cork-based and Carbon Phenolic Thermal Protection Materials in an X-Ray Synchrotron Facility,2018,"['I Sakraker', ' A Joshi', ' H Böhrk', ' D Haenschke…']", … and Heat Transfer …,,2022-03-04
Hannah Böhrk,The Sharp Leading Edge of SHEFEX II,2008,"['H Böhrk', ' T Laux', ' H Weihs ']",,2.0,2022-03-04
Hannah Böhrk,On Supersonic Hydrogen Heating: The TIHTUS Engine,,"['H Böhrk', ' M Auweter']",,,2022-03-04
Hannah Böhrk,Feasibility Study of Applicability of ATTILA to In-Space Propulsion,,"['H Böhrk', ' S Laure', ' M Auweter']",,,2022-03-04
Hannah Böhrk,A Furnace for Imaging of Charring in Materials under High Temperature,2016,['H Böhrk '],,,2022-03-04
Hannah Böhrk,Thermocouple Positioning for the of the Non-Integer System Identification Approach to HIFiRE-5 Fins,2011,"['S Löhle', ' H Böhrk', ' U Fuchs ']",,,2022-03-04
Hannah Böhrk,Extended Investigation of a New Circular Weave for C/C-SiC Applications,2012,"['H Böhrk', ' T Aliyev ']",,,2022-03-04
Hannah Böhrk,Design and numerical investigations of coupled Transpiration cooling experiments,2017,"['A Schwab', ' A Trübsbach', ' M Selzer', ' D Munk', ' H Böhrk… ']",,,2022-03-04
Hannah Böhrk,Elektrische Antriebe für die Raumfahrt,2008,"['H Leiter', ' D Bock', ' H Böhrk…']", Vakuum in Forschung …,,2022-03-04
Hannah Böhrk,REX-Free Flyer: Re-Entry to Earth Experiment-Machbarkeitsstudie,2010,"['H Böhrk', ' T Barth', ' I Dietlein', ' H Elsäßer', ' T Eggers… ']",,,2022-03-04
Hannah Böhrk,Heat Balance of the Transpiration-Cooled Heat Shield Experiment AKTiV,2009,"['H Böhrk', ' O Piol', ' M Kuhn ']",,,2022-03-04
Hannah Böhrk,Offene und geschlossene Porosität von keramischen Faserverbundwerkstoffen,2009,"['H Böhrk', ' A Wachter', ' R Mencke']",,,2022-03-04
Hannah Böhrk,Prozesseignung und Schubversuche an einem keramischen Faltkern,2012,"['H Böhrk', ' T Aliyev ']",,,2022-03-04
Hannah Böhrk,Ablation: Modelling and Evaluation Experiments,2016,['H Böhrk '],,,2022-03-04
Andrea Bosch,Microglial repopulation model reveals a robust homeostatic process for replacing CNS myeloid cells,2012,"['NH Varvel', ' SA Grathwohl', ' F Baumann…']", Proceedings of the …,234.0,2022-03-04
Andrea Bosch,Infiltrating monocytes promote brain inflammation and exacerbate neuronal damage after status epilepticus,2016,"['NH Varvel', ' JJ Neher', ' A Bosch…']", Proceedings of the …,211.0,2022-03-04
Andrea Bosch,Replacement of brain-resident myeloid cells does not alter cerebral amyloid-β deposition in mouse models of Alzheimer's disease,2015,"['NH Varvel', ' SA Grathwohl', ' K Degenhardt…']", Journal of Experimental …,75.0,2022-03-04
Andrea Bosch,Interactive Radio Instruction: Twenty-three years of improving education quality,1997,['A Bosch'], Washington,92.0,2022-03-04
Andrea Bosch,The role of agonist-induced activation and inhibition for the regulation of purinergic receptor expression in human platelets,2018,"['J Koessler', ' VN Trulley', ' A Bosch', ' K Weber…']", Thrombosis …,15.0,2022-03-04
Andrea Bosch,Electrocardiographic monitoring in children with chronic renal failure,1990,"['A Bosch', ' HE Ulmer', ' H Emil Keller', ' KE Bonzel…']", Pediatric …,21.0,2022-03-04
Andrea Bosch,Interactive radio instruction: An update from the field,2002,"['A Bosch', ' R Rhodes', ' S Kariuki']", Technologies for education …,11.0,2022-03-04
Andrea Bosch,"INA WORLD OF EXPLODING POSSIBILITIES IN DISTANCE LEARNING, DON'T FORGET ABOUT THE LIGHT BULB",2015,"['A Bosch', ' LH Toby', ' AR Alkhomsi']", Quarterly Review of Distance …,6.0,2022-03-04
Andrea Bosch,"Jugando en el Pidi: Active Learning, Early Child Development and Interactive Radio Instruction. Supporting Caregivers, Parents, and Young Children. LearnTech …",1995,"['A Bosch', ' C Crespo ']",,7.0,2022-03-04
Andrea Bosch,Sustainability and interactive radio instruction: why some projects last,2004,['A Bosch'], Adapting technology for school improvement: a global …,6.0,2022-03-04
Andrea Bosch,Uncovering Pathways for Girls' Education: Gender equity and early childhood development,2001,['A Bosch'], Development,5.0,2022-03-04
Andrea Bosch,Améliorer les possibilités d'apprentissage en Afrique,2002,"['P Murphy', ' S Anzalon', ' A Bosch…']", L'enseignement à …,14.0,2022-03-04
Andrea Bosch,Improving educational quality with interactive radio instruction: a toolkit for policymakers and planners,2005,"['S Anzalone', ' A Bosch ']",,4.0,2022-03-04
Andrea Bosch,Introducing learning technologies into Egyptian schools: Where there is demand there is a way,2009,['A Bosch'], Journal of Education for International Development,3.0,2022-03-04
Andrea Bosch,New Generation–Vorausschauend qualifizieren,2021,"['A Haupt', ' B Wendelstein', ' J Daly', ' D Jackson…']",,,2022-03-04
Andrea Bosch,[BOOK][B] Local interpretations of learning and development: The cultural production of theory and discourse in Cuba,2003,['AJ Bosch '],,1.0,2022-03-04
Andrea Bosch,"Caesarean Section. Guideline of the DGGG, OEGGG and SGGG (S3-Level, AWMF Registry No. 015/084, June 2020)",2021,"['F Louwen', ' U Wagner', ' M Abou']",,,2022-03-04
Andrea Bosch,Senegal-Participatory Local Development Project,,"['S Anzalone', ' A Bosch ']",,,2022-03-04
Andrea Bosch,environment impact assessment of Zonkwa dam,,"['S Anzalone', ' A Bosch ']",,,2022-03-04
Andrea Bosch,Visible service improvements facilitate reforms in town water supply: PRAGUAS in Ecuador,,"['S Anzalone', ' A Bosch ']",,,2022-03-04
Andrea Bosch,China-Liaoning and Shandong Technical and Vocational Education and Training Project: procurement plan,,"['S Anzalone', ' A Bosch ']",,,2022-03-04
Andrea Bosch,Computer-Assisted Instruction in Grenada: High-Tech Success and Sustainability against the Odds. LearnTech Case Study Series No. 3.,1994,['A Bosch '],,,2022-03-04
Andrea Bosch,Manual de manejo de herbicidas y plaguicidas,,"['S Anzalone', ' A Bosch ']",,,2022-03-04
Andrea Bosch,"Development Communication Report, 1993.",1993,['A Bosch'], Development Communication Report,,2022-03-04
Andrea Bosch,[BOOK][B] Den Kaiserschnitt vermeiden: Eine Analyse relevanter Faktoren,2020,['A Bosch '],,,2022-03-04
Andrea Bosch,"[HTML][HTML] Benefits, advantages, and challenges of dual degree programs and implications for the development of therapy science programs/Nutzen, Vorteile und …",2021,"['C Winkelmann', ' A Helmer']",Denzel,,2022-03-04
Andrea Bosch,Das Vertrauen in die normale Geburt ist die Grundhaltung im Hebammenkreißsaal,2020,"['A Bosch', ' MA Becker']", Die Hebamme,,2022-03-04
Andrea Bosch,Análisis Funcional de la Conducta Verbal del Terapeuta en el Tratamiento de un Caso de Ansiedad,2012,"['AL Bosch', ' R de Pascual Verdú']", Clínica y Salud,,2022-03-04
Andrea Bosch,"[BOOK][B] Erzählwerkstatt an der Grundschule Wilhelmsschule, Untertürkheim. Abschlussbericht",2014,['A Bosch '],,,2022-03-04
Jens Helge Bossmann,Kalkulationsverfahren zur Instandhaltungsbudgetierung gebäudetechnischer Anlagen öffentlicher Immobilienportfolien,2015,['JH Bossmann '],,1.0,2022-03-04
Jens Helge Bossmann,Kosten für das Betreiben von technischen Anlagen,2013,"['C Bahr', ' JH Bossmann']", Journal for Facility Management,,2022-03-04
Jutta Braun,Learning needs of patients with angina: an extension study.,1990,"['BA Karlik', ' A Yarcheski', ' J Braun', ' M Wu']", The Journal of …,40.0,2022-03-04
Jutta Braun,Football history: a German perspective on current research fields,2015,['J Braun'], Historical Social Research/Historische Sozialforschung,5.0,2022-03-04
Jutta Braun,The People's Sport? Popular Sport and Fans in the Later Years of the German Democratic Republic,2009,['J Braun'], German History,13.0,2022-03-04
Jutta Braun,'Tracksuit Traitors': Eastern German Top Athletes on the Run,2014,"['J Braun', ' R Wiese']", The International Journal of the History of Sport,6.0,2022-03-04
Jutta Braun,""" Very nice, the enemies are gone!""—Coming to Terms With GDR Sports Since 1989/90",2007,['J Braun'], Historical Social Research/Historische Sozialforschung,5.0,2022-03-04
Jutta Braun,DDR-Fußball und gesamtdeutsche Identität im Kalten Krieg,2005,"['J Braun', ' R Wiese']", Historical Social Research/Historische Sozialforschung,15.0,2022-03-04
Jutta Braun,[BOOK][B] Sportstadt Berlin im Kalten Krieg: Prestigekämpfe und Systemwettstreit,2006,"['J Braun', ' HJ Teichler ']",,10.0,2022-03-04
Jutta Braun,[BOOK][B] Geteilte Geschichte: Ost-und Westdeutschland 1970–2000,2015,"['R Ahrens', ' J Braun', ' C Classen', ' J Danyel', ' E Droit… ']",,5.0,2022-03-04
Jutta Braun,Sportstadt Berlin im Kalten Krieg,2007,"['J Braun', ' HJ Teichler']", Prestigekämpfe und Systemwettstreit. Berlin,6.0,2022-03-04
Jutta Braun,[BOOK][B] Porsche: vom Konstruktionsbüro zur Weltmarke,2017,"['W Pyta', ' N Havemann', ' J Braun ']",,3.0,2022-03-04
Jutta Braun,Football and political freedom: the historical experience of divided Germany,2008,['J Braun '],,1.0,2022-03-04
Jutta Braun,Politische Medizin. Ideologie und Gesundheitsökonomie im SED-Staat der 1950er-und 1960er-Jahre,2020,['J Braun'], Zeithistorische Forschungen–Studies in …,1.0,2022-03-04
Jutta Braun,[BOOK][B] Die Hinterbühne politischer Strafjustiz in den frühen Jahren der SBZ/DDR,1999,"['J Braun', ' N Klawitter', ' F Werkentin ']",,2.0,2022-03-04
Jutta Braun,Altlastenbereich,2013,['JM Braun'],,,2022-03-04
Jutta Braun,Too posh—or too busy?,2005,"['SB HEATWOLE', ' PG BATSON', ' BP REYNOLDS…']", …,,2022-03-04
Jutta Braun,A New Research Agenda in Political Theory,,['J Braun '],,,2022-03-04
Jutta Braun,Die Realität der Fiktion. Historische Erfahrung und Futurologie im Werk von Stanisław Lem–zum 100. Geburtstag,2021,['J Braun'], Zeithistorische Forschungen–Studies in …,,2022-03-04
Jutta Braun,fußball und politische freiheit–historische erfahrungen des geteilten deutschland,2008,['J Braun '],,1.0,2022-03-04
Jutta Braun,30 Jahre deutsche Sporteinheit: Von der Epochenzäsur 1989/90 zur geteilten Erinnerung,2020,['J Braun'], STADION,,2022-03-04
Jutta Braun,Vom Troublemaker zum Integrationsstifter? Fußball und Gewaltprävention in Deutschland vor und nach 1989,2018,['J Braun'], Zeithistorische Forschungen,,2022-03-04
Jutta Braun,Arzneistoffabsorption in Caco-2-TC7-Zellen: Ibuprofen und der Monocarboxylat-Transporter 1 (MCT1),2007,['JS Braun '],,,2022-03-04
Jutta Braun,Umsetzung der Bundesgesetzgebung auf die kommunale Ebene—Fallbeispiele aus dem Altlastenbereich,1999,['JM Braun'],,,2022-03-04
Jutta Braun,Zeitgeschichte des Sports. Der Arbeitsbereich Zeitgeschichte des Sports der Universität Potsdam,2007,['J Braun'], Historical Social Research/Historische Sozialforschung,,2022-03-04
Jutta Braun,Rezensionen online 727,,"['J Braun', ' HJ Teichler', ' SB im Kalten Krieg ']",,,2022-03-04
Ulrich Bucher,Impact of sepsis on neurodevelopmental outcome in a Swiss National Cohort of extremely premature infants,2011,"['LJ Schlapbach', ' M Aebischer', ' M Adams…']", …,351.0,2022-03-04
Ulrich Bucher,"[HTML][HTML] Population based trends in mortality, morbidity and treatment for very preterm-and very low birth weight infants over 12 years",2012,"['C Rüegger', ' M Hegglin', ' M Adams', ' HU Bucher']", BMC pediatrics,172.0,2022-03-04
Ulrich Bucher,"The influence of the timing of cord clamping on postnatal cerebral oxygenation in preterm neonates: a randomized, controlled trial",2007,"['O Baenziger', ' F Stolkin', ' M Keel', ' K von Siebenthal…']", …,164.0,2022-03-04
Ulrich Bucher,An approach to using recombinant erythropoietin for neuroprotection in very preterm infants,2008,"['JC Fauchere', ' C Dame', ' R Vonthein', ' B Koller', ' S Arri…']", …,172.0,2022-03-04
Ulrich Bucher,Association between early administration of high-dose erythropoietin in preterm infants and brain MRI abnormality at term-equivalent age,2014,"['RHV Leuchter', ' L Gui', ' A Poncet', ' C Hagmann…']", Jama,134.0,2022-03-04
Ulrich Bucher,[HTML][HTML] Outcome at two years of age in a Swiss national cohort of extremely preterm infants born between 2000 and 2008,2012,"['LJ Schlapbach', ' M Adams', ' E Proietti…']", BMC …,136.0,2022-03-04
Ulrich Bucher,"Sucrose reduces pain reaction to heel lancing in preterm infants: a placebo-controlled, randomized and masked study",1995,"['HU Bucher', ' KV Siebenthal', ' M Keel', ' M Wolf', ' G Duc']", Pediatric research,189.0,2022-03-04
Ulrich Bucher,Grief and post-traumatic growth in parents 2–6 years after the death of their extremely premature baby,2007,"['S Büchi', ' H Mörgeli', ' U Schnyder', ' J Jenewein…']", Psychotherapy and …,129.0,2022-03-04
Ulrich Bucher,[HTML][HTML] Creative music therapy to promote brain function and brain structure in preterm infants: A randomized controlled pilot study,2020,"['FB Haslbeck', ' A Jakab', ' U Held', ' D Bassler…']", NeuroImage: Clinical,44.0,2022-03-04
Ulrich Bucher,Effect of early prophylactic high-dose recombinant human erythropoietin in very preterm infants on neurodevelopmental outcome at 2 years: a randomized clinical trial,2016,"['G Natalucci', ' B Latal', ' B Koller', ' C Rüegger', ' B Sick…']", Jama,94.0,2022-03-04
Ulrich Bucher,Finnegan neonatal abstinence scoring system: normal values for first 3 days and weeks 5–6 in non‐addicted infants,2010,"['U Zimmermann‐Baer', ' U Nötzli', ' K Rentsch…']", …,99.0,2022-03-04
Ulrich Bucher,Increasing incidence of respiratory distress in neonates,2007,"['J Ersch', ' M Roth‐Kleiner', ' P Baeckert…']", Acta …,99.0,2022-03-04
Ulrich Bucher,Shared or discordant grief in couples 2–6 years after the death of their premature baby: Effects on suffering and posttraumatic growth,2009,"['S Büchi', ' H Mörgeli', ' U Schnyder', ' J Jenewein', ' A Glaser…']", Psychosomatics,84.0,2022-03-04
Ulrich Bucher,Safety of early high-dose recombinant erythropoietin for neuroprotection in very preterm infants,2015,"['JC Fauchère', ' BM Koller', ' A Tschopp', ' C Dame…']", The Journal of …,77.0,2022-03-04
Ulrich Bucher,Impact of chorioamnionitis and preeclampsia on neurodevelopmental outcome in preterm infants below 32 weeks gestational age,2010,"['LJ Schlapbach', ' J Ersch', ' M Adams', ' V Bernet…']", Acta …,74.0,2022-03-04
Ulrich Bucher,Methadone maintenance program in pregnancy in a Swiss perinatal center (II): neonatal outcome and social resources,2005,"['R Arlettaz', ' M Kashiwagi', ' S Das']",,99.0,2022-03-04
Ulrich Bucher,High copeptin concentrations in umbilical cord blood after vaginal delivery and birth acidosis,2010,"['S Wellmann', ' J Benzing', ' G Cippa…']", The Journal of …,70.0,2022-03-04
Ulrich Bucher,Cycled light exposure reduces fussing and crying in very preterm infants,2012,"['C Guyer', ' R Huber', ' J Fontijn', ' HU Bucher', ' H Nicolai…']", …,63.0,2022-03-04
Ulrich Bucher,[HTML][HTML] Decision-making at the limit of viability: differing perceptions and opinions between neonatal physicians and nurses,2018,"['HU Bucher', ' SD Klein', ' MJ Hendriks', ' R Baumann']",,37.0,2022-03-04
Ulrich Bucher,Prevention of hypernatraemic dehydration in breastfed newborn infants by daily weighing,2009,"['G Konetzny', ' HU Bucher', ' R Arlettaz']", European journal of pediatrics,62.0,2022-03-04
Ulrich Bucher,Near-infrared spectroscopy measurements of cerebral oxygenation in newborns during immediate postnatal adaptation,2010,"['JC Fauchère', ' G Schulz', ' D Haensse', ' E Keller…']", The Journal of …,64.0,2022-03-04
Ulrich Bucher,Detection of hyperbilirubinaemia in jaundiced full-term neonates by eye or by bilirubinometer?,2004,"['P Szabo', ' M Wolf', ' HU Bucher', ' JC Fauchere…']", European journal of …,69.0,2022-03-04
Ulrich Bucher,Variability of very low birth weight infant outcome and practice in Swiss and US neonatal units,2018,"['M Adams', ' D Bassler', ' HU Bucher', ' M Roth']",,29.0,2022-03-04
Ulrich Bucher,Hemodynamic response to visual stimulation in newborn infants using functional near‐infrared spectroscopy,2008,"['T Karen', ' G Morren', ' D Haensse…']", Human brain …,71.0,2022-03-04
Ulrich Bucher,"[HTML][HTML] Creative music therapy to promote brain structure, function, and neurobehavioral outcomes in preterm infants: a randomized controlled pilot trial protocol",2017,"['FB Haslbeck', ' HU Bucher', ' D Bassler…']", Pilot and feasibility …,34.0,2022-03-04
Ulrich Bucher,Malposition of feeding tubes in neonates: is it an issue?,2009,"['D Quandt', ' T Schraner', ' HU Bucher…']", Journal of pediatric …,52.0,2022-03-04
Ulrich Bucher,[HTML][HTML] Patterns of paediatric end-of-life care: a chart review across different care settings in Switzerland,2018,"['K Zimmermann', ' E Cignacco', ' S Engberg', ' AS Ramelet…']", BMC pediatrics,26.0,2022-03-04
Ulrich Bucher,End‐of‐life decisions in delivery room and neonatal intensive care unit,2005,"['R Arlettaz', ' D Mieth', ' HU BUCHER', ' G Duc…']", Acta …,67.0,2022-03-04
Ulrich Bucher,Population-based study of bronchopulmonary dysplasia in very low birth weight infants in Switzerland,2005,"['J Hentschel', ' TM Berger', ' A Tschopp', ' M Müller…']", European journal of …,69.0,2022-03-04
Ulrich Bucher,Very preterm infants show earlier emergence of 24-hour sleep–wake rhythms compared to term infants,2015,"['C Guyer', ' R Huber', ' J Fontijn', ' HU Bucher…']", Early human …,39.0,2022-03-04
Ulrich Bucher,"Cerebral blood flow in preterm infants affected by sex, mechanical ventilation, and intrauterine growth",1994,"['O Baenziger', ' JL Jaggi', ' AC Mueller', ' CG Morales…']", Pediatric …,58.0,2022-03-04
Ulrich Bucher,Plasma copeptin in preterm infants: a highly sensitive marker of fetal and neonatal stress,2011,"['J Benzing', ' S Wellmann', ' F Achini…']", The Journal of …,46.0,2022-03-04
Ulrich Bucher,Continuous noninvasive measurement of cerebral arterial and venous oxygen saturation at the bedside in mechanically ventilated neonates,1997,"['M Wolf', ' G Duc', ' M Keel', ' P Niederer…']", Critical care …,72.0,2022-03-04
Ulrich Bucher,Sources of distress for physicians and nurses working in Swiss neonatal intensive care units,2017,"['SD Klein', ' HU Bucher', ' MJ Hendriks…']", Swiss medical …,29.0,2022-03-04
Ulrich Bucher,A framework for ethical decision making in neonatal intensive care,2005,"['…', ' M Maffezzoni', ' H Ulrich Bucher']", Acta …,52.0,2022-03-04
Ulrich Bucher,In vivo precision assessment of a near-infrared spectroscopy-based tissue oximeter (OxyPrem v1. 3) in neonates considering systemic hemodynamic fluctuations,2018,"['S Kleiser', ' D Ostojic', ' N Nasseri', ' H Isler…']", … of biomedical optics,22.0,2022-03-04
Ulrich Bucher,Delayed cyclic activity development on early amplitude-integrated EEG in the preterm infant with brain lesions,2013,"['G Natalucci', ' V Rousson', ' HU Bucher', ' V Bernet…']", Neonatology,41.0,2022-03-04
Ulrich Bucher,[HTML][HTML] Comparison of a new transcutaneous bilirubinometer (Bilimed®) with serum bilirubin measurements in preterm and full-term infants,2009,"['T Karen', ' HU Bucher', ' JC Fauchère']", BMC pediatrics,40.0,2022-03-04
Ulrich Bucher,New multichannel near infrared spectrophotometry system for functional studies of the brain in adults and neonates,2005,"['D Haensse', ' P Szabo', ' D Brown', ' JC Fauchère…']", Optics …,58.0,2022-03-04
Ulrich Bucher,Hyperoxemia in newborn infants: detection by pulse oximetry,1989,"['HU Bucher', ' S Fanconi', ' P Baeckert', ' G Duc']", Pediatrics,80.0,2022-03-04
Ulrich Bucher,[HTML][HTML] Network based statistics reveals trophic and neuroprotective effect of early high dose erythropoetin on brain connectivity in very preterm infants,2019,"['A Jakab', ' C Ruegger', ' HU Bucher', ' M Makki', ' PS Huppi…']", NeuroImage: Clinical,17.0,2022-03-04
Ulrich Bucher,Health‐related quality of life of former very preterm infants in adulthood,2012,"['M Baumgardt', ' HU Bucher', ' R Arlettaz Mieth…']", Acta …,41.0,2022-03-04
Ulrich Bucher,"[HTML][HTML] Minimally invasive, imaging guided virtual autopsy compared to conventional autopsy in foetal, newborn and infant cases: study protocol for the paediatric …",2014,"['CM Rüegger', ' C Bartsch', ' RM Martinez', ' S Ross…']", BMC pediatrics,34.0,2022-03-04
Ulrich Bucher,"Creative music therapy with premature infants and their parents: A mixed-method pilot study on parents' anxiety, stress and depressive symptoms and parent–infant …",2021,"['SM Kehl', ' L Marca']",Ghaemmaghami,16.0,2022-03-04
Ulrich Bucher,Short courses of dual‐strain probiotics appear to be effective in reducing necrotising enterocolitis,2016,"['F Guthmann', ' RP Arlettaz Mieth', ' HU Bucher…']", Acta …,27.0,2022-03-04
Ulrich Bucher,Improved monitoring of preterm infants by fuzzy logic,1996,"['M Wolf', ' M Keel', ' K von Siebenthal…']", … and health care,46.0,2022-03-04
Ulrich Bucher,Population based report on health related quality of life in adolescents born very preterm,2017,"['G Natalucci', ' HU Bucher', ' M Von Rhein', ' CB Tolsa…']", Early human …,22.0,2022-03-04
Ulrich Bucher,17-Hydroxyprogesterone in premature infants as a marker of intrauterine stress,2008,"['J Ersch', ' E Beinder', ' T Stallmach', ' HU Bucher…']", Journal of perinatal …,35.0,2022-03-04
Ulrich Bucher,Fidgety movements in infants born very preterm: predictive value for cerebral palsy in a clinical multicentre setting,2017,"['AN Datta', ' MA Furrer', ' I Bernhardt…']", … Medicine & Child …,23.0,2022-03-04
Ulrich Bucher,Early enteral feeding in conservatively managed stage II necrotizing enterocolitis is associated with a reduced risk of catheter-related sepsis,2009,"['B Brotschi', ' O Baenziger', ' B Frey', ' HU Bucher', ' J Ersch ']",,32.0,2022-03-04
