AUTHOR_NAME,PUB_TITLE,PUB_YEAR,PUB_AUTHORS,PUB_PUBLISHER,PUB_CITATIONS,UPDATED
Ulrich Bucher,The influence of a clear layer on near-infrared spectrophotometry measurements using a liquid neonatal head phantom,1999,"['M Wolf', ' M Keel', ' V Dietz', ' K von Siebenthal…']", Physics in Medicine …,49.0,2022-03-04
Ulrich Bucher,Slow blood sampling from an umbilical artery catheter prevents a decrease in cerebral oxygenation in the preterm newborn,2003,"['G Schulz', ' E Keller', ' D Haensse', ' R Arlettaz…']", …,39.0,2022-03-04
Ulrich Bucher,Plasma C-terminal pro-endothelin-1 and the natriuretic pro-peptides NT-proBNP and MR-proANP in very preterm infants with patent ductus arteriosus,2012,"['J Letzner', ' F Berger', ' S Schwabe', ' J Benzing…']", Neonatology,27.0,2022-03-04
Ulrich Bucher,"[HTML][HTML] Treatment of opioid withdrawal in neonates with morphine, phenobarbital, or chlorpromazine: a randomized double-blind trial",2020,"['U Zimmermann', ' C Rudin', ' A Duò', ' L Held…']", European journal of …,9.0,2022-03-04
Ulrich Bucher,Reducing false alarm rates in neonatal intensive care: a new machine learning approach,2020,"['D Ostojic', ' S Guglielmini', ' V Moser', ' JC Fauchère…']", Oxygen Transport to …,8.0,2022-03-04
Ulrich Bucher,"Cyclical fluctuations in blood pressure, heart rate and cerebral blood volume in preterm infants",1999,"['K von Siebenthal', ' J Beran', ' M Wolf', ' M Keel', ' V Dietz…']", Brain and …,39.0,2022-03-04
Ulrich Bucher,[HTML][HTML] Impact of perinatal factors on continuous early monitoring of brain electrocortical activity in very preterm newborns by amplitude-integrated EEG,2014,"['G Natalucci', ' C Hagmann', ' V Bernet', ' HU Bucher…']", Pediatric …,21.0,2022-03-04
Ulrich Bucher,Can near infrared spectroscopy of the liver monitor tissue oxygenation?,2000,"['J Teller', ' M Wolf', ' M Keel', ' HU Bucher…']", European journal of …,33.0,2022-03-04
Ulrich Bucher,Rectal paracetamol in newborn infants after assisted vaginal delivery may increase pain response,2013,"['EM Tinner', ' I Hoesli', ' K Jost', ' N Schöbi', ' YU Megged…']", The Journal of …,24.0,2022-03-04
Ulrich Bucher,[HTML][HTML] Pulse oximetry in the newborn: is the left hand pre-or post-ductal?,2010,"['C Rüegger', ' HU Bucher', ' RA Mieth']", BMC pediatrics,26.0,2022-03-04
Ulrich Bucher,Comparison of three methods to measure absolute cerebral hemoglobin concentration in neonates by near infrared spectrophotometry,2002,"['M Wolf', ' K von Siebenthal', ' M Keel…']", Journal of …,35.0,2022-03-04
Ulrich Bucher,Erythropoietin for the repair of cerebral injury in very preterm infants (EpoRepair),2015,"['CM Rüegger', ' CF Hagmann', ' C Bührer', ' L Held…']", Neonatology,17.0,2022-03-04
Ulrich Bucher,[HTML][HTML] Plasma midregional proadrenomedullin in newborn infants: impact of prematurity and perinatal infection,2012,"['D Admaty', ' J Benzing', ' T Burkhardt', ' O Lapaire…']", Pediatric …,19.0,2022-03-04
Ulrich Bucher,Sleep state changes associated with cerebral blood volume changes in healthy term newborn infants,1998,"['DM Münger', ' HU Bucher', ' G Duc']", Early human development,29.0,2022-03-04
Ulrich Bucher,[HTML][HTML] Functional brain maturation assessed during early life correlates with anatomical brain maturation at term-equivalent age in preterm infants,2013,"['G Natalucci', ' RHV Leuchter', ' HU Bucher', ' B Latal…']", Pediatric …,20.0,2022-03-04
Ulrich Bucher,"Impact of central, obstructive and mixed apnea on cerebral hemodynamics in preterm infants",1996,"['OG Jenni', ' M Wolf', ' M Hengartner', ' K von Siebenthal…']", Neonatology,38.0,2022-03-04
Ulrich Bucher,Swiss neonatal caregivers express diverging views on parental involvement in shared decision‐making for extremely premature infants,2021,"['JC Fauchère', ' SD Klein', ' MJ Hendriks…']", Acta …,2.0,2022-03-04
Ulrich Bucher,Oxygen extraction index measured by near infrared spectroscopy-a parameter for monitoring tissue oxygenation?,2009,"['O Baenziger', ' M Keel', ' HU Bucher', ' M Wolf']", Oxygen Transport to Tissue …,18.0,2022-03-04
Ulrich Bucher,Feeding problems in preterm infants of preeclamptic mothers,2008,"['J Ersch', ' O Baenziger', ' V Bernet…']", Journal of paediatrics …,21.0,2022-03-04
Ulrich Bucher,"Triplets and quadruplets in Switzerland: comparison with singletons, and evolution over the last decade",2003,"['R Arlettaz', ' E Paraskevopoulos', ' HU Bucher ']",,24.0,2022-03-04
Ulrich Bucher,[HTML][HTML] Creative Music Therapy and Neurodevelopmental Outcomes in Pre-term Infants at 2 Years: A Randomized Controlled Pilot Trial,2021,"['FB Haslbeck', ' HU Bucher', ' D Bassler…']", Frontiers in …,,2022-03-04
Ulrich Bucher,[HTML][HTML] Transcutaneously measured near-infrared spectroscopic liver tissue oxygenation does not correlate with hepatic venous oxygenation in children,2002,"['M Weiss', ' G Schulz', ' M Fasnacht', ' C Balmer…']", Canadian Journal of …,24.0,2022-03-04
Ulrich Bucher,[HTML][HTML] Changes in cerebral oxygenation during early postnatal adaptation in newborns delivered by vacuum extraction measured by near-infrared spectroscopy,2014,"['T Karen', ' M Wolf', ' R Nef', ' D Haensse', ' HU Bucher…']", BMC pediatrics,16.0,2022-03-04
Ulrich Bucher,CO2 reactivity of the cerebral hemoglobin concentration in healthy term newborns measured by near infrared spectrophotometry,1999,"['V Dietz', ' M Wolf', ' M Keel', ' K Siebenthal', ' O Baenziger…']", Neonatology,22.0,2022-03-04
Ulrich Bucher,[HTML][HTML] Retrospective cohort study of all deaths among infants born between 22 and 27 completed weeks of gestation in Switzerland over a 3-year period,2017,"['TM Berger', ' MA Steurer', ' HU Bucher', ' JC Fauchère…']", BMJ open,12.0,2022-03-04
Ulrich Bucher,Exploring societal solidarity in the context of extreme prematurity,2017,"['MJ Hendriks', ' HU Bucher', ' SD Klein', ' JC Streuli…']", Swiss Medical …,10.0,2022-03-04
Ulrich Bucher,Higher multiple births in Switzerland: neonatal outcome and evolution over the last 20 years,2011,"['R Arlettaz', ' S Ersfeld', ' N Douchet', ' S Wellmann…']", Swiss Medical …,14.0,2022-03-04
Ulrich Bucher,Music Is Life—Follow-Up Qualitative Study on Parental Experiences of Creative Music Therapy in the Neonatal Period,2021,"['FB Haslbeck', ' L Schmidli', ' HU Bucher…']", International Journal of …,1.0,2022-03-04
Ulrich Bucher,Effect of Early Recombinant Human Erythropoietin on Neurodevelopmental Outcomes at Age 5 Years—Reply,2021,"['G Natalucci', ' HU Bucher', ' JC Fauchère']", JAMA,,2022-03-04
Ulrich Bucher,Liveborn and stillborn very low birthweight infants in Switzerland: comparison between hospital based birth registers and the national birth register.,2005,"['M Müller', ' G Drack', ' C Schindler', ' HU Bucher']", Swiss Medical Weekly,18.0,2022-03-04
Ulrich Bucher,Attitudes towards decisions about extremely premature infants differed between Swiss linguistic regions in population‐based study,2017,"['MJ Hendriks', ' SD Klein', ' HU Bucher…']", Acta …,10.0,2022-03-04
Ulrich Bucher,Body proportionality in growth-retarded VLBW infants,1997,"['RH Largo', ' K von Siebenthal', ' K Etter', ' C Morales… ']",,19.0,2022-03-04
Ulrich Bucher,Benign neonatal sleep myoclonus in newborn infants of opioid dependent mothers,2009,"['K Held‐Egli', ' C Rüegger', ' S Das‐Kundu…']", Acta …,12.0,2022-03-04
Ulrich Bucher,Regional differences of cerebral blood flow in the preterm infant,1995,"['O Baenziger', ' JL Jaggi', ' AC Mueller', ' CG Morales…']", European journal of …,13.0,2022-03-04
Ulrich Bucher,Impaired chemical coupling of cerebral blood flow is compatible with intact neurological outcome in neonates with perinatal risk factors,1999,"['O Baenziger', ' M Moenkhoff', ' CG Morales', ' K Waldvogel…']", Neonatology,13.0,2022-03-04
Ulrich Bucher,Testing near-infrared spectrophotometry using a liquid neonatal head phantom,1998,"['M Wolf', ' O Baenziger', ' M Keel', ' V Dietz…']", … in Tissues IV,11.0,2022-03-04
Ulrich Bucher,Your diagnosis? Umbilical cord tumor,2007,"['…', ' J Wisser', ' R Weil', ' T Stallmach', ' H Ulrich Bucher']", European journal of …,8.0,2022-03-04
Ulrich Bucher,Overlapping borders: limit of viability and late terminations of pregnancy-a retrospective multicentre observational study,2020,"['F Berger', ' HU Bucher', ' JC Fauchère', ' S Schulzke…']", Swiss Medical …,2.0,2022-03-04
Ulrich Bucher,Acceleration of lung maturation in a human fetus following maternal isotretinoin intake,2006,"['JC Fauchère', ' J Ersch', ' DA Grant', ' R Zimmermann…']", Neonatology,7.0,2022-03-04
Ulrich Bucher,[HTML][HTML] Comparison of three different methods for risk adjustment in neonatal medicine,2017,"['M Adams', ' J Braun', ' HU Bucher', ' MA Puhan', ' D Bassler…']", BMC pediatrics,5.0,2022-03-04
