AUTHOR_NAME,PUB_TITLE,PUB_YEAR,PUB_AUTHORS,PUB_TYPE,PUB_PUBLISHER,PUB_ISBN,PUB_DOI,PUB_CITATIONS,JOU_RATING_VHB,JOU_RATING_SCIMAGO,UPDATED
Stefan Fischer,Towards information centric application development for wireless sensor networks,2004.0,"['C Buschmann', ' S Fischer', ' J Koberstein', ' N Luttenberger']",,Proceedings of the System Support for Ubiquitous Computing Workshop (UbiSys …,,,16.0,,,2022-03-19
Stefan Fischer,Middleware for swarm-like collections of devices,2003.0,"['C Buschmann', ' S Fischer', ' N Luttenberger', ' F Reuter']",,IEEE Pervasive Computing Magazine,,,16.0,k.R.,101.0,2022-03-19
Stefan Fischer,Generality challenges and approaches in wsns,2009.0,"['F Tirkawi', ' S Fischer']",,International Journal of Communications,,,15.0,B,195.0,2022-03-19
Stefan Fischer,Making wireless sensor network simulators cooperate,2010.0,"['Q Li', ' F Österlind', ' T Voigt', ' S Fischer', ' D Pfisterer']",,Proceedings of the ACM workshop on Performance evaluation of wireless ad …,,,14.0,,118.0,2022-03-19
Stefan Fischer,Koordinatenfreies Lokationsbewusstsein (Localization without Coordinates),2005.0,"['SP Fekete', ' A Kröller', ' C Buschmann', ' S Fischer', ' D Pfisterer']",,it-Information Technology,,,14.0,,4.0,2022-03-19
Stefan Fischer,A multi-agent architecture for cooperative quality of service management,1998.0,"['A Hafid', ' S Fischer']",,Management of Multimedia Networks and Services,,,14.0,k.R.,27.0,2022-03-19
Stefan Fischer,A new approach for distributing Estelle specifications,1995.0,"['E Lallet', ' S Fischer', ' JF Verdier']",,International Conference on Formal Techniques for Distributed Objects …,,,14.0,,,2022-03-19
Stefan Fischer,Short paper: Collaboration between VANET applications based on open standards,2013.0,"['S Ebers', ' H Hellbück', ' D Pfisterer', ' S Fischer']",,IEEE vehicular networking conference,,,12.0,,116.0,2022-03-19
Stefan Fischer,Empowered by wireless communication: Distributed methods for self-organizing traffic collectives,2010.0,"['SP Fekete', ' C Schmidt', ' A Wegener', ' H Hellbrück', ' S Fischer']",,ACM Transactions on Autonomous and Adaptive Systems (TAAS),,,12.0,k.R.,84.0,2022-03-19
Stefan Fischer,Quality of service mapping in distributed multimedia systems,1995.0,"['S Fischer', ' R Keller']",,In Proceedings of the IEEE International Conference on Multimedia Networking …,,,12.0,B,279.0,2022-03-19
Stefan Fischer,Europe's mission in next-generation networking with special emphasis on the German-lab project,2016.0,"['P Müeller', ' S Fischer']",,,,,11.0,,,2022-03-19
Stefan Fischer,An approach to integrate distributed systems of medical devices in high acuity environments,2014.0,"['D Gregorczyk', ' S Fischer', ' T Busshaus', ' S Schlichting', ' S Pöhlsen']",,Workshop on Medical Cyber-Physical Systems,,,11.0,,14.0,2022-03-19
Stefan Fischer,Methods for Improving the Flow of Traffic,2011.0,"['SP Fekete', ' B Hendriks', ' C Tessars', ' A Wegener', ' H Hellbrück', ' S Fischer', ' ...']",,Organic Computing—A Paradigm Shift for Complex Systems,,,11.0,,,2022-03-19
Stefan Fischer,CUPID-communication pattern informed duty cycling in sensor networks,2010.0,"['D Krüger', ' D Pfisterer', ' S Fischer']",,Fifth International Conference on Systems and Networks Communications …,,,11.0,,123.0,2022-03-19
Stefan Fischer,Privacy concerns in a remote monitoring and social networking platform for assisted living,2010.0,"['P Rothenpieler', ' C Becker', ' S Fischer']",,IFIP PrimeLife International Summer School on Privacy and Identity …,,,11.0,,,2022-03-19
Stefan Fischer,Designing a Decentralized Traffic Information System—AutoNomos,2009.0,"['A Wegener', ' H Hellbrück', ' S Fischer', ' B Hendriks', ' C Schmidt', ' SP Fekete']",,Kommunikation in Verteilten Systemen (KiVS),,,11.0,,,2022-03-19
Stefan Fischer,"Java Tools: Using XML, EJB, Corba, Servlets and SOAP",2002.0,"['A Eberhart', ' S Fischer']",,Wiley,,,11.0,,,2022-03-19
Stefan Fischer,Netzwerkprogrammierung unter LINUX und UNIX,1999.0,"['S Fischer', ' W Müller']",,Hanser,,,11.0,,,2022-03-19
Stefan Fischer,QoS management: a model-based approach,1998.0,"['S Fischer', ' H De Meer']",,Proceedings. Sixth International Symposium on Modeling,,,11.0,,123.0,2022-03-19
Stefan Fischer,Hardware/software co-design of communication protocols,1996.0,"['S Fischer', ' J Wytrebowicz', ' S Budkowski']",,Proceedings of EUROMICRO Euromicro Conference. Beyond,,,11.0,,,2022-03-19
Stefan Fischer,On the suitability of Estelle for multimedia systems,1995.0,['S Fischer'],,International Conference on Protocol Specification,,,11.0,,122.0,2022-03-19
Stefan Fischer,GRAPE-Gradient based routing for all purpose,2007.0,"['M Lipphardt', ' H Hellbruck', ' A Wegener', ' S Fischer']",,IEEE International Conference on Mobile Adhoc and Sensor Systems,,,10.0,,123.0,2022-03-19
Stefan Fischer,Intranet: Das Internet im Unternehmen,1997.0,"['S Fischer', ' W Müller']",,Hanser,,,10.0,,,2022-03-19
Stefan Fischer,Efficient configuration of protocol software for multiprocessors,1995.0,"['S Fischer', ' W Effelsberg']",,International Conference on High Performance Networking,,,10.0,,56.0,2022-03-19
Stefan Fischer,A Critical Review of Surveys Emphasizing on Routing in Wireless Sensor Networks—An Anatomization under General Survey Design Framework,2017.0,"['W Rehan', ' S Fischer', ' M Rehan']",,,,,9.0,,,2022-03-19
Stefan Fischer,Critical Infrastructure Surveillance Using SecureWireless Sensor Networks,2015.0,"['M Niedermeier', ' X He', ' H de Meer', ' C Buschmann', ' K Hartmann', ' ...']",,,,,9.0,,,2022-03-19
Stefan Fischer,Towards service-oriented architectures,2007.0,"['S Fischer', ' C Werner']",,Semantic Web Services,,,9.0,,45.0,2022-03-19
Stefan Fischer,SpyGlass: taking a closer look at sensor networks,2004.0,"['C Buschmann', ' D Pfisterer', ' S Fischer', ' SP Fekete', ' A Kröller']",,Proceedings of the international conference on Embedded networked sensor …,,,9.0,C,279.0,2022-03-19
Stefan Fischer,Grundlagen eines Kalkulationsmodells für Blended Learning Kurse,2003.0,"['M Gutbrod', ' HW Jung', ' S Fischer']",,DeLFI,,,9.0,,,2022-03-19
Stefan Fischer,Decision support for cooperative QoS management,1998.0,"['S Fischer', ' H de Meer']",,Sixth International Workshop on Quality of Service No …,,,9.0,,,2022-03-19
Stefan Fischer,Function centric networking: an approach for addressing in In-Body nano networks,2016.0,"['M Stelzner', ' F Dressler', ' S Fischer']",,,,,8.0,,,2022-03-19
Stefan Fischer,Poster: Adapter framework for VANET simulators,2014.0,"['S Ebers', ' S Fischer']",,IEEE Vehicular Networking Conference (VNC),,,8.0,,116.0,2022-03-19
Stefan Fischer,AutoCast: A General-Purpose Data Dissemination Protocol and its Application in Vehicular Networks.,2008.0,"['H Hellbrück', ' A Wegener', ' S Fischer']",,Adhoc & Sensor Wireless Networks,,,8.0,,89.0,2022-03-19
Stefan Fischer,Remote interaction tool for wireless sensor networks,2008.0,"['F Tirkawi', ' S Fischer']",,International Symposium on Wireless Pervasive Computing,,,8.0,,,2022-03-19
Stefan Fischer,Network Monitoring with Asynchronous Notifications in Web Service Environments,2007.0,"['T Klie', ' F Müller', ' S Fischer']",,Communication in Distributed ITG/GI Symposium,,,8.0,,,2022-03-19
Stefan Fischer,Advanced data compression techniques for SOAP web services,2007.0,"['C Werner', ' C Buschmann', ' S Fischer']",,Modern Technologies in Web Services Research,,,8.0,,,2022-03-19
Michael Streich,"Green Energy and Green Economy Act, 2009: A Fit-ing Policy for North America",2010.0,['ME Streich'],, Hous. J. Int'l L.,,,11.0,,,2022-03-19
Michael Streich,Der Preis-Qualitäts-Zusammenhang im Spiegel von Warentesturteilen,2002.0,['M Streich '],,,,,3.0,,,2022-03-19
Michael Streich,Sustaining indoor air quality: Maintaining indoor air quality is imperative for occupant health and comfort as well as the reliable operation and longevity of information …,2020.0,"['M Streich', ' S Tumber']",, Consulting Specifying Engineer,,,,,4.0,2022-03-19
Michael Streich,Das World Wide Web (WWW) als neues Medium für Verbraucherinformationen,2000.0,['M Streich '],,,,,2.0,,,2022-03-19
Michael Streich,Design generator rooms for optimum performance: mechanical engineers should design generator set rooms so that the electrical system meets the design goals set …,2015.0,"['M Streich', ' S Tumber']",, Consulting Specifying Engineer,,,,,4.0,2022-03-19
Michael Streich,Ralph Berndt,2000.0,"['M Streich', ' C Scheck']",, Management Strategien,,,,,15.0,2022-03-19
Michael Streich,Kommunikation für Kongresse,2017.0,"['M Streich', 'Michael Streich']",Chapter,nan,,10.1007/978-3-658-08309-0_25,1.0,,,
Michael Streich,Internationale Werbemittelgestaltung und internationale Mediaselektion: eine Betrachtung unter dem Ziel der Maximierung der Ansprachen,1997.0,['M Streich '],,,,,1.0,,,2022-03-19
Michael Streich,Trends in das nächste Jahrtausend-Ergebnisse einer empirischen Analyse,2000.0,"['R Berndt', ' M Streich', ' C Scheck']",, Management Strategien,,,1.0,,15.0,2022-03-19
Michael Streich,Trends ins nächste Jahrtausend: Ergebnisse einer empirischen Analyse,1998.0,"['R Berndt', ' M Streich', ' C Scheck ']",,,,,2.0,,,2022-03-19
Jürgen Schneider,What do teachers think and feel when analyzing videos of themselves and other teachers teaching?,2013.0,"['M Kleinknecht', ' J Schneider']",,Teaching and teacher education,,,243.0,,123.0,2022-03-19
Jürgen Schneider,Videos oder Texte in der Lehrerbildung? Effekte unterschiedlicher Medien auf die kognitive Belastung und die motivational-emotionalen Prozesse beim Lernen mit Fällen,2015.0,"['M Syring', ' T Bohl', ' M Kleinknecht', ' S Kuntze', ' M Rehm', ' J Schneider']",,Zeitschrift für Erziehungswissenschaft,,,58.0,k.R.,19.0,2022-03-19
Jürgen Schneider,Pre-service teachers’ perceived value of general pedagogical knowledge for practice: Relations with epistemic beliefs and source beliefs,2017.0,"['S Merk', ' T Rosman', ' J Rueß', ' M Syring', ' J Schneider']",,PloS one,,,37.0,,332.0,2022-03-19
Jürgen Schneider,"Fallarbeit als Angebot-fallbasiertes Lernen als Nutzung. Empirische Ergebnisse zur kognitiven Belastung, Motivation und Emotionen bei der Arbeit mit Unterrichtsfällen",2016.0,"['M Syring', ' T Bohl', ' M Kleinknecht', ' S Kuntze', ' M Rehm', ' J Schneider']",,Zeitschrift für Pädagogik,,,26.0,k.R.,,2022-03-19
Jürgen Schneider,Varianten videobasierten Lehrens und Lernens in der Lehrpersonenaus-und-fortbildung–empirische Befunde und didaktische Empfehlungen zum Einsatz unterschiedlicher Lehr-Lern …,2014.0,"['M Kleinknecht', ' J Schneider', ' M Syring']",,Beiträge zur Lehrerinnen-und Lehrerbildung,,,26.0,,,2022-03-19
Jürgen Schneider,Unterricht analysieren und reflektieren mit unterschiedlichen Fallmedien: Ist Video wirklich besser als Text?,2016.0,"['J Schneider', ' T Bohl', ' M Kleinknecht', ' S Kuntze', ' M Rehm', ' M Syring']",,Unterrichtswissenschaft: Zeitschrift für Lernforschung,,,21.0,,,2022-03-19
Jürgen Schneider,Lehramtsstudierende analysieren Praxis. Ein Vergleich der Effekte unterschiedlicher fallbasierter Lehr-Lern-Arrangements,2016.0,['J Schneider'],,Universität Tübingen,,,17.0,,,2022-03-19
Jürgen Schneider,"How problem-based or direct instructional case-based learning environments influence secondary school pre-service teachers’ cognitive load, motivation and emotions: A quasi …",2015.0,"['M Syring', ' M Kleinknecht', ' T Bohl', ' S Kuntze', ' M Rehm', ' J Schneider']",,Journal of Education and Human Development,,,17.0,k.R.,106.0,2022-03-19
Jürgen Schneider,Re-Building Trust,2019.0,"['J Schneider', ' S Merk']",,PsychArchives,,,15.0,,,2022-03-19
Jürgen Schneider,Relationierung von Theorie und Praxis: Was bedeutet dieses Konzept für die Begleitung von Praktika in der Lehrerinnen-und Lehrerbildung? Relationierung von Theorie und Praxis,2020.0,"['J Schneider', ' C Cramer']",,Verlängerte Praxisphasen in der Lehrer* innenbildung,,,13.0,,,2022-03-19
Jürgen Schneider,Observing many researchers using the same data and hypothesis reveals a hidden universe of uncertainty,2021.0,"['N Breznau', ' EM Rinke', ' A Wuttke', ' M Adem', ' J Adriaans', ' ...']",,MetaArXiv,,,10.0,,,2022-03-19
Jürgen Schneider,"Epistemologische Überzeugungen von Lehramtsstudierenden bezüglich pädagogischen Wissens: Gegenstands-, Quellen-und Kontextspezifität",2017.0,"['S Merk', ' J Schneider', ' T Bohl', ' A Kelava', ' M Syring']",,Journal for educational research online,,,8.0,,121.0,2022-03-19
Jürgen Schneider,Pädagogisches Kaffeekränzchen oder harte empirische Fakten?,2016.0,"['S Merk', ' J Schneider', ' M Syring', ' T Bohl']",,Pabst Science Publishers,,,7.0,,,2022-03-19
Jürgen Schneider,"Teacher students’ epistemic beliefs about general pedagogical knowledge: Topic-, source-and context specificity",2017.0,"['S Merk', ' J Schneider', ' T Bohl', ' A Kelava', ' M Syring']",,Journal for Educational Research Online/Journal für Bildungsforschung Online …,,,6.0,,49.0,2022-03-19
Jürgen Schneider,Welchen Einfluss haben Quelle und Kontext auf epistemologische Überzeugungen bezüglich pädagogischen Wissens,2016.0,"['S Merk', ' J Schneider', ' M Syring', ' T Bohl']",,Forschungsdaten zu einer experimentellen Untersuchung,,,5.0,,,2022-03-19
Jürgen Schneider,The Crowdsourced Replication Initiative: Investigating Immigration and Social Policy Preferences. Executive Report.,2019.0,"['N Breznau', ' EM Rinke', ' A Wuttke', ' M Adem', ' J Adriaans', ' ...']",,,,,4.0,,,2022-03-19
Jürgen Schneider,Tübinger Portfolio Lehrer* innenbildung. Konzeption,2017.0,"['L Feder', ' C Cramer', ' H Krämer', ' D Bogner', ' M Harant', ' E Prinz', ' J Schneider']",,Verfügbar unter http://www. uni-tuebingen.,,,3.0,,,2022-03-19
Jürgen Schneider,NSF 19-501 Accelnet Proposal: Community of Open Scholarship Grassroots Networks (COSGN),2020.0,"['BA Nosek', ' KS Corker', ' T Krall', ' FL Grasty', ' RE Brooks III', ' DT Mellor', ' ...']",,MetaArXiv,,,2.0,,,2022-03-19
Jürgen Schneider,Video or text in case-based teacher education? An examination of the effects of different media on cognitive load and motivational-emotional processes in case-based learning,2015.0,"['M Syring', ' T Bohl', ' M Kleinknecht', ' S Kuntze', ' M Rehm', ' J Schneider']",,ZEITSCHRIFT FUR ERZIEHUNGSWISSENSCHAFT,,,2.0,,17.0,2022-03-19
Jürgen Schneider,Facilitating Open Science Practices for Research Syntheses: PreregRS Guides Preregistration,2022.0,"['J Schneider', ' I Backfisch', ' A Lachner']",,Research Synthesis Methods,,,1.0,A,111.0,2022-03-19
Jürgen Schneider,Datset for:(Re) Building Trust? Journals' Open Science Badges Influence Trust in Scientists. Study 3.,2021.0,"['J Schneider', ' T Rosman', ' S Merk']",,PsychArchives,,,,,,2022-03-19
Jürgen Schneider,TüDi-BASE: Tübinger digitale Bibliothek aufbereiteter Forschungssynthesen,2021.0,"['J Schneider', ' I Backfisch', ' A Lachner', ' P Breil', ' T Bohl', ' K Scheiter']",,"QLB-Programmworkshops"" Lehrkräftebildung nach dem pandemiebedingten Digital …",,,,,,2022-03-19
Jürgen Schneider,preregRS guides preregistration. Facilitating Open Science Practices for research syntheses,2021.0,"['J Schneider', ' I Backfisch', ' A Lachner']",,Research Synthesis & Big Data,,,,,27.0,2022-03-19
Jürgen Schneider,How Many Replicators Does It Take to Achieve Reliability? Investigating Researcher Variability in a Crowdsourced Replication,2021.0,"['N Breznau', ' EM Rinke', ' A Wuttke', ' HHV Nguyen', ' M Adem', ' J Adriaans', ' ...']",,SocArXiv,,,,,,2022-03-19
Jürgen Schneider,(Re) Building Trust? Investigating the effects of open science badges on perceived trustworthiness of journal articles.[EXPANSION: Public Sample],2020.0,"['J Schneider', ' S Merk', ' T Rosman', ' A Kelava']",,PsychArchives,,,,,,2022-03-19
Jürgen Schneider,Another jingle-jangle fallacy? Examining the validity of Technological Pedagogical and Content Knowledge (TPACK) self-report assessments,2020.0,"['I Backfisch', ' J Schneider', ' A Lachner', ' K Scheiter', ' R Scherer']",,PsychArchives,,,,,,2022-03-19
Jürgen Schneider,Study Information,2020.0,"['J Schneider', ' S Merk', ' T Rosman', ' A Kelava']",,,,,,,,2022-03-19
Jürgen Schneider,Merkmale der Hausaufgabenvergabe: erste Erkenntnisse zu schulartunspezifischen Betrachtungen in der Literatur,2020.0,"['B Kohler', ' J Schneider']",,Empirische Pädagogik-Landau: Empirische Pädagogik eV,,,,,,2022-03-19
Jürgen Schneider,Victoria L. Barth: Professionelle Wahrnehmung von Störungen im Unterricht. Wiesbaden: Springer VS Verlag für Sozialwissenschaften 2017 (340 S.)[Rezension],2018.0,['J Schneider'],,Erziehungswissenschaftliche Revue (EWR),,,,,,2022-03-19
Jürgen Schneider,"Zur Einführung der Gemeinschaftsschule in Baden-Württemberg: Zusammenfassung, Diskussion und Empfehlungen",2016.0,"['A Batzel-Kremer', ' T Bohl', ' S Derscheid', ' F Heller', ' S Meissner', ' S Merk', ' ...']",,,,,,,,2022-03-19
Jürgen Schneider,"How problem-based or direct instructional case-based learning enviroments influence pre-service teachers' cognitive load, motivation and emotions: A quasi-experimental …",2016.0,"['M Syring', ' T Bohl', ' M Kleinknecht', ' S Kuntze', ' S Rehm', ' J Schneider']",,Journal of Education and Human Development,,,,k.R.,106.0,2022-03-19
Jürgen Schneider,"Geschäftsreisende in Deutschland: ein Überblick, erweitert um eine vertiefte Analyse der weiblichen Geschäftsreisenden",2012.0,"['J Schneider', ' A Mrkwicka']",,Bock,,,,,,2022-03-19
Jürgen Schneider,Wirtschaftliches Eigentum und Ertragsrealisierung bei Grundstücken: ein Vergleich von HGB/EStG und IFRS,2009.0,['J Schneider'],,Praxis der internationalen Rechnungslegung,,,,k.w.Z.,,2022-03-19
Jürgen Schneider,Kapitalrenditecontrolling der Bilfinger Berger AG—Ein generell anwendbares Konzept für Anlagenbau und Bauindustrie,2003.0,['JM Schneider'],,Perspektiven der Strategischen Unternehmensführung,,,,,,2022-03-19
Jürgen Schneider,Varianten videobasierten Lehrens und Lernens in der Lehrpersonenaus-und-fortbildung-Empirische Befunde,,"['M Kleinknecht', ' J Schneider', ' M Syring']",,für fachdidaktische Projelcte,,,,,,2022-03-19
Jürgen Schneider,Epistemic Beliefs and the Theory-Practice Gap in Teacher Education,,"['S Merk', ' T Rosman', ' J Ruess', ' M Syring', ' J Schneider']",,,,,,,,2022-03-19
Thomas Asche,Validation of the COMPASS force field for complex inorganic–organic hybrid polymers,2017.0,"['TS Asche', ' P Behrens', ' AM Schneider']",,,,,18.0,,,2022-02-22
Thomas Asche,[BOOK][B] Das Sicherheitsverhalten von Konsumenten,1990.0,['T Asche '],,,,,27.0,,,2022-02-22
Thomas Asche,Die Ergebnisse der empirischen Analyse zum Sicherheitsverhalten,1990.0,['T Asche'],, Das Sicherheitsverhalten von Konsumenten,,,,,,2022-02-22
Thomas Asche,Atomistic simulation of sol-gel-derived hybrid materials,2018.0,"['Thomas Sebastian Asche', 'M. Duderstaedt', 'P. Behrens', 'Andreas M. Schneider']",Chapter,,,10.1007/978-3-319-32101-1_109,,,,2022-03-02
Thomas Asche,Validation of the COMPASS force field for complex inorganic–organic hybrid polymers,2017.0,"['Thomas Sebastian Asche', 'Peter Behrens', 'Andreas M. Schneider']",Article,Journal of Sol-Gel Science and Technology,,10.1007/s10971-016-4185-y,,C,68.0,2022-03-02
Thomas Asche,Atomistic Simulation of Sol–Gel-Derived Hybrid Materials,2016.0,"['Thomas Sebastian Asche', 'Mirja Duderstaedt', 'Peter Behrens', 'Andreas M. Schneider']",Chapter,,,10.1007/978-3-319-19454-7_109-1,,,,2022-03-02
Thomas Asche,Two-photon polymerization of inorganic-organic polymers for biomedical and microoptical applications,2015.0,"['F. Burmeister', 'Sönke Steenhusen', 'Ruth Houbertz', 'Heike Walles']",Chapter,,,10.1515/9783110354324-016,,,,2022-03-02
Thomas Asche,Die Datengewinnung zur Analyse des Sicherheitsverhaltens,1990.0,['T Asche'],, Das Sicherheitsverhalten von Konsumenten,,,,,,2022-02-22
Klaus Birk,"Jürgen Osterhammel: Shanghai, 30. Mai 1925. Die chinesische Revolution, München:: Deutscher Taschenbuchverlag 1997, 276 S.",1998.0,['K Birk'],, Comparativ,,,,,,2022-03-19
Klaus Birk,Zivilgesellschaft in China? Zur Frage der Autonomie und politischen Partizipation gesellschaftlicher Gruppen,1998.0,['K Birk'],, Comparativ,,,,,,2022-03-19
Klaus Birk,Building experiences: a reflective design process for media architecture,2017.0,['K Birk '],,,,,,,,2022-03-19
Olaf Fritz,Bowl Shaped Monodentate Phosphines by Condensation of Imidazole Units with Boranes,2018.0,"['H Schall', ' O Fritz', ' M Schikora', ' J Elias…']",, Zeitschrift für …,,,2.0,D,,2022-03-19
Olaf Fritz,[BOOK][B] Psychologische Folgen einer permanenten Erreichbarkeit durch digitale Medien,2019.0,"['O Fritz', ' C Weber', ' C Procher', ' S Schorling ']",,,,,1.0,,,2022-03-19
Olaf Fritz,Cover Feature: Bowl Shaped Monodentate Phosphines by Condensation of Imidazole Units with Boranes (Z. Anorg. Allg. Chem. 14/2018),2018.0,"['H Schall', ' O Fritz', ' M Schikora', ' J Elias…']",, Zeitschrift für …,,,,D,,2022-03-19
Olaf Fritz,[BOOK][B] Ethische Aspekte der Künstlichen Intelligenz,2019.0,"['O Fritz', ' C Weber', ' A König', ' J Wolf ']",,,,,,,,2022-03-19
Jan Specht,20% efficient passivated large-area metal wrap through solar cells on boron-doped Cz silicon,2011.0,"['E Lohmuller', ' B Thaidigsmann', ' M Pospischil', ' U Jager', ' S Mack', ' J Specht', ' ...']",,IEEE Electron Device Letters,,,46.0,,154.0,2022-03-19
Jan Specht,Investigations of thick-film-paste rheology for dispensing applications,2011.0,"['M Pospischil', ' K Zengerle', ' J Specht', ' G Birkle', ' P Koltay', ' R Zengerle', ' ...']",,Energy Procedia,,,44.0,,193.0,2022-03-19
Jan Specht,Paste rheology correlating with dispensed finger geometry,2013.0,"['M Pospischil', ' J Specht', ' M König', ' M Hörteis', ' C Mohr', ' F Clement', ' D Biro']",,IEEE Journal of Photovoltaics,,,36.0,,215.0,2022-03-19
Jan Specht,Process development for a high-throughput fine line metallization approach based on dispensing technology,2013.0,"['M Pospischil', ' M Klawitter', ' M Kuchler', ' J Specht', ' H Gentischer', ' R Efinger', ' ...']",,Energy Procedia,,,35.0,,193.0,2022-03-19
Jan Specht,Hot-melt inkjet as masking technology for back-contacted cells,2009.0,"['N Mingirulli', ' R Keding', ' J Specht', ' A Fallisch', ' D Stüwe', ' D Biro']",,IEEE Photovoltaic Specialists Conference (PVSC),,,27.0,,57.0,2022-03-19
Jan Specht,Formation of a honeycomb texture for multicrystalline silicon solar cells using an inkjetted mask,2012.0,"['J Nievendick', ' J Specht', ' M Zimmer', ' L Zahner', ' W Glover', ' D Stüwe', ' ...']",,physica status solidi (RRL)–Rapid Research Letters,,,18.0,,68.0,2022-03-19
Jan Specht,High aspect ratio front contacts by single step dispensing of metal pastes,2010.0,"['J Specht', ' K Zengerle', ' M Pospischil', ' D Erath', ' J Haunschild', ' F Clement', ' ...']",,Proceedings of the European Photovoltaic Solar Energy Conference and …,,,16.0,,6.0,2022-03-19
Jan Specht,Screen‐printed Emitter‐Wrap‐Through solar cell with single step side selective emitter with 18.8% efficiency,2011.0,"['N Mingirulli', ' D Stüwe', ' J Specht', ' A Fallisch', ' D Biro']",,Progress in Photovoltaics: Research and Applications,,,15.0,,152.0,2022-03-19
Jan Specht,21.1% efficient PERC silicon solar cells on large scale by using inline sputtering for metallization,2010.0,"['D Reinwand', ' J Specht', ' D Stüwe', ' S Seitz', ' JF Nekarda', ' D Biro', ' R Preu', ' ...']",,IEEE Photovoltaic Specialists Conference,,,13.0,,57.0,2022-03-19
Jan Specht,Correlations between finger geometry and dispensing paste rheology,2012.0,"['M Pospischil', ' J Specht', ' H Gentischer', ' M König', ' M Hörteis', ' C Mohr', ' ...']",,European photovoltaic solar energy conference and exhibition,,,12.0,,9.0,2022-03-19
Jan Specht,Industrially feasible front-side metallization based on ink-jet masking and nickel plating,2008.0,"['M Alemán', ' N Bay', ' J Gautero', ' J Specht', ' D Stüwe', ' R Neubauer', ' D Baurcha', ' ...']",,Proceedings of the European Photovoltaic Solar Energy Conference …,,,12.0,,41.0,2022-03-19
Jan Specht,Application of the inkjet-honeycomb-texture in silicon solar cell production,2012.0,"['J Nievendick', ' M Stocker', ' J Specht', ' W Glover', ' M Zimmer', ' J Rentsch']",,Energy Procedia,,,11.0,,193.0,2022-03-19
Jan Specht,An industrially applicable honeycomb texture,2011.0,"['J Nievendick', ' J Specht', ' M Zimmer', ' L Zahner', ' W Glover', ' D Stüwe', ' D Biro', ' ...']",,Proceedings of the European Photovoltaic Solar Energy Conference and …,,,10.0,,6.0,2022-03-19
Jan Specht,Comparison of different rear contacting approaches for industrial PERC solar cells on mc-Si wafer,2010.0,"['L Gautero', ' D Kania', ' J Seiffe', ' A Knorz', ' J Specht', ' J Nekarda', ' M Hofmann', ' ...']",,Proceedings of the European Photovoltaics Solar Energy Conference …,,,10.0,,41.0,2022-03-19
Jan Specht,Using hotmelt-inkjet as a structuring method for higher efficiency industrial silicon solar cells,2008.0,"['J Specht', ' D Biro', ' N Mingirulli', ' M Aleman', ' U Belledin', ' R Efinger', ' D Erath', ' ...']",,NIP & Digital Fabrication Conference,,,9.0,,,2022-03-19
Jan Specht,Advanced metallization of rear surface passivated metal wrap through silicon solar cells,2011.0,"['E Lohmüller', ' B Thaidigsmann', ' J Bartsch', ' C Harmel', ' J Specht', ' A Wolf', ' ...']",,Energy Procedia,,,6.0,,193.0,2022-03-19
Jan Specht,18.8% EWT-cells with screen-printed metallization and single step side selective emitter formation,2009.0,"['N Mingirulli', ' D Stüwe', ' J Specht', ' R Keding', ' R Neubauer', ' A Fallisch', ' D Biro']",,Proceedings of the European Photovoltaic Solar Energy Conference,,,6.0,,41.0,2022-03-19
Jan Specht,"Industrial approach for the deposition, through-vias wet opening and firing activation of a backside passivation layer applied on solar cells",2008.0,"['L Gautero', ' J Rentsch', ' L Weiss', ' N Kohn', ' S Eigner', ' M Zimmer', ' J Specht', ' ...']",,Proceedings of the European Photovoltaic Solar Energy Conference,,,6.0,,41.0,2022-03-19
