AUTHOR_NAME,PUB_TITLE,PUB_YEAR,PUB_AUTHORS,PUB_TYPE,PUB_PUBLISHER,PUB_ISBN,PUB_DOI,PUB_CITATIONS,JOU_RATING_VHB,JOU_RATING_SCIMAGO,UPDATED
Melanie Deutmeyer,Töchter pflegen ihre Eltern: Traumatisierungspotenziale in der häuslichen Elternpflege—Indizien für geschlechtstypische Ungleichheit?,2008.0,['M Deutmeyer'],, Soziale Ungleichheit und Pflege,,,12.0,,,2022-03-19
Melanie Deutmeyer,Belastungen und Bewältigungsstrategien von erwachsenen Töchtern in der häuslichen Pflege von körperlich und geistig kranken Müttern und Vätern,2006.0,['M Deutmeyer '],,,,,4.0,,,2022-03-19
Thomas Dobbelstein,Customers' willingness to purchase new store brands,2007.0,"['S Zielke', ' T Dobbelstein']",, Journal of Product & Brand Management,,,230.0,C,318.0,2022-03-19
Thomas Dobbelstein,Consumers׳ perception of the complexity of selected household purchase decisions,2014.0,"['AC Erasmus', ' S Donoghue', ' T Dobbelstein']",, Journal of Retailing and …,,,37.0,C,151.0,2022-03-19
Thomas Dobbelstein,The impact of risk perceptions on the attitude toward multi-channel technologies,2019.0,"['A Ortlinghaus', ' S Zielke…']",, The International Review of …,,,11.0,C,62.0,2022-03-19
Thomas Dobbelstein,A membrane electrode for nitrate and other univalent anions,1969.0,"['TN Dobbelstein', ' H Diehl']",, Talanta,,,21.0,,161.0,2022-03-19
Thomas Dobbelstein,The influence of the level of environmental complexity and turbulence on the choice of marketing tactics,2016.0,"['RB Mason', ' T Dobbelstein']",, Journal of economics and …,,,6.0,C,259.0,2022-03-19
Thomas Dobbelstein,"Mystery Shopping—Ziele, Prozess und Qualität eines Verfahrens zum Controlling der Dienstleistungsqualität",2007.0,"['T Dobbelstein', ' D Windbacher']",, Theoretische Fundierung und praktische …,,,14.0,,,2022-03-19
Thomas Dobbelstein,First choice or fallback option? The attractiveness of South Africa's retail industry for Gen Y members,2017.0,"['W Heidig', ' T Dobbelstein', ' RB Mason…']",, … and perspectives in …,,,4.0,C,31.0,2022-03-19
Thomas Dobbelstein,9 Levels for Value systems Development of a scale for level-measurement,2012.0,"['T Dobbelstein', ' R Krumm']",, Journal of Applied Leadership and …,,,4.0,C,284.0,2022-03-19
Thomas Dobbelstein,Deceptive counterfeiting and purchase intention towards products in anti-counterfeit packaging: An empirical investigation in Sub-Saharan Africa,2019.0,"['T Dobbelstein', ' PM Pepuere']",, Journal of Applied Leadership and …,,,1.0,C,284.0,2022-03-19
Thomas Dobbelstein,[BOOK][B] Marktpotenzialanalysen als Basis der Sortimentspolitik: Das Beispiel Presseartikel,2013.0,['T Dobbelstein '],,,,,10.0,,,2022-03-19
Thomas Dobbelstein,Preference for a career in retailing: a question of personality,2018.0,"['W Heidig', ' T Dobbelstein', ' RB Mason…']",, … International Review of …,,,1.0,B,38.0,2022-03-19
Thomas Dobbelstein,Factors encouraging and discouraging attendance at farmers' markets: an application of The Kano Model,2021.0,"['RB Mason', ' T Dobbelstein…']",, The Retail and …,,,,,7.0,2022-03-19
Thomas Dobbelstein,Leadership productivity model: Evaluation of operationalisation,2018.0,['T Dobbelstein'],, Journal of Applied Leadership and Management,,,1.0,C,318.0,2022-03-19
Thomas Dobbelstein,"Perception of cost, cost drivers, human resource management, long and short term critical success factors in the hotel industry: Recommendations for hotel …",2012.0,"['D Thomas', ' B Carsten']",, African Journal of Business …,,,1.0,k.R.,182.0,2022-03-19
Thomas Dobbelstein,Exploring Consumers' Spiritual Development in Adulthood: Possible Implications for Marketing Organisations,2007.0,"['T Dobbelstein', ' MD Santos', ' F Herbst']",, Proceedings of the Academy of …,,,1.0,C,431.0,2022-03-19
Thomas Dobbelstein,Development of the Generation 50plus and their effects on retail marketing: an insight into the German market2,2006.0,"['T Dobbelstein', ' K Klebl']",, Sediba,,,1.0,,,2022-03-19
Thomas Dobbelstein,Analyzing the world of work's requirements with the aim of enthusing companies about cooperative education,2004.0,"['T Dobbelstein', ' S Taylor']",,,,,1.0,,,2022-03-19
Thomas Dobbelstein,Whether to adopt or not?: a cross-country comparison of consumer resistance towards the Internet of Things in households,2021.0,"['C Meintjes', ' W Heidig…']",, The Retail and Marketing …,,,,,,2022-03-19
Thomas Dobbelstein,A comparative investigation into the changing use of shopping malls in Germany and South Africa,2019.0,"['RB Mason', ' T Dobbelstein…']",, Journal of business and …,,,1.0,C,182.0,2022-03-19
Thomas Dobbelstein,Digital transformation in destination management,2020.0,['T Dobbelstein '],,,,,,,,2022-03-19
Thomas Dobbelstein,Prozessqualität als Wettbewerbsvorteil für Krankenhäuser–eine Analyse aus Sicht der Einweiser,2008.0,['T Dobbelstein'],, Zukunft der Krankenhausversorgung,,,4.0,,,2022-03-19
Thomas Dobbelstein,Creating enthusiasm about farmers' markets in a post pandemic world: a South African-German comparison,2021.0,"['T Dobbelstein', ' K Corbishley…']",,,,,,,,2022-03-19
Thomas Dobbelstein,Project 2016/20: The retail industry in South Africa as employer of first choice for young talent,,"['T Dobbelstein', ' W Heidig', ' MW Jooste', ' RB Mason ']",,,,,,,,2022-03-19
Thomas Dobbelstein,[BOOK][B] A phenol-formaldehyde polymer membrane responsive to anions,1967.0,['TN Dobbelstein '],,,,,,,,2022-03-19
Thomas Dobbelstein,9 Levels for Value Systems-Operationalising and measuring the level resistances,2016.0,"['T Dobbelstein', ' R Krumm']",, Journal of Applied Leadership and …,,,,C,284.0,2022-03-19
Thomas Dobbelstein,The Bologna agreement: implications for universities in Central Asia,2004.0,"['N Mouraviev', ' T Dobbelstein']",,,,,,,,2022-03-19
Thomas Dobbelstein,Regional Anchoring as a Selection Criterion for Compulsory Health Insurance,2012.0,"['T Dobbelstein', ' O Renzing']",, International Journal of Applied …,,,,B,284.0,2022-03-19
Thomas Dobbelstein,Development of a scale for level-measurement,,"['T Dobbelstein', ' R Krumm ']",,,,,,,,2022-03-19
Thomas Dobbelstein,[BOOK][B] TikTok und Instagram: Erfolgsfaktoren zur Markenführung für Konsumgüter in der Generation Z,2021.0,"['T Dobbelstein', ' N Walz ']",,,,,,,,2022-03-19
Thomas Dobbelstein,Strategische Vorabentscheidungen,2021.0,"['W Heidig', ' T Dobbelstein']",, Quick Guide Marktforschung im Mittelstand,,,,,,2022-03-19
Thomas Dobbelstein,Von der Grundgesamtheit zur Stichprobe,2021.0,"['W Heidig', ' T Dobbelstein']",, Quick Guide Marktforschung im Mittelstand,,,,,,2022-03-19
Thomas Dobbelstein,Von der Forschungsfrage zum Marktforschungsprojekt,2021.0,"['W Heidig', ' T Dobbelstein']",, Quick Guide Marktforschung im Mittelstand,,,,,,2022-03-19
Thomas Dobbelstein,Wahl und Gestaltung des Fragebogens,2021.0,"['W Heidig', ' T Dobbelstein']",, Quick Guide Marktforschung im Mittelstand,,,,,,2022-03-19
Thomas Dobbelstein,Zur Bedeutung der Marktforschung im Mittelstand,2021.0,"['W Heidig', ' T Dobbelstein']",, Quick Guide Marktforschung im Mittelstand,,,,,,2022-03-19
Thomas Dobbelstein,Wahl und Gestaltung der Gruppendiskussion,2021.0,"['W Heidig', ' T Dobbelstein']",, Quick Guide Marktforschung im Mittelstand,,,,,,2022-03-19
Thomas Dobbelstein,Von der Auswertung zur Ergebnisdarstellung,2021.0,"['W Heidig', ' T Dobbelstein']",, Quick Guide Marktforschung im Mittelstand,,,,,,2022-03-19
Thomas Dobbelstein,Reduziertes Flop-Risiko,2021.0,"['W Heidig', ' T Dobbelstein']",, return; Vol.,,,,,,2022-03-19
Thomas Dobbelstein,Checklisten,2021.0,"['W Heidig', ' T Dobbelstein']",, Quick Guide Marktforschung im Mittelstand,,,,,,2022-03-19
Thomas Dobbelstein,Quick Guide Marktforschung im Mittelstand,,"['W Heidig', ' T Dobbelstein ']",,,,,,,,2022-03-19
Thomas Dobbelstein,Zusammenfassende Bewertung und Ausblick,2002.0,['T Dobbelstein'],, Marktpotenzialanalysen als Basis der Sortimentspolitik,,,,,,2022-03-19
Thomas Dobbelstein,Kalibrieren und exemplarisches Anwenden des Modells,2002.0,['T Dobbelstein'],, Marktpotenzialanalysen als Basis der Sortimentspolitik,,,,,,2022-03-19
Thomas Dobbelstein,Die Sortimentsplanung im Rahmen des Category Managements,2002.0,['T Dobbelstein'],, Marktpotenzialanalysen als Basis der Sortimentspolitik,,,,,,2022-03-19
Thomas Dobbelstein,Definitorische Grundlagen und Rahmenbedingungen des Pressemarktes,2002.0,['T Dobbelstein'],, Marktpotenzialanalysen als Basis der Sortimentspolitik,,,,,,2022-03-19
Thomas Dobbelstein,Problemstellung und Gang der Arbeit,2002.0,['T Dobbelstein'],, Marktpotenzialanalysen als Basis der Sortimentspolitik,,,,,,2022-03-19
Thomas Dobbelstein,Analyse des Kaufverhaltens bei Presseerzeugnissen und Entwicklung eines Modells zur verkaufsstellenindividuellen Marktpotentialanalyse,2002.0,['T Dobbelstein'],, Marktpotenzialanalysen als Basis der Sortimentspolitik,,,,,,2022-03-19
Tobias Frank,Femtosecond photo-switching of interface polaritons in black phosphorus heterostructures,2017.0,"['MA Huber', ' F Mooshammer', ' M Plankl', ' L Viti', ' F Sandner', ' LZ Kastner', ' ...']",,Nature Nanotechnology,,,168.0,,1226.0,2022-03-19
Tobias Frank,Excitonic valley effects in monolayer WS2 under high magnetic fields,2016.0,"['G Plechinger', ' P Nagler', ' A Arora', ' A Granados del Águila', ' MV Ballottin', ' ...']",,Nano Letters,,,100.0,,488.0,2022-03-19
Tobias Frank,Spin-orbit coupling in fluorinated graphene,2015.0,"['S Irmer', ' T Frank', ' S Putz', ' M Gmitra', ' D Kochan', ' J Fabian']",,Physical Review B,,,69.0,,164.0,2022-03-19
Tobias Frank,"Theory of proximity-induced exchange coupling in graphene on hBN/(Co, Ni)",2016.0,"['K Zollner', ' M Gmitra', ' T Frank', ' J Fabian']",,Physical Review B,,,66.0,,164.0,2022-03-19
Tobias Frank,,2016.0,"['B Scharf', ' T Frank', ' M Gmitra', ' J Fabian', ' I Žutić', ' V Perebeinos']",,Physical Review B,,,50.0,,164.0,2022-03-19
Tobias Frank,Protected Pseudohelical Edge States in  Z2 -Trivial Proximitized Graphene,2018.0,"['T Frank', ' P Högl', ' M Gmitra', ' D Kochan', ' J Fabian']",,Phys. Rev. Lett.,,,46.0,,,2022-03-19
Tobias Frank,Theory of electronic and spin-orbit proximity effects in graphene on Cu (111),2016.0,"['T Frank', ' M Gmitra', ' J Fabian']",,Physical Review B,,,35.0,,164.0,2022-03-19
Tobias Frank,Many-body quantum Monte Carlo study of 2D materials: cohesion and band gap in single-layer phosphorene,2018.0,"['T Frank', ' R Derian', ' K Tokar', ' J Mitas', ' Lubos', ' Fabian', ' I Stich']",,Physical Review X,,,28.0,,164.0,2022-03-19
Tobias Frank,Quantum anomalous hall effects in graphene from proximity-induced uniform and staggered spin-orbit and exchange coupling,2020.0,"['P Högl', ' T Frank', ' K Zollner', ' D Kochan', ' M Gmitra', ' J Fabian']",,Physical Review Letters,,,26.0,,164.0,2022-03-19
Tobias Frank,Copper adatoms on graphene: Theory of orbital and spin-orbital effects,2017.0,"['T Frank', ' S Irmer', ' M Gmitra', ' D Kochan', ' J Fabian']",,Physical Review B,,,25.0,,164.0,2022-03-19
Tobias Frank,Spin-orbit coupling in methyl functionalized graphene,2016.0,"['K Zollner', ' T Frank', ' S Irmer', ' M Gmitra', ' D Kochan', ' J Fabian']",,Physical Review B,,,20.0,,164.0,2022-03-19
Tobias Frank,Chiral Majorana fermions in graphene from proximity-induced superconductivity,2020.0,"['P Högl', ' T Frank', ' D Kochan', ' M Gmitra', ' J Fabian']",,Phys. Rev. B,,,9.0,,,2022-03-19
Tobias Frank,Landau levels in spin-orbit coupling proximitized graphene: bulk states,2020.0,"['T Frank', ' J Fabian']",,Physical Review B,,,4.0,,164.0,2022-03-19
Tobias Frank,Ab initio studies of extrinsic spin-orbit coupling effects in graphene and quantum Monte Carlo simulations of phosphorene,2019.0,['T Frank'],,Universität Regensburg,,,,,,2022-03-19
Navid Sardarabady,[BOOK][B] Verbesserung des Lean Management Konzepts im besonderen Shop-Floor Management durch Einführung von Industrie 4.0,2019.0,['N Sardarabady '],,,,,,,,2022-03-19
Gregor Hopf,Online targeting und controlling,2011.0,"['C Bauer', ' R Abel', ' M Altendorf', ' N Andersen', ' G Greve', ' G Hopf']",,Gabler,,,47.0,,,2022-03-19
Gregor Hopf,"Online-Marketing Intelligence - Kennzahlen, Erfolgsfaktoren und Steuerungskonzepte im Online-Marketing",2019.0,"['D Ahrholdt', ' G Greve', ' G Hopf']",,,,,35.0,,,2022-03-19
Gregor Hopf,Einführung in das Online Targeting,2011.0,"['G Greve', ' G Hopf', ' C Bauer']",,Online targeting und controlling,,,21.0,,,2022-03-19
Gregor Hopf,Saving and Investment: The Economic Development of Singapore 1965-99: An in-depth look at the country''s saving behaviour and government control,2009.0,['G Hopf'],,VDM Publishing,,,9.0,,,2022-03-19
Gregor Hopf,Chancen und Risiken im pro-aktiven Umgang mit Online-Reputationsnetzwerken,2011.0,"['G Hopf', ' M Kaiser']",,Social Media im Kulturmanagement: Grundlagen,,,5.0,,,2022-03-19
Gregor Hopf,Die zerstörerische Kraft des Internets,2010.0,['G Hopf'],,Kultur Neue Web-Strategien für das Kulturmanagement im Zeitalter von …,,,5.0,,,2022-03-19
Gregor Hopf,Psychografisches Targeting - Wirkung und Funktionsweise als eine besondere Form des Micro-Targetings in den sozialen Medien,2020.0,['G Hopf'],,Data-driven Marketing Insights aus Wissenschaft und Praxis,,,3.0,,,2022-03-19
Gregor Hopf,In vier Schritten zum Online-Geschäftsmodell,2011.0,['G Hopf'],,Online Targeting und Controlling,,,3.0,,,2022-03-19
Gregor Hopf,A Critical Assessment Of Past Investigations Into Singapore'S Saving Behavior,2006.0,['G Hopf'],,The Singapore Economic Review,,,3.0,,17.0,2022-03-19
Gregor Hopf,Digitalisierung im föderalen Kontext: Was erwartet die einzelnen föderalen Ebenen durch die Digitalisierung von Wirtschaft und Gesellschaft?,2016.0,['G Hopf'],,Jahrbuch des Föderalismus,,,2.0,,,2022-03-19
Gregor Hopf,Saving and investment: the economic development of Singapore 1965-99,2004.0,['G Hopf'],,The London School of Economics and Political Science (LSE),,,2.0,,,2022-03-19
Gregor Hopf,Mobile Marketing,2019.0,"['D Ahrholdt', ' G Greve', ' G Hopf']",,Online-Marketing-Intelligence,,,1.0,k.R.,,2022-03-19
Gregor Hopf,Was Singapore extraordinary? A comparative view of Singapore's saving performance 1965-99,2009.0,['G Hopf'],,Working Paper Series der HSBA Hamburg School of Business Administration,,,1.0,,,2022-03-19
Gregor Hopf,Suchmaschinenmarketing,2019.0,"['D Ahrholdt', ' G Greve', ' G Hopf']",,Online-Marketing-Intelligence,,,,k.R.,,2022-03-19
Gregor Hopf,Social Media,2019.0,"['D Ahrholdt', ' G Greve', ' G Hopf']",,Online-Marketing-Intelligence,,,,k.R.,,2022-03-19
Gregor Hopf,Einführung in Teil II: Forschungsergebnisse,2019.0,"['D Ahrholdt', ' G Greve', ' G Hopf']",,Online-Marketing-Intelligence,,,,k.R.,,2022-03-19
Gregor Hopf,Display-Marketing,2019.0,"['D Ahrholdt', ' G Greve', ' G Hopf']",,Online-Marketing-Intelligence,,,,k.R.,,2022-03-19
Gregor Hopf,Die eigene Website am Beispiel Online-Shop,2019.0,"['D Ahrholdt', ' G Greve', ' G Hopf']",,Online-Marketing-Intelligence,,,,k.R.,,2022-03-19
Gregor Hopf,Erfolgszusammenhänge beim Online-Shop,2019.0,"['D Ahrholdt', ' G Greve', ' G Hopf']",,Online-Marketing-Intelligence,,,,k.R.,,2022-03-19
Gregor Hopf,E-Mail-Marketing,2019.0,"['D Ahrholdt', ' G Greve', ' G Hopf']",,Online-Marketing-Intelligence,,,,k.R.,,2022-03-19
Gregor Hopf,Voll Free Digger!,2011.0,['G Hopf'],,Social Media im Kulturmanagement: Grundlagen,,,,,,2022-03-19
Gregor Hopf,Broadway trifft Staatstheater,2008.0,['G Hopf'],,Kulturmanagement Konkret – Interdisziplinäre Positionen und Perspektiven,,,,,,2022-03-19
Gregor Hopf,Kommerzialisierung im Theater,2007.0,['G Hopf'],,Sport- und Kulturkongress – Grenzen und Reichweiten der …,,,,,,2022-03-19
Gregor Hopf,The Economic Development of Singapore: Saving and Investment in Singapore 1965-99,2004.0,['G Hopf'],,University of London,,,,,24.0,2022-03-19
Gregor Hopf,"With all diligence due: Where did all the savings go? Singapore’s investment pattern, 1965-99",2003.0,['G Hopf'],,Economic History Society Annual Conference,,,,,,2022-03-19
Stefan Zink,B-type natriuretic peptide in paediatric patients with congenital heart disease,2006.0,"['A Koch', ' S Zink', ' H Singer']",, European heart journal,,,213.0,C,133.0,2022-03-19
Stefan Zink,"Benign metastasizing leiomyoma of the uterus: documentation of clinical, immunohistochemical and lectin-histochemical data of ten cases",2000.0,"['K Kayser', ' S Zink', ' T Schneider', ' H Dienemann', ' S André…']",, Virchows Archiv,,,207.0,,99.0,2022-03-19
Stefan Zink,Comprehensive genotype–phenotype analysis in 230 patients with tetralogy of Fallot,2010.0,"['R Rauch', ' M Hofbeck', ' C Zweier', ' A Koch…']",, Journal of medical …,,,153.0,D,299.0,2022-03-19
Stefan Zink,Limits to redistribution in a democracy: a survey,2003.0,"['P Harms', ' S Zink']",, European Journal of Political Economy,,,155.0,B,186.0,2022-03-19
Stefan Zink,Systematic assessment of atypical deletions reveals genotype–phenotype correlation in 22q11. 2,2005.0,"['A Rauch', ' S Zink', ' C Zweier', ' CT Thiel', ' A Koch…']",, Journal of Medical …,,,138.0,D,299.0,2022-03-19
Stefan Zink,Laterality of the aortic arch and anomalies of the subclavian artery—reliable indicators for 22q11. 2 deletion syndromes?,2004.0,"['R Rauch', ' A Rauch', ' A Koch', ' S Zink', ' R Kaulitz…']",, European journal of …,,,85.0,C,299.0,2022-03-19
Stefan Zink,"Survival, disease-free interval, and associated tumor features in patients with colon/rectal carcinomas and their resected intra-pulmonary metastases",2001.0,"['S Zink', ' G Kayser', ' HJ Gabius…']",, European journal of cardio …,,,110.0,C,93.0,2022-03-19
Stefan Zink,B‐type natriuretic peptide levels in patients with functionally univentricular hearts after total cavopulmonary connection,2008.0,"['AME Koch', ' S Zink', ' H Singer…']",, European journal of heart …,,,65.0,C,93.0,2022-03-19
Stefan Zink,Impact of cardiac surgery on plasma levels of B-type natriuretic peptide in children with congenital heart disease,2007.0,"['A Koch', ' T Kitzsteiner', ' S Zink', ' R Cesnjevar…']",, International journal of …,,,63.0,D,299.0,2022-03-19
Stefan Zink,Ternary Cathode Blend Electrodes for Environmentally Friendly Lithium‐Ion Batteries,2020.0,"['NM Jobst', ' A Hoffmann', ' A Klein', ' S Zink…']",, …,,,8.0,,,2022-03-19
Stefan Zink,B-type natriuretic peptide in patients with systemic right ventricle,2008.0,"['AME Koch', ' S Zink', ' H Singer']",, Cardiology,,,50.0,,63.0,2022-03-19
Stefan Zink,Virtually imprinted polymers (VIPs): understanding molecularly templated materials via molecular dynamics simulations,2018.0,"['S Zink', ' FA Moura', ' PA da Silva Autreto…']",, Physical Chemistry …,,,18.0,,171.0,2022-03-19
Stefan Zink,Plasma levels of B-type natriuretic peptide in patients with tetralogy of Fallot after surgical repair,2010.0,"['AME Koch', ' S Zink', ' M Glöckler', ' T Seeliger…']",, International journal of …,,,39.0,D,299.0,2022-03-19
Stefan Zink,Glyco‐and immunohistochemical refinement of the differential diagnosis between mesothelioma and metastatic carcinoma and survival analysis of patients,2001.0,"['K Kayser', ' G Böhm', ' S Blum', ' M Beyer…']",, The Journal of …,,,48.0,C,299.0,2022-03-19
Stefan Zink,Efficient prediction of suitable functional monomers for molecular imprinting via local density of states calculations,2018.0,"['S Zink', ' FA Moura', ' PA da Silva Autreto…']",, Physical Chemistry …,,,15.0,,171.0,2022-03-19
Stefan Zink,Decreasing ratio of plasma N‐terminal pro‐B‐type natriuretic peptide and B‐type natriuretic peptide according to age,2006.0,"['AME Koch', ' M Rauh', ' S Zink', ' H Singer']",, Acta Paediatrica,,,41.0,,,2022-03-19
Stefan Zink,"Primary colorectal carcinomas and their intrapulmonary metastases: Clinical, glyco‐, immuno‐and lectin histochemical, nuclear and syntactic structure analysis with …",2002.0,"['K Kayser', ' S Zink', ' S André', ' MP Schüring', ' E Hecker…']",, Apmis,,,36.0,,88.0,2022-03-19
Stefan Zink,Solow and heterogeneous labour: a neoclassical explanation of wage inequality,2004.0,"['J Meckl', ' S Zink']",, The Economic Journal,,,22.0,k.R.,62.0,2022-03-19
Stefan Zink,Human capital and growth cycles,2007.0,"['L Kaas', ' S Zink']",, Economic Theory,,,25.0,k.R.,101.0,2022-03-19
Stefan Zink,Growing into and out of social conflict,2005.0,"['P Harms', ' S Zink']",, Economica,,,20.0,,65.0,2022-03-19
Stefan Zink,Human capital investment with competitive labor search,2011.0,"['L Kaas', ' S Zink']",, European Economic Review,,,15.0,A+,297.0,2022-03-19
Stefan Zink,"Endobronchial juvenile hemangioma–a case report of a neonate including immunohistochemical monitoring and nuclear, cellular, and vascular morphometry",2001.0,"['K Kayser', ' S Zink', ' B Link', ' F Herth', ' H Dienemann…']",, Virchows Archiv,,,19.0,,99.0,2022-03-19
Stefan Zink,Buffer-architecture exploration for routers in a hierarchical network-on-chip,2005.0,"['H Zimmer', ' S Zink', ' T Hollstein…']",, IEEE International …,,,19.0,,23.0,2022-03-19
Stefan Zink,Life-threatening snakebites by Vipera berus,2003.0,"['M Schroth', ' J Jüngert', ' M Schreiber…']",, Intensive care …,,,16.0,,197.0,2022-03-19
Stefan Zink,Human–capital investment and the wage gap,2002.0,"['J Meckl', ' S Zink']",, Economic Theory,,,19.0,k.R.,101.0,2022-03-19
Stefan Zink,Plasma levels of B-type natriuretic peptide in children and adolescents with high degree atrioventricular block,2009.0,"['A Koch', ' S Zink', ' S Dittrich']",, International …,,,14.0,,145.0,2022-03-19
Stefan Zink,New technical aspects in telepathology,2000.0,"['K Kayser', ' G Kayser', ' S Zink']",, Electronic Journal of Pathology …,,,18.0,C,184.0,2022-03-19
Stefan Zink,Eating the rich vs. feeding the poor: borrowing constraints and the reluctance to redistribute,2003.0,"['P Harms', ' S Zink']",, Public Choice,,,10.0,k.R.,81.0,2022-03-19
Stefan Zink,Small Pulmonary Lesions-a challenge for thoracic surgery?,2001.0,"['K Kayser', ' D Dünnwald', ' S Zink…']",, Electronic Journal of …,,,8.0,C,299.0,2022-03-19
Stefan Zink,Is Equality of Opportunity Politically Feasible?,2005.0,['S Zink'],, Economics & Politics,,,7.0,,32.0,2022-03-19
Stefan Zink,Serum levels of gastric-acid-stimulating factors in children undergoing open heart surgery,2009.0,"['C Breuer', ' M Rauh', ' S Zink', ' A Koch', ' M Weyand…']",, Intensive care …,,,4.0,,197.0,2022-03-19
Stefan Zink,"Invest, expropriate, or wait? Expected income and the demand for redistribution",2000.0,"['P Harms', ' S Zink ']",,,,,2.0,,,2022-03-19
Stefan Zink,"Klinische, immun-und ligandohistochemische Untersuchung von Primärtumor und korrespondierender Lungenmetastase bei Patienten mit kolorektalem Karzinom …",2002.0,['SM Zink '],,,,,,,,2022-03-19
Stefan Zink,Generic open source gamification framework,2014.0,['S Zink'],, FHWS Science Journal,,,,,14.0,2022-03-19
Stefan Zink,Pilotstudie zur experimentellen Kombinationstherapie von Ig-Apherese und Omalizumab bei schwerem Atopischem Ekzem mit erhöhten IgE-Spiegeln,2012.0,['AGS Zink '],,,,,,,,2022-03-19
Ernst Deuer,"Die Panelstudie „Studienverlauf–Weichenstellungen, Erfolgskriterien und Hürden im Verlauf des Studiums an der DHBW “",2017.0,"['E Deuer', ' S Wild', ' S Schäfer']",,Walkmann,,,19.0,,,2022-03-19
Ernst Deuer,Studienverlauf und Studienerfolg im Kontext des dualen Studiums,2020.0,"['E Deuer', ' T Meyer']",, Ergebnisse einer Längsschnittstudie. Bielefeld: wbv …,,,4.0,,,2022-03-19
Ernst Deuer,[BOOK][B] Validierung eines Instruments zur Erfassung der Studienabbruchneigung bei dual Studierenden,2018.0,"['E Deuer', ' S Wild ']",,,,,8.0,,,2022-03-19
Ernst Deuer,Studienerfolgsverständnis von hauptamtlichen Lehrkräften im Studienbereich Wirtschaft der Dualen Hochschule Baden-Württemberg (DHBW)–Ein …,2018.0,"['S Wild', ' E Deuer', ' P Pohlenz']",, Zeitschrift für Evaluation,,,5.0,k.R.,6.0,2022-03-19
Ernst Deuer,[BOOK][B] Die Messung der Abbruchneigung im Rahmen der ersten Erhebungswelle des DHBW-Studierendenpanels,2017.0,"['E Deuer', ' S Wild ']",,,,,6.0,,,2022-03-19
Ernst Deuer,Abbruchneigung erkennen–Ausbildungsabbrüche verhindern,2003.0,['E Deuer'],,,,,9.0,,,2022-03-19
Ernst Deuer,"[BOOK][B] Akzeptable Schwundquote im dualen Studium aus der Perspektive von Professor* innen, Studierenden und dualen Partnern",2017.0,"['E Deuer', ' S Wild ']",,,,,6.0,,,2022-03-19
Ernst Deuer,[BOOK][B] Das duale Studium aus der Sicht der dualen Partner: Konzeption und Eckdaten einer empirischen Untersuchung,2017.0,"['E Deuer', ' S Wild ']",,,,,5.0,,,2022-03-19
Ernst Deuer,"Ausbildungsabbrüche-Ursachen, Folgen und Handlungsfelder",2015.0,['E Deuer'],, … . Fachkräfterekrutierung am Übergang Schule–Beruf,,,5.0,,,2022-03-19
Ernst Deuer,[BOOK][B] Studienbedingungen und Studienabbruchneigung-ein Erklärungsmodell,2018.0,"['E Deuer', ' S Wild ']",,,,,6.0,,,2022-03-19
Ernst Deuer,Gratifikationskrisen im Kontext des dualen Studiums,2017.0,['E Deuer'],, Ursachen,,,4.0,,,2022-03-19
Ernst Deuer,[BOOK][B] Der Theorie-Praxis-Bezug aus der Sicht der Studierenden,2017.0,"['E Deuer', ' S Wild ']",,,,,4.0,,,2022-03-19
Ernst Deuer,Work-Life-Balance in Ausbildung und Studium,2013.0,['E Deuer '],,,,,5.0,,,2022-03-19
Ernst Deuer,Berufsorientierung aus Unternehmenssicht,2015.0,"['T Brüggemann', ' E Deuer']",, Fachkräfterekrutierung am Übergang …,,,3.0,,,2022-03-19
Ernst Deuer,[BOOK][B] Studiennoten im Kontext des dualen Studiums-Zusammenhänge und potentielle Wirkungsfaktoren,2018.0,"['E Deuer', ' S Wild ']",,,,,3.0,,,2022-03-19
Ernst Deuer,Theorie-Praxis-Verzahnung im dualen Studium: Ein konzeptioneller Forschungsbeitrag,2021.0,"['V Gerstung', ' E Deuer']",, Zeitschrift für Hochschulentwicklung,,,,k.R.,,2022-03-19
Ernst Deuer,Nachwuchskräfte zeitgemäß führen,2020.0,['E Deuer'],, Human Digital Work–Eine Utopie?,,,1.0,,,2022-03-19
Ernst Deuer,Das Studienverlaufspanel an der DHBW,2020.0,"['E Deuer', ' T Meyer', ' R Walkmann…']",, … und Studienerfolg im …,,,1.0,,,2022-03-19
