AUTHOR_NAME,PUB_TITLE,PUB_YEAR,PUB_AUTHORS,PUB_PUBLISHER,PUB_CITATIONS,UPDATED
Maren+Müller,A defect in BRI1-EMS-SUPPRESSOR 1 (bes1)-mediated brassinosteroid signaling increases photoinhibition and photo-oxidative stress during heat stress in Arabidopsis,2020,"['A Setsungnern', ' P Muñoz', ' M Pérez-Llorca', ' M Müller', ' P Thiravetyan', ' ...']",Plant science,15,2022-05-02
Maren+Müller,,2018,"['D Souza Dias', ' L Monteiro Ribeiro', ' P Sérgio Nascimento Lopes', ' ...']",Annals of botany,15,2022-05-02
Maren+Müller,Phytohormones and the regulation of stress tolerance in plants: current status and future directions,2017,"['VP Singh', ' SM Prasad', ' S Munné-Bosch', ' M Müller']",Frontiers in plant science,15,2022-05-02
Maren+Müller,Foes or friends: ABA and ethylene interaction under abiotic stress,2021,['M Müller'],Plants,13,2022-05-02
Maren+Müller,"Linking jasmonates with pigment accumulation and photoprotection in a high-mountain endemic plant, Saxifraga longifolia",2018,"['A Cotado', ' M Müller', ' M Morales', ' S Munné-Bosch']",Environmental and Experimental Botany,13,2022-05-02
Maren+Müller,"Ethylene signaling cross-talk with other hormones in Arabidopsis thaliana exposed to contrasting phosphate availability: Differential effects in roots, leaves and fruits",2018,"['S Munné-Bosch', ' B Simancas', ' M Müller']",Journal of plant physiology,12,2022-05-02
Maren+Müller,The decapping activator Edc3 and the Q/N-rich domain of Lsm4 function together to enhance mRNA stability and alter mRNA decay pathway dependence in Saccharomyces cerevisiae,2016,"['S Huch', ' M Müller', ' M Muppavarapu', ' J Gommlich', ' V Balagopal', ' T Nissan']",Biology open,11,2022-05-02
Maren+Müller,"Bud vigor, budburst lipid peroxidation, and hormonal changes during bud development in healthy and moribund beech (Fagus sylvatica L.) trees",2015,"['M Juvany', ' M Müller', ' S Munné-Bosch']",Trees,11,2022-05-02
Maren+Müller,Vitamin E and defense-related phytohormones are reliable markers of embryo growth in macaw palm fruits exposed to various storage conditions,2014,"['LC Barreto', ' QS Garcia', ' M Morales', ' M Müller', ' S Munné-Bosch']",Plant Cell,11,2022-05-02
Maren+Müller,,2017,"['L Siles', ' M Müller', ' J Cela', ' I Hernández', ' L Alegre', ' S Munné-Bosch']",Plant Ecology & Diversity,10,2022-05-02
Maren+Müller,Phosphate starvation during the transition phase increases the sex ratio and 12-oxo-phytodienoic acid contents in females of Urtica dioica,2018,"['B Simancas', ' A Cotado', ' M Müller', ' S Munné-Bosch']",Environmental and experimental botany,9,2022-05-02
Maren+Müller,Vitamin E in legume nodules: Occurrence and antioxidant function,2020,"['D Soba', ' M Müller', ' I Aranjuelo', ' S Munné-Bosch']",Phytochemistry,8,2022-05-02
Maren+Müller,AsA/DHA redox pair influencing plant growth and stress tolerance,2017,"['JA Miret', ' M Müller']",Ascorbic Acid in Plant Growth,8,2022-05-02
Maren+Müller,Application of a rapid and sensitive method for hormonal and vitamin E profiling reveals crucial regulatory mechanisms in flower senescence and fruit ripening,2014,"['JA Miret', ' J Cela', ' LA Bezerra', ' L Arrom', ' M Juvany', ' M Müller', ' ...']",Journal of plant growth regulation,8,2022-05-02
Maren+Müller,Interactions between sucrose and jasmonate signalling in the response to cold stress,2020,"['A Wingler', ' V Tijero', ' M Müller', ' B Yuan', ' S Munné-Bosch']",BMC plant biology,7,2022-05-02
Maren+Müller,"Leaf orientation as part of the leaf developmental program in the semi-deciduous shrub, Cistus albidus L.: Diurnal, positional, and photoprotective effects during winter",2019,"['M Pérez-Llorca', ' A Casadesús', ' M Müller', ' S Munné-Bosch']",Frontiers in Plant Science,6,2022-05-02
Maren+Müller,MaMADS2 repression in banana fruits modifies hormone synthesis and signalling pathways prior to climacteric stage,2018,"['E Yakir', ' F Zhangjun', ' N Sela', ' Y Xu', ' V Singh', ' A Dagar', ' JR Joshi', ' M Müller', ' ...']",BMC plant biology,6,2022-05-02
Maren+Müller,"Tocotrienols in plants: occurrence, biosynthesis, and function",2013,"['M Müller', ' J Cela', ' MA Asensi-Fabado', ' S Munné-Bosch']",Tocotrienols: Vitamin E beyond Tocopherols. ed. CRC Press Taylor …,6,2022-05-02
Maren+Müller,Hormone profiling in plant tissues,2017,"['M Müller', ' S Munné-Bosch']",Plant Hormones,5,2022-05-02
Maren+Müller,,2021,"['Z Zuo', ' ME Roux', ' HP Sæmundsson', ' M Müller', ' S Munne Bosch', ' ...']",FEBS letters,4,2022-05-02
Maren+Müller,Abscisic acid responses match the different patterns of autumn senescence in roots and leaves of Iris versicolor and Sparganium emersum,2020,"['P Ryser', ' S Puig', ' M Müller', ' S Munné-Bosch']",Environmental and Experimental Botany,3,2022-05-02
Maren+Müller,Contrasting patterns of hormonal and photoprotective isoprenoids in response to stress in Cistus albidus during a Mediterranean winter,2019,"['M Pérez-Llorca', ' A Casadesús', ' S Munné-Bosch', ' M Müller']",Planta,3,2022-05-02
Maren+Müller,Inter-individual and sun orientation driven variability reveals antagonistic salicylate and jasmonate accumulation in white-leaved rockrose,2019,"['M Perez-Llorca', ' A Casadesus', ' M Mueller', ' S Munné-Bosch']",Environmental and Experimental Botany,3,2022-05-02
Maren+Müller,Formation of antioxidants and essential oil in sage and rosemary grown under Mediterranean and Central European climate,2004,['M Müller'],Dissertation. de,3,2022-05-02
Maren+Müller,,2021,"['M Pérez-Llorca', ' V Caselles', ' M Müller', ' S Munné-Bosch']",Tree Physiology,1,2022-05-02
Maren+Müller,"Foes or Friends: ABA and Ethylene Interaction under Abiotic Stress. Plants 2021, 10, 448",2021,['M Müller'],s Note: MDPI stays neutral with regard to jurisdictional claims in published …,,2022-05-02
Maren+Müller,Protein kinase CK2 mediates cross talk between auxin-and salicylic acid-signaling pathways in Arabidopsis,2015,"['MC Martinez', ' L Armengot', ' MM Marques-Bueno', ' A Soria-Garcia', ' ...']",FEBS JOURNAL,,2022-05-02
Maren+Müller,Hormonal cross-talk in plant devel,2013,"['S Munné-Bosch', ' M Müller']",,,2022-05-02
Maren+Müller,Bildung von phenolischen Diterpenen in Salvia officinalis L. Pflanzen,,"['M Müllera', ' S Munné-Boschb', ' L Alegreb', ' K Schwarza']",,,2022-05-02
Patrick+Roßmann,[BOOK][B] Management kleiner und mittlerer Unternehmen,2015,"['P Haag', ' P Roßmann ']",,11.0,2022-05-02
Patrick+Roßmann,[BOOK][B] Stärkung von Retailer Brands im Automobilhandel zur Steigerung der Kundenloyalität,2019,['P Roßmann '],,3.0,2022-05-02
Patrick+Roßmann,kleiner und mittlerer Unternehmen,,"['P Haag', ' P Roßmann ']",,,2022-05-02
Patrick+Roßmann,Handlungsempfehlungen,2019,['P Roßmann'], Stärkung von Retailer Brands im Automobilhandel zur …,,2022-05-02
Patrick+Roßmann,Retailer Brands im Automobilhandel als zentraler Untersuchungsgegenstand,2019,['P Roßmann'], Stärkung von Retailer Brands im Automobilhandel zur …,,2022-05-02
Patrick+Roßmann,Empirische Untersuchung zur Wirkung von Manufacturer Brands auf Retailer Brands,2019,['P Roßmann'], Stärkung von Retailer Brands im Automobilhandel zur …,,2022-05-02
Patrick+Roßmann,Theoretische Grundlagen und Herleitung des Untersuchungsmodells,2019,['P Roßmann'], Stärkung von Retailer Brands im Automobilhandel zur …,,2022-05-02
Patrick+Roßmann,"Kapitel 1: KMU–Stärken und Schwächen, Chancen und Risiken",2015,"['P Haag', ' P Roßmann']", Management kleiner und mittlerer …,,2022-05-02
Wilhelm+Ruckdeschel,Modelling of pilot behaviour using Petri nets,1994,"['W Ruckdeschel', ' R Onken']", … Conference on Application and Theory of Petri …,31.0,2022-05-02
Wilhelm+Ruckdeschel,Evaluation of intelligent on-board pilot assistance in in-flight field trials,1995,"['T Prévôt', ' M Gerlach', ' W Ruckdeschel', ' T Wittig…']", IFAC Proceedings …,25.0,2022-05-02
Wilhelm+Ruckdeschel,The cockpit assistant system cassy-design and in-flight evaluation,1995,"['M Gerlach', ' R Onken', ' T Prevot…']", Advances in Human …,3.0,2022-05-02
Wilhelm+Ruckdeschel,TAV-2021: Herausforderungen beim Testen moderner Softwaresysteme,2021,"['D Sokenou', ' M Friske', ' B Güldali', ' D Faragó', ' M Winter…']", INFORMATIK,,2022-05-02
Wilhelm+Ruckdeschel,Beteiligungsaufruf zur Studie „Wirtschaftlichkeitsaspekte in Softwaretestprojekten “,,"['W Ruckdeschel', ' DHBWD Ravensburg ']",,,2022-05-02
Wilhelm+Ruckdeschel,Frühe Maschinen auf Burgen und Schlössern: Erster Teil,1983,['W Ruckdeschel'],,,2022-05-02
Wilhelm+Ruckdeschel,Die Wasserkünste der Eremitage bei Bayreuth,1980,['W Ruckdeschel '],,,2022-05-02
Wilhelm+Ruckdeschel,Frühe Maschinen auf Burgen und Schlössern: Zweiter Teil,1983,['W Ruckdeschel'],,,2022-05-02
Gerhard+Hellstern,Analysis of a hybrid quantum network for classification tasks,2021,['G Hellstern'], IET Quantum Communication,1.0,2022-05-02
Gerhard+Hellstern,"Bashford, Jim University of Adelaide",1999,"['L Bland', ' S Brodsky', ' SC Choe', ' W Detmold…']", Future Directions In …,,2022-05-02
Gerhard+Hellstern,[BOOK][B] IT-Risiken in Banken: aufsichtliches Rahmenwerk für die digitale Transformation,2019,"['G Hellstern', ' P Buchmüller ']",,1.0,2022-05-02
Bernd+Rieger,Measuring image resolution in optical nanoscopy,2013,"['RPJ Nieuwenhuizen', ' KA Lidke', ' M Bates', ' DL Puig', ' D Grünwald', ' ...']",Nature methods,547,2022-05-02
Bernd+Rieger,"Fast, single-molecule localization that achieves theoretically minimum uncertainty",2010,"['CS Smith', ' N Joseph', ' B Rieger', ' KA Lidke']",Nature methods,503,2022-05-02
Bernd+Rieger,Superresolution by localization of quantum dots using blinking statistics,2005,"['KA Lidke', ' B Rieger', ' TM Jovin', ' R Heintzmann']",Optics express,398,2022-05-02
Bernd+Rieger,Super-resolution imaging visualizes the eightfold symmetry of gp210 proteins around the nuclear pore complex and resolves the central channel with nanometer resolution,2012,"['A Löschberger', ' S van de Linde', ' MC Dabauvalle', ' B Rieger', ' M Heilemann', ' ...']",Journal of cell science,,2022-05-02
Bernd+Rieger,Super-resolution imaging visualizes the eightfold symmetry of gp210 proteins around the nuclear pore complex and resolves the central channel with nanometer resolution,2012,"['A Löschberger', ' S van de Linde', ' MC Dabauvalle', ' B Rieger', ' M Heilemann', ' ...']",Journal of cell science,283,2022-05-02
Bernd+Rieger,Reaching out for signals: filopodia sense EGF and respond by directed retrograde transport of activated receptors,2005,"['DS Lidke', ' KA Lidke', ' B Rieger', ' TM Jovin', ' DJ Arndt-Jovin']",The Journal of cell biology,270,2022-05-02
Bernd+Rieger,Accuracy of the Gaussian point spread function model in 2D localization microscopy,2010,"['S Stallinga', ' B Rieger']",Optics express,222,2022-05-02
Bernd+Rieger,Super-resolution fight club: assessment of 2D and 3D single-molecule localization microscopy software,2019,"['D Sage', ' TA Pham', ' H Babcock', ' T Lukes', ' T Pengo', ' J Chao', ' R Velmurugan', ' ...']",Nature methods,194,2022-05-02
Bernd+Rieger,The persistence length of double stranded DNA determined using dark field tethered particle motion,2009,"['S Brinkers', ' HRC Dietrich', ' FH de Groote', ' IT Young', ' B Rieger']",The Journal of chemical physics,142,2022-05-02
Bernd+Rieger,ERK Nuclear Translocation Is Dimerization-independent but Controlled by the Rate of Phosphorylation*♦,2010,"['DS Lidke', ' F Huang', ' JN Post', ' B Rieger', ' J Wilsbacher', ' JL Thomas', ' ...']",Journal of Biological Chemistry,126,2022-05-02
Bernd+Rieger,The Lateral and Axial Localization Uncertainty in Super‐Resolution Light Microscopy,2014,"['B Rieger', ' S Stallinga']",ChemPhysChem,102,2022-05-02
Bernd+Rieger,Localization microscopy at doubled precision with patterned illumination,2020,"['J Cnossen', ' T Hinsdale', ' RØ Thorsen', ' M Siemons', ' F Schueder', ' ...']",Nature methods,90,2022-05-02
Bernd+Rieger,One-and two-photon photoactivation of a paGFP-fusion protein in live Drosophila embryos,2005,"['JN Post', ' KA Lidke', ' B Rieger', ' DJ Arndt-Jovin']",FEBS letters,86,2022-05-02
Bernd+Rieger,When to use the projection assumption and the weak-phase object approximation in phase contrast cryo-EM,2014,"['M Vulović', ' LM Voortman', ' LJ van Vliet', ' B Rieger']",Ultramicroscopy,83,2022-05-02
Bernd+Rieger,Image formation modeling in cryo-electron microscopy,2013,"['M Vulović', ' RBG Ravelli', ' LJ van Vliet', ' AJ Koster', ' I Lazić', ' U Lücken', ' ...']",Journal of structural biology,79,2022-05-02
Bernd+Rieger,The role of photon statistics in fluorescence anisotropy imaging,2005,"['KA Lidke', ' B Rieger', ' DS Lidke', ' TM Jovin']",IEEE Transactions on Image Processing,76,2022-05-02
Bernd+Rieger,DIPimage user manual: a scientific image processing toolbox,2001,"['CLL Hendriks', ' LJ Van Vliet']",,71,2022-05-02
Bernd+Rieger,Method for determining distortions in a particle-optical apparatus,2013,"['B Rieger', ' M Van Der Stam']",US Patent,,2022-05-02
Bernd+Rieger,Method for determining distortions in a particle-optical apparatus,2013,"['B Rieger', ' M Van Der Stam']",US Patent,,2022-05-02
Bernd+Rieger,Method for determining distortions in a particle-optical apparatus,2013,"['B Rieger', ' M Van Der Stam']",US Patent,68,2022-05-02
Bernd+Rieger,Quantitative localization microscopy: effects of photophysics and labeling stoichiometry,2015,"['RPJ Nieuwenhuizen', ' M Bates', ' A Szymborska', ' KA Lidke', ' B Rieger', ' ...']",PloS one,60,2022-05-02
Bernd+Rieger,Deconvolution methods for structured illumination microscopy,2016,"['N Chakrova', ' B Rieger', ' S Stallinga']",JOSA A,57,2022-05-02
Bernd+Rieger,On curvature estimation of ISO surfaces in 3D gray-value images and the computation of shape descriptors,2004,"['B Rieger', ' FJ Timmermans', ' LJ Van Vliet', ' PW Verbeek']",IEEE Transactions on Pattern Analysis and Machine Intelligence,54,2022-05-02
Bernd+Rieger,Ring formation in nanoliter cups: Quantitative measurements of flow in micromachined wells,2003,"['B Rieger', ' LR Van den Doel', ' LJ Van Vliet']",Physical Review E,51,2022-05-02
Bernd+Rieger,Position and orientation estimation of fixed dipole emitters using an effective Hermite point spread function model,2012,"['S Stallinga', ' B Rieger']",Optics express,50,2022-05-02
Bernd+Rieger,Nuclear accessibility of β-actin mRNA is measured by 3D single-molecule real-time tracking,2015,"['CS Smith', ' S Preibisch', ' A Joseph', ' S Abrahamsson', ' B Rieger', ' E Myers', ' ...']",Journal of Cell Biology,49,2022-05-02
Bernd+Rieger,Fully automatic evaluation of the corneal endothelium from in vivo confocal microscopy,2015,"['B Selig', ' KA Vermeer', ' B Rieger', ' T Hillenaar', ' CL Luengo Hendriks']",BMC medical imaging,47,2022-05-02
Bernd+Rieger,Phasor based single-molecule localization microscopy in 3D (pSMLM-3D): An algorithm for MHz localization rates using standard CPUs,2018,"['KJA Martens', ' AN Bader', ' S Baas', ' B Rieger', ' J Hohlbein']",The Journal of chemical physics,44,2022-05-02
Bernd+Rieger,X-ray micro tomography and image analysis as complementary methods for morphological characterization and coating thickness measurement of coated particles,2010,"['G Perfetti', ' E Van de Casteele', ' B Rieger', ' WJ Wildeboer', ' GMH Meesters']",Advanced Powder Technology,44,2022-05-02
Bernd+Rieger,Resolution improvement by 3D particle averaging in localization microscopy,2015,"['J Broeken', ' H Johnson', ' DS Lidke', ' S Liu', ' RPJ Nieuwenhuizen', ' S Stallinga', ' ...']",Methods and applications in fluorescence,43,2022-05-02
Bernd+Rieger,Quantitative assessment of gas cell development during the proofing of dough by magnetic resonance imaging and image analysis,2003,"['JPM van Duynhoven', ' GMP van Kempen', ' R van Sluis', ' B Rieger', ' ...']",Cereal Chemistry,42,2022-05-02
Bernd+Rieger,DNA deformations near charged surfaces: electron and atomic force microscopy views,2009,"['FGA Faas', ' B Rieger', ' LJ Van Vliet', ' DI Cherny']",Biophysical journal,41,2022-05-02
Bernd+Rieger,Studying different illumination patterns for resolution improvement in fluorescence microscopy,2015,"['N Chakrova', ' R Heintzmann', ' B Rieger', ' S Stallinga']",Optics express,40,2022-05-02
Bernd+Rieger,Biological applications of an LCoS-based programmable array microscope (PAM),2007,"['GM Hagen', ' W Caarls', ' M Thomas', ' A Hill', ' KA Lidke', ' B Rieger', ' C Fritsch', ' ...']",Imaging,39,2022-05-02
Bernd+Rieger,Alignment of the cell nucleus from labeled proteins only for 4D in vivo imaging,2004,"['B Rieger', ' C Molenaar', ' RW Dirks', ' LJ Van Vliet']",Microscopy research and technique,37,2022-05-02
Bernd+Rieger,Curvature of n-dimensional space curves in grey-value images,2002,"['B Rieger', ' LJ Van Vliet']",IEEE Transactions on Image Processing,36,2022-05-02
Bernd+Rieger,Template-free 2D particle fusion in localization microscopy,2018,"['H Heydarian', ' F Schueder', ' MT Strauss', ' B Van Werkhoven', ' M Fazel', ' ...']",Nature methods,35,2022-05-02
Bernd+Rieger,Probability-based particle detection that enables threshold-free and robust in vivo single-molecule tracking,2015,"['CS Smith', ' S Stallinga', ' KA Lidke', ' B Rieger', ' D Grunwald']",Molecular biology of the cell,31,2022-05-02
Bernd+Rieger,"A fast algorithm for computing and correcting the CTF for tilted, thick specimens in TEM",2011,"['LM Voortman', ' S Stallinga', ' RHM Schoenmakers', ' LJ van Vliet', ' B Rieger']",Ultramicroscopy,31,2022-05-02
Bernd+Rieger,Minimizing light exposure with the programmable array microscope,2011,"['W Caarls', ' B Rieger', ' AHB De Vries', ' DJ Arndt‐Jovin', ' TM Jovin']",Journal of microscopy,28,2022-05-02
Bernd+Rieger,A toolkit for the characterization of CCD cameras for transmission electron microscopy,2010,"['M Vulovic', ' B Rieger', ' LJ Van Vliet', ' AJ Koster', ' RBG Ravelli']",Acta Crystallographica Section D: Biological Crystallography,28,2022-05-02
Bernd+Rieger,A systematic approach to nD orientation representation,2004,"['B Rieger', ' LJ Van Vliet']",Image and Vision Computing,28,2022-05-02
Bernd+Rieger,Simultaneous measurement of position and color of single fluorescent emitters using diffractive optics,2014,"['J Broeken', ' B Rieger', ' S Stallinga']",Optics letters,27,2022-05-02
Bernd+Rieger,Precise and unbiased estimation of astigmatism and defocus in transmission electron microscopy,2012,"['M Vulović', ' E Franken', ' RBG Ravelli', ' LJ van Vliet', ' B Rieger']",Ultramicroscopy,27,2022-05-02
Bernd+Rieger,Co-orientation: quantifying simultaneous co-localization and orientational alignment of filaments in light microscopy,2015,"['RPJ Nieuwenhuizen', ' L Nahidiazar', ' EMM Manders', ' K Jalink', ' S Stallinga', ' ...']",PloS one,25,2022-05-02
Bernd+Rieger,Automated podosome identification and characterization in fluorescence microscopy images,2013,"['MBM Meddens', ' B Rieger', ' CG Figdor', ' A Cambi', ' K Van Den Dries']",Microscopy and microanalysis,25,2022-05-02
Bernd+Rieger,,2008,"['V Castaldo', ' CW Hagen', ' B Rieger', ' P Kruit']",Journal of Vacuum Science & Technology B: Microelectronics and Nanometer …,25,2022-05-02
Bernd+Rieger,Development of a DMD-based fluorescence microscope,2015,"['N Chakrova', ' B Rieger', ' S Stallinga']",Three-Dimensional and Multidimensional Microscopy: Image Acquisition and …,23,2022-05-02
Bernd+Rieger,The effect of background on localization uncertainty in single emitter imaging,2012,"['S Stallinga', ' B Rieger']",IEEE International Symposium on Biomedical Imaging (ISBI),23,2022-05-02
Bernd+Rieger,Calibrating photon counts from a single image,2016,"['R Heintzmann', ' PK Relich', ' RPJ Nieuwenhuizen', ' KA Lidke', ' B Rieger']",arXiv preprint,22,2022-05-02
Bernd+Rieger,"Fast, spatially varying CTF correction in TEM",2012,"['LM Voortman', ' EM Franken', ' LJ van Vliet', ' B Rieger']",Ultramicroscopy,22,2022-05-02
Bernd+Rieger,Adaptive illumination reduces photobleaching in structured illumination microscopy,2016,"['N Chakrova', ' AS Canton', ' C Danelon', ' S Stallinga', ' B Rieger']",Biomedical Optics Express,21,2022-05-02
Bernd+Rieger,,2003,"['B Rieger', ' LJ van Vliet']",International Conference on Computer Analysis of Images and Patterns,19,2022-05-02
Bernd+Rieger,Diffusion of microspheres in sealed and open microarrays,2004,"['B Rieger', ' HRC Dietrich', ' LRVD Doel', ' LJV Vliet']",Microscopy research and technique,18,2022-05-02
Bernd+Rieger,Quantifying resolution limiting factors in subtomogram averaged cryo-electron tomography using simulations,2014,"['LM Voortman', ' M Vulović', ' M Maletta', ' A Voigt', ' EM Franken', ' A Simonetti', ' ...']",Journal of structural biology,17,2022-05-02
Bernd+Rieger,Photon yield enhancement of red fluorophores at cryogenic temperatures,2018,"['CN Hulleman', ' W Li', ' I Gregor', ' B Rieger', ' J Enderlein']",ChemPhysChem,16,2022-05-02
Bernd+Rieger,Image processing and analysis for single-molecule localization microscopy: Computation for nanoscale imaging,2014,"['B Rieger', ' R Nieuwenhuizen', ' S Stallinga']",IEEE Signal Processing Magazine,16,2022-05-02
Bernd+Rieger,18 Visualization and Resolution in Localization Microscopy,2014,"['RPJ Nieuwenhuizen', ' S Stallinga', ' B Rieger']",Cell Membrane Nanodomains: From Biochemistry to Nanoscopy,16,2022-05-02
Bernd+Rieger,Tethered particle motion mediated by scattering from gold nanoparticles and darkfield microscopy,2009,"['HRC Dietrich', ' B Rieger', ' FGM Wiertz', ' FH De Groote', ' HA Heering', ' ...']",Journal of Nanophotonics,15,2022-05-02
Bernd+Rieger,A hybrid total internal reflection fluorescence and optical tweezers microscope to study cell adhesion and membrane protein dynamics of single living cells,2009,"['MI Snijder‐Van AS', ' B Rieger', ' B Joosten', ' V Subramaniam', ' CG Figdor', ' ...']",Journal of microscopy,15,2022-05-02
Bernd+Rieger,Method for determining the aberration coefficients of the aberration function of a particle-optical lens,2009,"['MJ van der Zande', ' C Kok', ' B Rieger']",US Patent,,2022-05-02
Bernd+Rieger,Method for determining the aberration coefficients of the aberration function of a particle-optical lens,2009,"['MJ van der Zande', ' C Kok', ' B Rieger']",US Patent,,2022-05-02
Bernd+Rieger,Method for determining the aberration coefficients of the aberration function of a particle-optical lens,2009,"['MJ van der Zande', ' C Kok', ' B Rieger']",US Patent,,2022-05-02
Bernd+Rieger,Method for determining the aberration coefficients of the aberration function of a particle-optical lens,2009,"['MJ van der Zande', ' C Kok', ' B Rieger']",US Patent,,2022-05-02
Bernd+Rieger,Method for determining the aberration coefficients of the aberration function of a particle-optical lens,2009,"['MJ van der Zande', ' C Kok', ' B Rieger']",US Patent,12,2022-05-02
Bernd+Rieger,DIPimage user manual,2002,"['CLL Hendriks', ' LJ van Vliet', ' B Rieger', ' M van Ginkel']",,11,2022-05-02
Bernd+Rieger,Simultaneous orientation and 3D localization microscopy with a Vortex point spread function,2021,"['CN Hulleman', ' RØ Thorsen', ' E Kim', ' C Dekker', ' S Stallinga', ' B Rieger']",Nature communications,9,2022-05-02
Bernd+Rieger,3D particle averaging and detection of macromolecular symmetry in localization microscopy,2021,"['H Heydarian', ' M Joosten', ' A Przybylski', ' F Schueder', ' R Jungmann', ' ...']",Nature communications,9,2022-05-02
Bernd+Rieger,Automatic correction of nonlinear damping effects in HAADF–STEM tomography for nanomaterials of discrete compositions,2018,"['Z Zhong', ' R Aveyard', ' B Rieger', ' S Bals', ' WJ Palenstijn', ' KJ Batenburg']",Ultramicroscopy,8,2022-05-02
Bernd+Rieger,Dynamics of Membrane Receptors: Single‐molecule Tracking of Quantum Dot Liganded Epidermal Growth Factor,2008,"['GM Hagen', ' KA Lidke', ' B Rieger', ' DS Lidke', ' W Caarls', ' DJ Arndt‐Jovin', ' ...']",Single Molecule Dynamics in Life Science,8,2022-05-02
Bernd+Rieger,Impact of optical aberrations on axial position determination by photometry,2018,"['RØ Thorsen', ' CN Hulleman', ' M Hammer', ' D Grünwald', ' S Stallinga', ' ...']",Nature methods,7,2022-05-02
Bernd+Rieger,Method for adjusting a stem equipped with an aberration corrector,2015,"['M Bischoff', ' B Rieger']",US Patent,,2022-05-02
Bernd+Rieger,Method for adjusting a stem equipped with an aberration corrector,2015,"['M Bischoff', ' B Rieger']",US Patent,,2022-05-02
Bernd+Rieger,Method for adjusting a stem equipped with an aberration corrector,2015,"['M Bischoff', ' B Rieger']",US Patent,7,2022-05-02
Bernd+Rieger,Superresolution with quantum dots: enhanced localization in fluorescence microscopy by exploitation of quantum dot blinking,2005,"['KA Lidke', ' B Rieger', ' TM Jovin', ' R Heintzmann']",,7,2022-05-02
Bernd+Rieger,Three dimensional particle averaging for structural imaging of macromolecular complexes by localization microscopy,2019,"['H Heydarian', ' A Przybylski', ' F Schueder', ' R Jungmann', ' B Van Werkhoven', ' ...']",bioRxiv,6,2022-05-02
Bernd+Rieger,Tilt series STEM simulation of a 25× 25× 25 nm semiconductor with characteristic X-ray emission,2016,"['R Aveyard', ' B Rieger']",Ultramicroscopy,6,2022-05-02
Bernd+Rieger,Method to determine image sharpness and resolution in Scanning Electron Microscopy images,2008,"['B Rieger', ' GN Veen']",EMC European Microscopy Congress September,6,2022-05-02
Bernd+Rieger,Curvature estimation of surfaces in 3D grey-value images,2002,"['B Rieger', ' FJ Timmermans', ' LJ van Vliet', ' PW Verbeek']",Object recognition supported by user interaction for service robots,6,2022-05-02
Bernd+Rieger,Estimation of curvature on surfaces in 3D grey-value images,2002,"['B Rieger', ' FJ Timmermans', ' LJ Van Vliet']",Proc ASCI,6,2022-05-02
Bernd+Rieger,Detecting structural heterogeneity in single-molecule localization microscopy data,2021,"['TAPM Huijben', ' H Heydarian', ' A Auer', ' F Schueder', ' R Jungmann', ' ...']",Nature Communications,5,2022-05-02
