AUTHOR_NAME,PUB_TITLE,PUB_YEAR,PUB_AUTHORS,PUB_TYPE,PUB_PUBLISHER,PUB_ISBN,PUB_DOI,PUB_CITATIONS,JOU_RATING_VHB,JOU_RATING_SCIMAGO,UPDATED
Frank Lehmann,Elevation of extracellular osmolarity improves signs of myotonia congenita in vitro: a preclinical animal study,2019.0,"['K Hoppe', ' S Chaiklieng', ' F Lehmann‐Horn…']",, The Journal of …,,,3.0,C,299.0,2022-02-22
Frank Lehmann,Myotonia in DNM2-related centronuclear myopathy,2014.0,"['R Dabby', ' M Sadeh', ' R Gilad', ' K Jurkat']",,,,,6.0,,,2022-02-22
Frank Lehmann,"[HTML][HTML] 6-Amino-1-benzyl-4-(4-chlorophenyl)-3-(4-pyridyl)-1, 4-dihydropyrano [2, 3-c] pyrazole-5-carbonitrile",2008.0,"['F Lehmann', ' D Schollmeyer', ' S Laufer']",, … Crystallographica Section E …,,,3.0,,13.0,2022-02-22
Frank Lehmann,[HTML][HTML] A gating model for wildtype and R1448H Nav1. 4 channels in paramyotonia,2014.0,"['B Holzherr', ' F Lehmann']",,Horn,,,5.0,,,2022-02-22
Frank Lehmann,Adaptation of building extraction rule sets derived from MFC3 and UltraCamD arial image data sets,2009.0,"['AM Trosset', ' T Bucher…']",, Remote Sensing for …,,,3.0,,124.0,2022-02-22
Frank Lehmann,[HTML][HTML] Paxilline Prevents the Onset of Myotonic Stiffness in Pharmacologically Induced Myotonia: A Preclinical Investigation,2020.0,"['K Hoppe', ' T Sartorius', ' S Chaiklieng…']",, Frontiers in …,,,,,133.0,2022-02-22
Frank Lehmann,Sight: automating genomic data-mining without programming skills,2004.0,"['A Meskauskas', ' F Lehmann']",,Horn,,,8.0,,,2022-02-22
Frank Lehmann,Reviewing in science requires quality criteria and professional reviewers,2004.0,['K Jurkat'],,Rott,,,6.0,,,2022-02-22
Frank Lehmann,Motorische Systeme,2010.0,['F Lehmann'],,,,,19.0,,,2022-02-22
Frank Lehmann,A compact very high resolution camera (VHRC) for earth and planetary exploration using a large array (7k× 8k) CCD,1999.0,"['HG Grothues', ' F Lehmann', ' H Michaelis', ' G Neukum…']",, Acta astronautica,,,3.0,,83.0,2022-02-22
Frank Lehmann,Kristallisierung und biochemische Eigenschaften von Glycerin-3-phosphat-Dehydrogenase aus menschlicher Leber,1968.0,"['FG LEHMANN', ' G PFLEIDERER ']",,,,,12.0,,,2022-02-22
Frank Lehmann,Hyperkalemic periodic paralysis type 1,1993.0,['K Jurkat'],,Rott,,,6.0,,,2022-02-22
Frank Lehmann,Die umfassende Bedeutung der Workflow-Management-Technologie.,1998.0,"['FR Lehmann', ' E Ortner']",, EMISA,,,9.0,,,2022-02-22
Frank Lehmann,Recovery of mechano-electrical transduction in rat cochlear hair bundles after postnatal destruction of the stereociliar cross-links,2010.0,"['J Ebert', ' S Fink', ' A Koitschev…']",, … of the Royal …,,,5.0,,771.0,2022-02-22
Frank Lehmann,[HTML][HTML] Successful treatment of periodic paralysis with coenzyme Q10: two case reports,2016.0,"['Y Da', ' L Lei', ' K Jurkat']",,Rott,,,4.0,,,2022-02-22
Frank Lehmann,Development of a sensor for monitoring mechanically stressed adhesive joints,2019.0,"['F Lehmann', ' S Chataigner', ' V Birtel', ' J Wang…']",, … and Building Materials,,,1.0,,164.0,2022-02-22
Frank Lehmann,Targeting high‐grade B cell lymphoma with CD19‐specific T cells,2014.0,"['FM Lehmann', ' A Maurberger', ' S Feicht…']",, … journal of cancer,,,2.0,D,299.0,2022-02-22
Frank Lehmann,Muscle channelopathies: myotonias and periodic paralyses,2015.0,['K Jurkat'],,Rott,,,4.0,,,2022-02-22
Frank Lehmann,"Ressourcen, Resilienz, Respekt–Wo stehen die kindheitsbezogenen Hand-lungsfelder? Versuch eines Resumees",2013.0,"['R Geene', ' C Höppner…']",, Kinder stark machen …,,,5.0,,,2022-02-22
Frank Lehmann,"Perfluoroalkyl End-Functionalized Oligoesters: Correlation between Wettability and End-Group Segregation. Volume 40, Number 2, January 23, 2007, pp 297− 305.",2007.0,"['A Synytska', ' D Appelhans', ' Z Wang', ' F Simon…']",, …,,,2.0,,,2022-02-22
Frank Lehmann,"Skeletal muscle channelopathies: myotonias, periodic paralyses and malignant hyperthermia",2003.0,['F Lehmann'],,Horn,,,5.0,,,2022-02-22
Frank Lehmann,Safe Change Filter Systems for Containments in the Pharmaceutical Industry,2011.0,"['F Lehmann', ' J Lümkemann']",, Pharmazeutische Industrie,,,2.0,,18.0,2022-02-22
Frank Lehmann,Malignant hyperthermia: an inherited disorder of muscle calcium metabolism,2015.0,"['W Klingler', ' F Lehmann']",,,,,4.0,,,2022-02-22
Frank Lehmann,Neuromuscular disorders and malignant hyperthermia,1996.0,['F Lehmann'],,,,,5.0,,,2022-02-22
Frank Lehmann,Verstärkung von Stahlbrücken mit hochfestem Beton,2017.0,"['T Mansperger', ' T Lehmann', ' M Hofmann', ' M Krüger… ']",,,,,4.0,,,2022-02-22
Frank Lehmann,Faszien besitzen eine der glatten Muskulatur vergleichbare Kontraktionsfähigkeit und können so die muskuloskelettale Mechanik beeinflussen,2008.0,"['R Schleip', ' W Klingler', ' F Lehmann']",,,,,14.0,,,2022-02-22
Frank Lehmann,Chlorine (35Cl) Magnetic resonance imaging of the human brain and muscle,2012.0,"['AM Nagel', ' FM Meise', ' MA Weber…']",, Proceedings of the …,,,4.0,D,771.0,2022-02-22
Frank Lehmann,Life-threatening hyperthermic syndromes,1994.0,"['EF Hund', ' F Lehmann']",,Horn,,,4.0,,,2022-02-22
Frank Lehmann,[BOOK][B] Psychosomatik der Infertilität,2013.0,"['P Kemeter', ' F Lehmann ']",,,,,7.0,,,2022-02-22
Frank Lehmann,[BOOK][B] Generierung interaktiver 3D-Stadtinformations-systeme aus Daten der High Resolution Stereo Camera (HRSC) am Beispiel des 3D-Stadtplans München,2005.0,"['O Kranz', ' F Siegert', ' J Liebscher', ' F Lehmann… ']",,,,,6.0,,,2022-02-22
Frank Lehmann,Hydration Modeling for Improved Curing Process Prediction in Concrete Construction,2020.0,"['P Skalecki', ' S Idrizi', ' M Schreiner…']",, IEEE/ASME …,,,,,132.0,2022-02-22
Frank Lehmann,Modular photogrammetric sensor systems for real-time information extraction and 3d-applications,2016.0,"['T Bucher', ' R Berger', ' J Brauchle', ' D Hein…']",, … und Geoinformation eV,,,4.0,,,2022-02-22
Frank Lehmann,Principles of Electrophysiological In Vitro Measurements,2010.0,['F Lehmann'],,Horn,,,3.0,,,2022-02-22
Frank Lehmann,Prozessierung und elektrische Charakterisierung von ZnSe Heterostrukturen in verschiedenen Messgeometrien zum eindeutigen Nachweis der elektrischen …,2005.0,['F Lehmann '],,,,,5.0,,,2022-02-22
Frank Lehmann,Motorische Systeme,2007.0,['F Lehmann'],,,,,11.0,,,2022-02-22
Frank Lehmann,Schutzkonzept und Einsatz von tz von A Flexible and Scalable Isolator Platform for State of the Art Aseptic Processing,2017.0,"['HJ Bässler', ' F Haefele', ' F Lehmann']",, Pharm. Ind,,,1.0,,,2022-02-22
Frank Lehmann,A Becker myotonia patient with compound heterozygosity for CLCN1 mutations and Prinzmetal angina pectoris,2012.0,"['D Zielonka', ' K Jurkat']",,Rott,,,3.0,,,2022-02-22
Frank Lehmann,"Consolidated efforts to strengthen health promotion in living environments: The cooperation network"" Equity in Health""",2016.0,"['H Kilian', ' F Lehmann', ' A Richter']",,,,,1.0,,,2022-02-22
Frank Lehmann,Impedanzmessungen zum Monitoring von Feuchte und Salz an Bauwerken,2014.0,"['F Lehmann', ' M Krüger']",, Fachtagung Bauwerksdiagnose–Praktische …,,,4.0,,,2022-02-22
Frank Lehmann,One solver for all—A generic allocation concept for planning and shop floor control,2012.0,"['S Werner', ' F Lehmann', ' A Klemmt…']",, Proceedings of the …,,,1.0,D,771.0,2022-02-22
Frank Lehmann,High-Frequency Sources In Shallow Seismic Experiments,1998.0,"['M van der Veen', ' H Buness', ' F Nitsche…']",, … EEGS Symposium on …,,,1.0,,,2022-02-22
Frank Lehmann,Sustainable instrumentation of everyday commodities—Concepts and tools,2012.0,"['B Brandherm', ' A Kröner', ' J Haupert…']",, IEEE …,,,1.0,C,129.0,2022-02-22
Frank Lehmann,Very high resolution photogrammetric DSMs and true-orthoimages: 3D-fault zone mapping in Northern Chile,2012.0,"['T Bucher', ' O Zielke', ' P Victor', ' F Lehmann', ' O Onken ']",,,,,1.0,,,2022-02-22
Frank Lehmann,Fault Assessment of Flood Protecting Dikes with Remote Sensing,2005.0,"['N Ohle', ' A Elsner', ' S Mai', ' C Zimmermann…']",, Solutions to Coastal …,,,1.0,,,2022-02-22
Frank Lehmann,Towards durable concrete that repairs cracks autonomously,2010.0,"['K Van Tittelboom', ' N De Belie', ' F Lehmann…']",, … RILEM Conference on …,,,1.0,,122.0,2022-02-22
Frank Lehmann,Definition and assessment of an adhesively bonded composite reinforcement in fatigue for steel structures developped in fasstbridge project,2018.0,"['S Chataigner', ' K Benzarti', ' G Forêt…']",, … sur les composites …,,,1.0,,,2022-02-22
Frank Lehmann,Automation in 3D georadar investigations: new acquisition and processing techniques,1999.0,['F Lehmann '],,,,,1.0,,,2022-02-22
Frank Lehmann,Holistic Cycle Time Analysis and Improvement Project within a 200mm Lithography I-line Production Area,2006.0,"['T Zarbock', ' F Lehmann…']",, The Annual SEMI …,,,1.0,,,2022-02-22
Frank Lehmann,Vectorial nature of georadar data,2000.0,"['F Lehmann', ' D Boerner', ' K Holliger…']",, … Conference on Ground …,,,1.0,,122.0,2022-02-22
Frank Lehmann,"Plasma steroid patterns in normal, pathological and induced ovarian cycles",1971.0,"['F Lehmann', ' G Bettendorf…']",, European Journal of …,,,1.0,C,299.0,2022-02-22
Frank Lehmann,MRI in muscle channelopathies,2013.0,['K Jurkat'],,Rott,,,2.0,,,2022-02-22
Frank Lehmann,[HTML][HTML] Skeletal muscle calcium channel mutation R528G: enhanced channel inactivation and omega-current at hyperpolarization contribute to hypokalemic periodic …,2016.0,"['M Bednarz', ' Y Da', ' F Lehmann']",,Horn,,,2.0,,,2022-02-22
Frank Lehmann,Myofibroblast density in fasciae,2009.0,"['R Schleip', ' S Rankl', ' A Zorn…']",, Proceedings of the …,,,2.0,D,771.0,2022-02-22
Frank Lehmann,Muscle channelopathies. Myotonias and periodic paralyses,2011.0,['K Jurkat'],,Rott,,,2.0,,,2022-02-22
Frank Lehmann,Hypokalemic periodic paralysis induced by thymic hyperplasia and relieved by thymectomy,2013.0,"['R Yang', ' K Jurkat']",,Rott,,,2.0,,,2022-02-22
Frank Lehmann,Drohnengestützte Erfassung von maritimen Infrastrukturen,2020.0,"['D Heuskin', ' F Lehmann ']",,,,,1.0,,,2022-02-22
Frank Lehmann,Airborne camera and spectrometer experiments and data evaluation,2009.0,"['FF Lehmann', ' T Bucher', ' S Pless…']",, Remote Sensing for …,,,2.0,,124.0,2022-02-22
Frank Lehmann,[BOOK][B] Therapie und Verlauf neurologischer Erkrankungen,2017.0,"['B Schoser', ' JB Schulz', ' V Dietz', ' V Ghilescu', ' T Schenk… ']",,,,,5.0,,,2022-02-22
Frank Lehmann,Kooperationsverbund zur Realisierung der Gesundheitsförderung bei sozial Benachteiligten in Deutschland,2009.0,['F Lehmann'],, Gesundheitliche Ungleichheit,,,3.0,,,2022-02-22
Frank Lehmann,Myotonic disorders,2007.0,"['F Lehmann‐Horn', ' K Jurkat‐Rott']",, Handbook of Clinical Neurology,,,1.0,,42.0,2022-02-22
Frank Lehmann,Finite State Machines and Timed Automata: A Hierarchical Approach for Integrated Traffic Microsimulations,2018.0,"['F Lehmann', ' PS Roop', ' P Ranjitkar']",, … of Traffic and Logistics Engineering Vol,,,,,22.0,2022-02-22
Frank Lehmann,Medizinische Chemie und molekulare Hemmmechanismen der Tyrosinkinase‐Inhibitoren. Schwerpunkt pharmazeutischer Forschung,2008.0,"['M Holm', ' F Lehmann', ' S Laufer']",, Pharmazie in unserer Zeit,,,3.0,,24.0,2022-02-22
Frank Lehmann,Schulung von KrankenkassenmitarbeiterInnen zur Gesundheitsförderung im Rahmen des § 20 Sozialgesetzbuch (SGB) Fünftes Buch (V),1996.0,"['W Hass', ' FF Lehmann']",, Zeitschrift für Gesundheitswissenschaften,,,3.0,k.R.,30.0,2022-02-22
Frank Lehmann,ZERSTÖRUNGSFREIE PRÜFUNG UND BAUWERKSÜBER-WACHUNG ALS ELEMENTE DER BAUWERKSPRÜFUNG,2020.0,['FA Lehmann'],,,,,,,,2022-02-22
Frank Lehmann,Markov and Eyring Modeling Predict Differential Contributions of Homologous Mutations in Hypokalemic Periodic Paralysis to Skeletal Muscle Fiber Excitability,2021.0,"['JR Groome', ' L Bayless']",,Edwards,,,,,,2022-02-22
Frank Lehmann,[HTML][HTML] Kir2. 2 p. Thr140Met: a genetic susceptibility to sporadic periodic paralysis,2018.0,"['C Fan', ' M Kuhn', ' AP Mbiol', ' J Groome', ' V Winston…']",, Acta …,,,1.0,,170.0,2022-02-22
Frank Lehmann,Qualitätsmanagement in der Prävention und Gesundheitsförderung,2014.0,"['U Walter', ' M Plaumann', ' F Lehmann']",, Public Health Forum,,,2.0,,34.0,2022-02-22
Frank Lehmann,Interferon-γ Resistance and Immune Evasion in Glioma Develop via Notch-Regulated Co-Evolution of Malignant and Immune Cells,,"['E Parmigiani', ' R Ivanek', ' C Rolando', ' K Hafen', ' A Gerber… ']",,,,,,,,2022-02-22
Frank Lehmann,Microtearing of the superficial layer of lumbar fascia as a source for low back pain,,"['R Schleip', ' S Rankl', ' A Zorn', ' F Lehmann']",,,,,1.0,,,2022-02-22
Frank Lehmann,Novel Mutation of SCN1A in a German Family Presenting with both Hemiplegic Migraine and Epilepsy,2015.0,"['C Fan', ' F Lehmann']",,Horn,,,1.0,,,2022-02-22
Frank Lehmann,Sarcolemmal Ion Channelopathies,2013.0,"['K Jurkat‐Rott', ' F Lehmann‐Horn']",, Muscle Disease: Pathology …,,,1.0,,,2022-02-22
Frank Lehmann,Humidity and Temperature Variation in Building Stones: Comparing Simulation Results and Impedance Measurements,,"['NRM Sakiyama', ' SBM Hejazi', ' J Frick', ' F Lehmann… ']",,,,,,,,2022-02-22
Frank Lehmann,Simulating Intelligent Transport Systems with Discrete Traffic Models on Grid Topologies,,"['F Lehmann', ' N Sharma', ' P Ranjitkar', ' PS Roop ']",,,,,,,,2022-02-22
Frank Lehmann,WIRTSCHAFT,2004.0,['F Lehmann '],,,,,2.0,,,2022-02-22
Frank Lehmann,""" German Aerospace Center (DLR), Institute of Space Sensor Technology and Planetary Exploration, Adlershof",,"['A HOFFMANN', ' JW VAN DER VEGT', ' F LEHMANN ']",,,,,,,,2022-02-22
Frank Lehmann,Last-Mile-Numerical Last-Mile Tsunami Early Warning and Evacuation Information System,2009.0,"['H Taubenböck', ' N Goseberg', ' N Setiadi…']",,,,,2.0,,,2022-02-22
Frank Lehmann,"Myotone Dystrophien, nicht dystrophe Myotonien und periodische Paralysen",2018.0,['C Schneider'],,Gold,,,3.0,,59.0,2022-02-22
Frank Lehmann,Development and application of FASSTbridge solution to Jarama bridge (Fast and effective Solution for Steel bridges lifetime extension),2018.0,"['S Chataigner', ' K Benzarti', ' G Forêt', ' JF Caron…']",, IABSE …,,,,,,2022-02-22
Frank Lehmann,Car-Following Behaviour: Statistical Analysis of Differences Between Drivers,2017.0,"['F Lehmann', ' P Ranjitkar…']",, Australasian …,,,,,38.0,2022-02-22
Frank Lehmann,Management Games for Group Decision Making in a Dynamic,,"['PM Milling', ' F Lehmann ']",,,,,,,,2022-02-22
Frank Lehmann,Application of the magnetic leakage field method to investigate wire strands,2018.0,"['M Schreiner', ' F Lehmann ']",,,,,,,,2022-02-22
Frank Lehmann,High-Frequency Sources in Shallow Seismic Experiments,1998.0,"['M Veen', ' H Buness', ' F Nitsche', ' F Büker…']",, Symposium on the …,,,,,49.0,2022-02-22
Frank Lehmann,Experimental evaluation of the developed reinforcement system in FASSTBridge project,2017.0,"['S Chataigner', ' K Benzarti…']",, SMAR,,,,,,2022-02-22
Frank Lehmann,Adding new dimensions to fluorescence microscopy,2009.0,"['C Biskup', ' J Kusch', ' E Schulz…']",, … Microscopy in the …,,,,,,2022-02-22
Frank Lehmann,[HTML][HTML] The Genomic Landscape of Serrated Lesion of the Colorectum: Similarities and Differences With Tubular and Tubulovillous Adenomas,2021.0,"['L Tornillo', ' FS Lehmann', ' A Garofoli', ' V Paradiso…']",, Frontiers in …,,,,,133.0,2022-02-22
Frank Lehmann,Effect of a strong axial magnetic field in the plasma recombination and extreme ultraviolet emission from a highly-ionized capillary discharge,,"['FJ Lehmann', ' M Villagran', ' JF Schmerge', ' JJ Rocca… ']",,,,,,,,2022-02-22
Frank Lehmann,Daimler Trucks,2008.0,"['FH Lehmann', ' A Grzegorski']",, … : Ein Leitfaden Fr Die Praxis/a …,,,,,,2022-02-22
Frank Lehmann,The Definition of Dynamic Z,,['FLE Lehmann '],,,,,,,,2022-02-22
Frank Lehmann,An efficient approach to shallow high-resolution seismic data acquisition: Preliminary results,1997.0,"['M van der Veen', ' F Lehmann', ' P Wild', ' A Green']",, EEGS Meeting,,,,,,2022-02-22
Frank Lehmann,Monitoring of the Process Environment,2013.0,"['HJ Bässler', ' F Lehmann']",, Containment Technology,,,,,,2022-02-22
Frank Lehmann,Towards automated map updating: detecting houses with new digital data-acquisition and processing techniques,2000.0,"['A Hoffmann', ' JW Van Der Vegt…']",, IGARSS IEEE …,,,,,,2022-02-22
Frank Lehmann,Evaluation of GER airborne scanner data for environmental applications,1990.0,"['F Lehmann', ' H Rothfuss…']",, Optics in Complex Systems,,,,,32.0,2022-02-22
Frank Lehmann,Product Protection Isolators,2013.0,"['HJ Bässler', ' F Lehmann']",, Containment Technology,,,,,,2022-02-22
Frank Lehmann,Cleaning,2013.0,"['HJ Bässler', ' F Lehmann']",, Containment Technology,,,,,,2022-02-22
Frank Lehmann,"< 5cm Ground Resolution DEMs for the Atacama Fault System (Chile), Acquried With the Modular Airborne Camera System (MACS)",2011.0,"['O Zielke', ' P Victor', ' O Oncken…']",, AGU Fall Meeting …,,,,,,2022-02-22
Frank Lehmann,Access Devices,2013.0,"['HJ Bässler', ' F Lehmann']",, Containment Technology,,,,,,2022-02-22
Frank Lehmann,Introduction/Definition,2013.0,"['HJ Bässler', ' F Lehmann']",, Containment Technology,,,,,,2022-02-22
Frank Lehmann,Three dimensional georadar acquisition with a real time positioning system,1997.0,"['F Lehmann', ' M van der Veen', ' AC Green…']",, EEGS …,,,,,,2022-02-22
Frank Lehmann,A new fluorescent dye for cell tracing and mitochondrial,2015.0,"['AT Press', ' L Ungelenk', ' AC Rinkenauer', ' M Gröger… ']",,,,,,,,2022-02-22
Frank Lehmann,On top of the world: Covering Mount Everest in 3D from a Stemme powered glider with the airborne high-altitude camera system MACS–Himalaya,2014.0,"['F Lehmann', ' R Berger', ' J Brauchle', ' D Hein', ' A Wieden ']",,,,,,,,2022-02-22
Frank Lehmann,Perforation Resistance of Reinforced Concrete Slabs Impacted by Low Velocity Drop Loads,2015.0,"['A Fila', ' F Lehmann', ' R Tropp ']",,,,,,,,2022-02-22
Frank Lehmann,CD19 as Foreign Antigen Elicits a Specific T-Cell Response and Mediates Rejection of High Grade B-Cell Lymphoma In Mice,2010.0,"['F Lehmann', ' A Gerbitz', ' C Loddenkemper', ' E Kremmer… ']",,,,,,,,2022-02-22
Frank Lehmann,"New optical sensor systems for high-resolution satellite, airborne and terrestrial imaging systems",2007.0,"['A Eckardt', ' A Börner', ' F Lehmann']",, Sensors,,,,,57.0,2022-02-22
Frank Lehmann,"Safe Change Filter Systems for Isolators, Containments, and RABS",2013.0,"['HJ Bässler', ' F Lehmann']",, Containment Technology,,,,,,2022-02-22
Frank Lehmann,Isolators for Personnel-and Environmental Protection,2013.0,"['HJ Bässler', ' F Lehmann']",, Containment Technology,,,,,,2022-02-22
Frank Lehmann,"Proceedings of the International RILEM Conference-Materials, Systems and Structures in Civil Engineering 2016. Segment on Moisture in Materials and Structures.",2016.0,"['KK Hansen', ' C Rode', ' LO Nilsson', ' C Zhou', ' F Ren…']",, … RILEM Conference on …,,,,,122.0,2022-02-22
Frank Lehmann,Decontamination of Aseptically Operated Isolators,2013.0,"['HJ Bässler', ' F Lehmann']",, Containment Technology,,,,,,2022-02-22
Frank Lehmann,HRSC hgh resolution stereo camera digital airborne imager: three years of operational data production and applications,2003.0,['F Lehmann'],, … Monitoring,,,,,,2022-02-22
Frank Lehmann,[HTML][HTML] Stromal Cross-Presentation and Host Interferon-ÃŽÂ³ Signaling and Are Required for Elimination of Antigen-Loss Variants of High-Grade B Cell Lymphomas …,2010.0,"['A Gerbitz', ' M Sukumar', ' F Helm', ' A Wilke', ' C Friese…']",, Blood,,,,,465.0,2022-02-22
Frank Lehmann,Measurement of masticatory forces in the horse,2005.0,"['C Staszyk', ' F Lehmann', ' A Bienert', ' K Ludwig…']",, …,,,,,,2022-02-22
Frank Lehmann,A System—Dynamics Examination of the Effects of the Mahaweli—Project in Sri Lanka,1989.0,"['F Lehmann', ' T Lehner', ' J Beckmann']",,,,,,,,2022-02-22
Frank Lehmann,System Validation,2013.0,"['HJ Bässler', ' F Lehmann']",, Containment Technology,,,,,,2022-02-22
Frank Lehmann,Studi e Statistiche,,"['F Pizzuto', ' S Comotto', ' M Bonato', ' F Lehmann', ' G Corradi… ']",,,,,,,,2022-02-22
Frank Lehmann,Thermal Infrared Profiling Spectrometer (TIPS),1990.0,"['F Lanzl', ' G Miosga', ' F Lehmann', ' R Richter…']",, Infrared …,,,,,,2022-02-22
Frank Lehmann,Imaging Laser Spectroscopy By Limes,1988.0,"['V Klein', ' W Wiesemann', ' F Lehmann']",, Infrared technology XIV,,,,,,2022-02-22
Frank Lehmann,[HTML][HTML] a High-Resolution Space Camera (hrsc) for Earth Observation in Regional Scales,1996.0,"['G Neukum', ' R Jaumann', ' H Hoffmann…']",, Space Station …,,,,,,2022-02-22
Frank Lehmann,Technological Outlook,2013.0,"['HJ Bässler', ' F Lehmann']",, Containment Technology,,,,,,2022-02-22
Frank Lehmann,Industrie 4.0 Digitalization–more than just fancy!,2018.0,['F Lehmann'],, Commercial Vehicle Technology,,,1.0,,,2022-02-22
Frank Lehmann,Correction to: Preclinical pharmacological in vitro investigations on low chloride conductance myotonia: effects of potassium regulation,2020.0,"['H Kerstin', ' C Sunisa', ' F Lehmann']",,,,,,,,2022-02-22
Frank Lehmann,Hotline für maligne Hyperthermie,2011.0,"['W Klingler', ' F Lehmann']",,Horn,,,3.0,,,2022-02-22
Frank Lehmann,"[HTML][HTML] Hypokalemic Periodic Paralysis Synonyms: HOKPP, HypoPP",,"['F Weber', ' F Lehmann']",,,,,,,,2022-02-22
Frank Lehmann,Investigating a Domain I Hypokalemic Periodic Paralysis Mutation in hNaV1. 4: A Computational Approach,2018.0,['LJ Bayless'],,Edwards,,,,,,2022-02-22
Frank Lehmann,Characterization of a NaV1. 4 Hypokalemic Periodic Paralysis Mutation in Domain I,2018.0,"['JR Groome', ' L Bayless']",,Edwards,,,,,,2022-02-22
Frank Lehmann,Zerstörungsfreie Untersuchungen mittels Impact Echo und Georadar am Turmhelm der Marienkirche in Reutlingen,2009.0,"['J Frick', ' F Lehmann', ' F Grüner']",, ZfP in Forschung,,,1.0,,,2022-02-22
Frank Lehmann,Zerstörungsfreie und minimalinvasive Prü-fung von Holzbrücken,2010.0,"['F Lehmann', ' G Dill']",,Langer,,,1.0,,,2022-02-22
Frank Lehmann,Kinder stark machen—Gesundheitsförderung und Prävention bei Kindern und Jugendlichen,2009.0,"['E Pott', ' G Marsen']",,Storz,,,1.0,,,2022-02-22
Frank Lehmann,N eurological R esearchand T herapy,,"['M Bednarz', ' Y Da', ' F Lehmann']",,Horn,,,,,,2022-02-22
Frank Lehmann,Semiautomatisches aseptisches Füllen,2012.0,"['HJ Bässler', ' F Lehmann']",, TechnoPharm,,,1.0,,,2022-02-22
Frank Lehmann,Hochauflösende Oberflächenmodelle und True Ortho Photos aus digitalen Luftbildkameras: die Entwicklung anhand von Beispielen der letzten 10 Jahre,2011.0,"['F Lehmann', ' T Bucher', ' S Pless…']",, … und Geoinformation eV,,,1.0,,,2022-02-22
Frank Lehmann,Schulsozialarbeit—ungeliebt und unentbehrlich,2009.0,['F Lehmann'],, Jugend im Diskurs—Beiträge aus Theorie und Praxis,,,1.0,,,2022-02-22
Frank Lehmann,[PS][PS] Implementierung von Algorithmen zur Berechnung modularer Polynome und deren Anwendung im Algorithmus von Atkin,1994.0,['FJ Lehmann '],,,,,1.0,,,2022-02-22
Frank Lehmann,EXTRACELLULAR pH,,['F LEHMANN'],,HORN,,,,,,2022-02-22
Frank Lehmann,GGGGGGGGzGGGK LKKKGG SLS SLL S GG L GGGG GGG GGGGGG LLLLLYLLL GG,,['F LEHMANN'],,HORN,,,,,,2022-02-22
Frank Lehmann,Retraction statement,2014.0,"['B Holzherr', ' F Lehmann']",,Horn,,,,,,2022-02-22
Frank Lehmann,Sodium channelopathies in skeletal muscle and brain,2002.0,"['H Lerche', ' N Mitrovic', ' K Jurkat']",,,,,,,,2022-02-22
Frank Lehmann,"This copy is for personal use only. To order printed copies, contact reprints@ rsna. org",,"['MA Weber', ' AM Nagel', ' AM Marschar', ' P Glemser… ']",,,,,,,,2022-02-22
Frank Lehmann,Familial cramp due to potassium-aggravated,,"['RW Orrell', ' K Jurkat']",,Rott,,,,,,2022-02-22
Frank Lehmann,[HTML][HTML] CHEMICAL BIOLOGY,,['F Lehmann'],,Horn,,,,,,2022-02-22
Frank Lehmann,Disease-causing mutations,,['F LEHMANN'],,,,,,,,2022-02-22
Frank Lehmann,Domain III S4 in Closed-State Fast Inactivation: Insights from a Periodic Paralysis Mutation revision to MS# 2014CHANNELS0042R,,"['JR Groome', ' K Jurkat']",,Rott,,,,,,2022-02-22
Frank Lehmann,Malignant Hyperthermia and Neuroleptic Malignant Syndrome,2003.0,"['M Weller', ' F Lehmann']",,,,,,,,2022-02-22
Frank Lehmann,Dyskalemic Periodic Paralyses,2003.0,['F Lehmann'],,Horn,,,,,,2022-02-22
Frank Lehmann,Do Calcium Activated Potassium Channels Control Proliferation of Myofibroblasts? Implications for Fibroproliferative Diseases,2012.0,"['H Jäger', ' W Klingler…']",, Journal of …,,,,A+,259.0,2022-02-22
Frank Lehmann,Effects of a Novel Cav1. 1-R1242G Mutation Leading to Hypokalemic Periodic Paralysis,2013.0,"['C Fan', ' F Lehmann']",,Horn,,,,,,2022-02-22
Frank Lehmann,34 Channelopathies in Epileptology,2016.0,['F Lehmann'],,Horn,,,,,,2022-02-22
Frank Lehmann,Pathogenesis of hypokalemic periodic paralysis,1995.0,['F Lehmann'],,,,,,,,2022-02-22
Frank Lehmann,PARADIGMS FOR THE EFFICACY OF MOLECULAR METHODS IN ELUCIDATING THE PATHOLOGY OF HEREDITARY DISEASES AND IN DEVELOPING …,,"['R ROdel', ' F Lehmann']",,,,,,,,2022-02-22
Frank Lehmann,A Novel NaV1. 1 Mutation L1613P Associated with Familial Hemiplegic Migraine,2014.0,"['C Fan', ' F Lehmann']",,Horn,,,,,,2022-02-22
Frank Lehmann,Effect Of Temperature On Slow Inactivation Of WT And R1448H Mutant Sodium Channels,2009.0,"['BD Holzherr', ' K Jurkat']",,Rott,,,,,,2022-02-22
Frank Lehmann,"How can we better understand established factors of risk and protection by research on function of neuro-muscular system, joint and disc?",2004.0,['F LEHMANN'],,HORN,,,,,,2022-02-22
Frank Lehmann,Ion channels in medicine,2007.0,"['F Lehmann‐Horn', ' K Jurkat‐Rott']",, Wiley Encyclopedia of …,,,,,,2022-02-22
Frank Lehmann,Myotonia and Paramyotonia,,['K JURKAT'],,ROTT,,,,,,2022-02-22
Frank Lehmann,Effects of S906T polymorphism on the severity of a novel borderline mutation,,"['C Fan', ' F Lehmann']",,Horn,,,,,,2022-02-22
