AUTHOR_NAME,PUB_TITLE,PUB_YEAR,PUB_AUTHORS,PUB_TYPE,PUB_PUBLISHER,PUB_ISBN,PUB_DOI,PUB_CITATIONS,JOU_RATING_VHB,JOU_RATING_SCIMAGO,UPDATED
Wolfgang Fuchs,Charging effect in electron‐irradiated ice,1978.0,"['W Fuchs', ' JD Brombach', ' W Trösch']",, Journal of Microscopy,,,21.0,D,299.0,2022-03-19
Wolfgang Fuchs,[BOOK][B] Encounters with Alphonso Lingis,2003.0,"['AE Hooke', ' WW Fuchs ']",,,,,11.0,,,2022-03-19
Wolfgang Fuchs,"Increase of N. gonorrhoeae, Chlamydia trachomatis and Ureaplasma in HIV infected individuals",2014.0,"['W Fuchs', ' NH Brockmeyer']",, MMW Fortschritte der Medizin,,,3.0,,13.0,2022-03-19
Wolfgang Fuchs,[BOOK][B] On the maximum number of deficient values of certain classes of functions,1960.0,"['A Edrei', ' WHJ Fuchs ']",,,,,8.0,,,2022-03-19
Christoph Neef,Graphene Roadmap Briefs (No. 2): industrialization status and prospects 2020,2021.0,"['H Döscher', ' T Schmaltz', ' C Neef', ' A Thielmann…']",, Materials,,,10.0,,483.0,2022-03-19
Christoph Neef,A new LiCoPO 4 polymorph via low temperature synthesis,2013.0,"['C Jähne', ' C Neef', ' C Koo', ' HP Meyer…']",, Journal of Materials …,,,58.0,D,299.0,2022-03-19
Christoph Neef,Filled carbon nanotubes as anode materials for lithium-ion batteries,2020.0,"['E Thauer', ' A Ottmann', ' P Schneider', ' L Möller', ' L Deeg…']",, Molecules,,,7.0,,149.0,2022-03-19
Christoph Neef,Industry 4.0 in the european iron and steel industry: Towards an overview of implementations and perspectives,2018.0,"['C Neef', ' S Hirzel', ' M Arens']",, Fraunhofer Institute for Systems and …,,,21.0,,,2022-03-19
Christoph Neef,Morphology and Agglomeration Control of LiMnPO4 Micro- and Nanocrystals,2013.0,"['C Neef', ' C Jähne', ' HP Meyer', ' R Klingeler']",, Langmuir,,,33.0,,333.0,2022-03-19
Christoph Neef,"High-pressure optical floating-zone growth of Li (Mn, Fe) PO4 single crystals",2017.0,"['C Neef', ' H Wadepohl', ' HP Meyer', ' R Klingeler']",, Journal of Crystal Growth,,,20.0,,85.0,2022-03-19
Christoph Neef,Morphology-controlled two-step synthesis and electrochemical studies on hierarchically structured LiCoPO4,2015.0,"['C Neef', ' HP Meyer', ' R Klingeler']",, Solid State Sciences,,,23.0,,59.0,2022-03-19
Christoph Neef,Anisotropic ionic conductivity of LiMn1− xFexPO4 (0≤ x≤ 1) single crystals,2020.0,"['C Neef', ' A Reiser', ' E Thauer', ' R Klingeler']",, Solid State Ionics,,,6.0,,193.0,2022-03-19
Christoph Neef,High magnetic field phase diagram and failure of the magnetic Grüneisen scaling in,2019.0,"['J Werner', ' S Sauerland', ' C Koo', ' C Neef', ' A Pollithy…']",, Physical Review B,,,6.0,,164.0,2022-03-19
Christoph Neef,The role of academic major and academic year for self-determined motivation in cooperative education,2019.0,"['S Wild', ' C Neef']",, Industry and Higher Education,,,6.0,k.R.,90.0,2022-03-19
Christoph Neef,Challenges in the crystal growth of Li2FeSiO4,2021.0,"['W Hergett', ' C Neef', ' HP Meyer', ' R Klingeler']",, Journal of Crystal Growth,,,2.0,,85.0,2022-03-19
Christoph Neef,High-pressure optical floating-zone growth of Li2FeSiO4 single crystals,2019.0,"['W Hergett', ' C Neef', ' H Wadepohl', ' HP Meyer…']",, Journal of Crystal …,,,6.0,D,299.0,2022-03-19
Christoph Neef,A facile synthesis method and electrochemical studies of a hierarchical structured MoS 2/C-nanocomposite,2016.0,"['Z Li', ' A Ottmann', ' E Thauer', ' C Neef', ' H Sai', ' Q Sun…']",, Rsc Advances,,,13.0,,148.0,2022-03-19
Christoph Neef,Exceptional field dependence of antiferromagnetic magnons in,2021.0,"['J Werner', ' C Neef', ' C Koo', ' A Ponomaryov', ' S Zvyagin…']",, Physical Review B,,,,,164.0,2022-03-19
Christoph Neef,Batterien für Elektroautos: Faktencheck und Handlungsbedarf. Sind Batterien für Elektroautos der Schlüssel für eine nachhaltige Mobilität der Zukunft?[Batteries for …,2020.0,"['A Thielmann', ' M Wietschel', ' S Funke', ' A Grimm… ']",,,,,16.0,,,2022-03-19
Christoph Neef,"Growth, characterization, and magnetic properties of a Li (Mn, Ni) PO4 single crystal",2014.0,"['K Wang', ' A Maljuk', ' CGF Blum', ' T Kolb', ' C Jähne…']",, Journal of crystal …,,,9.0,D,299.0,2022-03-19
Christoph Neef,Synthesis and magnetism of a Li2FeSiO4 single crystal,2019.0,"['W Hergett', ' M Jonak', ' J Werner', ' F Billert…']",, Journal of Magnetism …,,,2.0,D,299.0,2022-03-19
Christoph Neef,Antisite disorder in the battery material,2020.0,"['J Werner', ' C Neef', ' C Koo', ' S Zvyagin', ' A Ponomaryov…']",, Physical Review …,,,,,164.0,2022-03-19
Christoph Neef,"Microwave-assisted synthesis and properties of nanosized LiMPO4 (M= Mn, Co)",2012.0,"['C Neef', ' C Jähne', ' R Klingeler']",, Lecture Notes on Impedance …,,,2.0,,,2022-03-19
Christoph Neef,Handlungsorientierter oder traditioneller Unterricht: Welches Konzept fördert berufliche Handlungskompetenz und Lernmotivation?,2009.0,['C Neef'],,,,,3.0,,,2022-03-19
Christoph Neef,"Züchtung und Untersuchung von LiMPO4 und Li2MSiO4 M=(Mn, Fe, Co) Mikro-und Makrokristallen",2016.0,['C Neef '],,,,,1.0,,,2022-03-19
Christoph Neef,Batteries for electric cars: Fact check and need for action. Are batteries for electric cars the key to sustainable mobility in the future?[Batterien für Elektroautos …,2020.0,"['A Thielmann', ' M Wietschel', ' S Funke', ' A Grimm… ']",,,,,,,,2022-03-19
Christoph Neef,Valutazione del comportamento ed esempio di dimensionamento di ancoranti gettati in opera soggetti ad azioni sismiche,2018.0,"['C Neef', ' S Gennai']",, Progettazione Sismica,,,,,,2022-03-19
Christoph Neef,Duale Hochschule Baden-Württemberg Ravensburg,,"['W Bihler', ' C Neef', ' W Bihler', ' C Neef', ' MAY Weber ']",,,,,,,,2022-03-19
Thomas Dietmüller,Ermittlung des wirtschaftlichen Nutzens präventiver Qualitätsmanagement-Methoden in Serienentwicklungsprojekten,2007.0,['T Dietmüller '],,,,,10.0,,,2022-03-19
Thomas Dietmüller,Case Study-A Plan for the Master Plan,2009.0,"['T Dietmüller', ' B Spitler']",, Six Sigma Forum Magazine,,,1.0,,,2022-03-19
Thomas Dietmüller,SCHRIFTENREIHE DER FAKULTÄT FÜR TECHNIK DER DUALEN HOCHSCHULE BADEN-WÜRTTEMBERG RAVENSBURG,,"['B Demmel', ' M Hölle', ' T Dietmüller', ' P Leber', ' IT Kibler ']",,,,,,,,2022-03-19
Bodo Möslein-Tröppner,[BOOK][B] Produktionswirtschaftliche Flexibilität in Supply Chains mit hohen Absatzrisiken: strategische Konzepte und operative Erfolgspotenziale,2010.0,['B Möslein'],,,,,8.0,,,2022-03-19
Bodo Möslein-Tröppner,Salesperson authenticity and gender-based perceptions: an international study,2020.0,"['M Stros', ' T Heinze', ' D Říha', ' B Möslein']",,,,,1.0,,,2022-03-19
Bodo Möslein-Tröppner,THE ROLE OF GENDER IN SALESPERSON PERCEPTION.,2018.0,"['M Stros', ' D Říha…']",, Marketing Science & …,,,3.0,A+,1186.0,2022-03-19
Bodo Möslein-Tröppner,Customer Loyalty-Related Marketing Measures in Fashion Markets,2020.0,['B Möslein'],,Tröppner,,,1.0,,,2022-03-19
Bodo Möslein-Tröppner,Consumers´ Cross-Border Shopping Behaviour in the City of Konstanz,2019.0,"['M Stros', ' B Möslein']",,Tröppner,,,1.0,,,2022-03-19
Bodo Möslein-Tröppner,Komponenten eines digitalen Gamebooks in der Bildung,2018.0,['B Möslein'],,Tröppner,,,1.0,,,2022-03-19
Bodo Möslein-Tröppner,Bestandteile des Digital Learning,2021.0,['B Möslein'],,Tröppner,,,,,,2022-03-19
Bodo Möslein-Tröppner,Praktische Gestaltungsformen des Digital Learning,2021.0,['B Möslein'],,Tröppner,,,,,,2022-03-19
Bodo Möslein-Tröppner,Digital Learning–wie es sich entwickelt hat und was es ist,2021.0,['B Möslein'],,Tröppner,,,,,,2022-03-19
Bodo Möslein-Tröppner,Praktische digitale Unterrichtsformen,2021.0,['B Möslein'],,Tröppner,,,,,,2022-03-19
Bodo Möslein-Tröppner,Digital Learning,,['B Möslein'],,Tröppner,,,1.0,,,2022-03-19
Bodo Möslein-Tröppner,Inhalte und Kompetenzen spielerisch mit digitalen Gamebooks erlernen,2018.0,['B Möslein'],,Tröppner,,,,,,2022-03-19
Bodo Möslein-Tröppner,Schreib dein Gamebook–Handlungsanleitung zur Erstellung,2018.0,['B Möslein'],,Tröppner,,,,,,2022-03-19
Bodo Möslein-Tröppner,Automatisierung der Gamebook-Erstellung mit Templates,2018.0,['B Möslein'],,Tröppner,,,,,,2022-03-19
Bodo Möslein-Tröppner,[BOOK][B] Digitale Gamebooks in der Bildung,2018.0,['B Möslein'],,Tröppner,,,7.0,,,2022-03-19
Stephan Daurer,Einführung in die Wirtschaftsinformatik: Ein fallstudienbasiertes Lehrbuch,2021.0,"['MA Bächle', ' S Daurer', ' A Kolb']",,De Gruyter Oldenbourg,,,41.0,,,2022-03-19
Stephan Daurer,Consumer Search Behavior on the Mobile Internet: An Empirical Analysis,2016.0,"['S Daurer', ' D Molitor', ' M Spann', ' P Manchanda']",,Ross School of Business Paper,,,23.0,,,2022-03-19
Stephan Daurer,Digitalisierung und Konvergenz von Online-und Offline-Welt: Einfluss der mobilen Internetsuche auf das Kaufverhalten,2012.0,"['S Daurer', ' D Molitor', ' M Spann']",,Zeitschrift für Betriebswirtschaft (ZfB),,,22.0,B,,2022-03-19
Stephan Daurer,Assistive technology for independent living with dementia: Stylized facts and research gaps,2018.0,"['M Bächle', ' S Daurer', ' A Judt', ' T Mettler']",,Health Policy and Technology,,,19.0,B,92.0,2022-03-19
Stephan Daurer,Tell Me Where You Are and I’ll Tell You What You Want: Using Location Data to Improve Marketing Decisions,2016.0,"['M Spann', ' D Molitor', ' S Daurer']",,GfK Marketing Intelligence Review,,,18.0,D,,2022-03-19
Stephan Daurer,Measuring Individual Search Costs on the Mobile Internet.,2012.0,"['S Daurer', ' D Molitor', ' M Spann']",,ECIS,,,14.0,,,2022-03-19
Stephan Daurer,Potenziale integrierter Social Software-das Beispiel Skype,2006.0,"['M Bächle', ' S Daurer']",,HMD-Praxis der Wirtschaftsinformatik,,,10.0,D,,2022-03-19
Stephan Daurer,"The Impact of Smartphones, Barcode Scanning, and Location-based Services on Consumers’ Search Behavior",2013.0,"['S Daurer', ' D Molitor', ' M Spann', ' P Manchanda']",,,,,9.0,,,2022-03-19
Stephan Daurer,Parental control reversed: Using ADR for designing a low-cost monitoring system for elderly,2017.0,"['T Mettler', ' M Bächle', ' S Daurer', ' A Judt']",,ICIS Proceedings,,,4.0,,,2022-03-19
Stephan Daurer,Application of Media Synchronicity Theory to Creative Tasks in Virtual Teams Using the Example of Design Thinking,2019.0,"['L Furmanek', ' S Daurer']",,Proceedings of the International Conference on Wirtschaftsinformatik …,,,3.0,C,279.0,2022-03-19
Stephan Daurer,Consumer Preferences for Product Information and Price Comparison Apps,2017.0,"['J Fölting', ' S Daurer', ' M Spann']",,Proceedings of the International Conference on Wirtschaftsinformatik,,,3.0,C,279.0,2022-03-19
Stephan Daurer,iCare—supporting people with increased need for care with smart and mobile IT,2016.0,"['M Bächle', ' S Daurer', ' A Judt', ' T Mettler']",,European Journal of Epidemiology (Supplement)),,,3.0,B,111.0,2022-03-19
Stephan Daurer,iCare – Supporting People with Increased Need for Care with Smart and Mobile IT,2016.0,"['M BÄCHLE', ' S DAURER', ' A JUDT', ' T METTLER']",,Health – Exploring Complexity: An Interdisciplinary Systems Approach …,,,,,,2022-03-19
Stephan Daurer,Chatbots as a User Interface for Assistive Technology in the Workplace,2018.0,"['M Bächle', ' S Daurer', ' A Judt', ' T Mettler']",,Assistenztechnologien in der Arbeitswelt. Beiträge zum Usability Day XVI …,,,2.0,,,2022-03-19
Stephan Daurer,iCare–Do-It-Yourself: Architektur ambienter Assistenzsysteme als ChatBots für Selbstbauer,2017.0,"['A Judt', ' M Bächle', ' S Daurer', ' T Mettler']",,Smart-Future-Living-Bodensee Conference,,,2.0,,,2022-03-19
Stephan Daurer,Do‐It‐Yourself as a Means for Making Assistive Technology Accessible to Elderly People: Evidence from the iCare Project,2021.0,"['T Mettler', ' S Daurer', ' MA Bächle', ' A Judt']",,Information Systems Journal,,,,C,159.0,2022-03-19
Stephan Daurer,Die Aufklärung und das Web 2.0,2019.0,"['MA Bächle', ' S Daurer']",,Wirtschaftsinformatik und Management. DOI:,,,,,,2022-03-19
Stephan Daurer,Digitizing Offline Search: An Empirical Analysis of Search Behavior on the Mobile Internet,2018.0,"['D Molitor', ' S Daurer', ' M Spann', ' P Manchanda']",,Ross School of Business Paper,,,,,,2022-03-19
Stephan Daurer,Notfallerkennung mit ambienten Assistenzsystemen als Bots in sozialen Netzwerken,2017.0,"['M Bächle', ' S Daurer', ' A Judt', ' T Mettler']",,Usability Day XV,,,,,,2022-03-19
Stephan Daurer,"Sag mir, wo du bist und ich sage dir, was du willst. Standortdaten für bessere Marketingentscheidungen.",2016.0,"['M Spann', ' D Molitor', ' S Daurer']",,GfK MIR - Marketingforschung für die Praxis,,,,,,2022-03-19
Stephan Daurer,Adblocker: Bitte keine Werbung!,2016.0,"['T Krohn', ' S Daurer']",,Markenartikel – Fachmagazin für Markenführung,,,,,,2022-03-19
Stephan Daurer,Adblocker,2016.0,"['S Daurer', ' T Krohn']",,MedienWirtschaft - Zeitschrift für Medienmanagement und Medienökonomie,,,,k.R.,,2022-03-19
Stephan Daurer,Location-based Services and Consumer Search on the Mobile Internet,2014.0,['S Daurer'],,epubli,,,,,,2022-03-19
Stephan Daurer,IT-Strategie,2013.0,['S Daurer'],,IT für Existenzgründer und junge Unternehmen - Auswahl,,,,,,2022-03-19
Stephan Daurer,Einkauf durch mobile Suche im Internet,2013.0,"['M Spann', ' S Daurer', ' D Molitor']",,WISU - Das Wirtschaftsstudium,,,,D,,2022-03-19
Frank Lehmann,Durability of the resin bond strength to zirconia ceramic after using different surface conditioning methods,2007.0,"['M Wolfart', ' F Lehmann', ' S Wolfart', ' M Kern']",, Dental Materials,,,635.0,,150.0,2022-02-22
Frank Lehmann,Symptoms of depression and anxiety are independently associated with clinical recurrence of inflammatory bowel disease,2016.0,['A Mikocka'],,Walus,,,209.0,,,2022-02-22
Frank Lehmann,The role and utility of faecal markers in inflammatory bowel disease,2015.0,"['FS Lehmann', ' E Burri…']",, Therapeutic advances in …,,,164.0,C,116.0,2022-02-22
Frank Lehmann,Influence of surface conditioning on bonding to polyetheretherketon (PEEK),2012.0,"['M Kern', ' F Lehmann']",, Dental Materials,,,179.0,,150.0,2022-02-22
Frank Lehmann,Hepatoid adenocarcinoma with liver metastasis mimicking hepatocellular carcinoma: an immunohistochemical and molecular study of eight cases,2003.0,"['LM Terracciano', ' K Glatz', ' P Mhawech…']",, The American journal …,,,172.0,B,111.0,2022-02-22
Frank Lehmann,Influence of surface conditioning and cleaning methods on resin bonding to zirconia ceramic,2011.0,"['A Attia', ' F Lehmann', ' M Kern']",, Dental Materials,,,155.0,,150.0,2022-02-22
Frank Lehmann,""" Last-Mile"" preparation for a potential disaster–Interdisciplinary approach towards tsunami early warning and an evacuation information system for the coastal city of …",2009.0,"['H Taubenböck', ' N Goseberg', ' N Setiadi…']",, … Hazards and Earth …,,,156.0,,99.0,2022-02-22
Frank Lehmann,Acoustic emission analysis for the quantification of autonomous crack healing in concrete,2012.0,"['K Van Tittelboom', ' N De Belie', ' F Lehmann…']",, … and Building Materials,,,151.0,,164.0,2022-02-22
Frank Lehmann,Relating ligand binding to activation gating in CNGA2 channels,2007.0,"['C Biskup', ' J Kusch', ' E Schulz', ' V Nache', ' F Schwede…']",, Nature,,,131.0,,129.0,2022-02-22
Frank Lehmann,Topographic migration of georadar data: Implications for acquisition and processing,2000.0,"['F Lehmann', ' AG Green']",, Geophysics,,,149.0,,172.0,2022-02-22
Frank Lehmann,Topographic migration of georadar data: Implications for acquisition and processing,2000.0,"['F Lehmann', ' AG Green']",, Geophysics,,,149.0,,172.0,2022-02-22
Frank Lehmann,"The effect of storage conditions, contamination modes and cleaning procedures on the resin bond strength to lithium disilicate ceramic.",2009.0,"['K Klosa', ' S Wolfart', ' F Lehmann', ' HJ Wenz…']",, Journal of Adhesive …,,,116.0,D,299.0,2022-02-22
Frank Lehmann,[HTML][HTML] Value of fecal calprotectin in the evaluation of patients with abdominal discomfort: an observational study,2012.0,"['M Manz', ' E Burri', ' C Rothen…']",, BMC …,,,115.0,,106.0,2022-02-22
Frank Lehmann,[HTML][HTML] Interleukin-33-activated islet-resident innate lymphoid cells promote insulin secretion through myeloid cell retinoic acid production,2017.0,"['E Dalmas', ' FM Lehmann', ' E Dror', ' S Wueest', ' C Thienel…']",, Immunity,,,93.0,,395.0,2022-02-22
Frank Lehmann,Structural health monitoring of concrete structures using fibre-optic-based sensors: A review,2021.0,"['FIH Sakiyama', ' F Lehmann…']",, Magazine of Concrete …,,,15.0,,57.0,2022-02-22
Frank Lehmann,Voltage-gated ion channels and hereditary disease,1999.0,['F Lehmann'],,Horn,,,715.0,,,2022-02-22
Frank Lehmann,Four‐year clinical results of fixed dental prostheses with zirconia substructures (Cercon): end abutments vs. cantilever design,2009.0,"['S Wolfart', ' S Harder', ' S Eschbach…']",, European journal of …,,,107.0,C,299.0,2022-02-22
Frank Lehmann,Properties of hot-pressed lithium silicate glass-ceramics,2019.0,"['L Hallmann', ' P Ulmer', ' MD Gerngross', ' J Jetter…']",, Dental materials,,,42.0,,150.0,2022-02-22
Frank Lehmann,Durability of resin bonding to zirconia ceramic using different primers,2009.0,"['F Lehmann', ' M Kern']",, Journal of Adhesive Dentistry,,,94.0,,114.0,2022-02-22
Frank Lehmann,Effect of surface modifications on the bond strength of zirconia ceramic with resin cement resin,2016.0,"['L Hallmann', ' P Ulmer', ' F Lehmann', ' S Wille', ' O Polonskyi…']",, Dental Materials,,,70.0,,150.0,2022-02-22
Frank Lehmann,[HTML][HTML] Microbiota-induced tissue signals regulate ILC3-mediated antigen presentation,2020.0,"['FM Lehmann', ' N von Burg', ' R Ivanek', ' C Teufel…']",, Nature …,,,17.0,,129.0,2022-02-22
Frank Lehmann,Calretinin as a marker for cardiac myxoma: diagnostic and histogenetic considerations,2000.0,"['LM Terracciano', ' P Mhawech', ' K Suess…']",, American journal of …,,,100.0,k.R.,299.0,2022-02-22
Frank Lehmann,Influence of contamination on resin bond strength to nano‐structured alumina‐coated zirconia ceramic,2010.0,"['S Zhang', ' A Kocjan', ' F Lehmann…']",, European Journal of …,,,83.0,C,299.0,2022-02-22
Frank Lehmann,Arylpyrrolizines as Inhibitors of Microsomal Prostaglandin E2 Synthase-1 (mPGES-1) or as Dual Inhibitors of mPGES-1 and 5-Lipoxygenase (5-LOX),2009.0,"['AJ Liedtke', ' PR Keck', ' F Lehmann…']",, Journal of medicinal …,,,83.0,D,299.0,2022-02-22
Frank Lehmann,Semiautomated georadar data acquisition in three dimensions,1999.0,"['F Lehmann', ' AG Green']",, Geophysics,,,134.0,,172.0,2022-02-22
Frank Lehmann,Genetics and pathogenesis of malignant hyperthermia,2000.0,"['K Jurkat‐Rott', ' T McCarthy…']",, Muscle & Nerve: Official …,,,356.0,,145.0,2022-02-22
Frank Lehmann,Durability of resin bonding to lithium disilicate and zirconia ceramic using a self-etching primer,2017.0,"['S Wille', ' F Lehmann', ' M Kern']",, J Adhes Dent,,,55.0,,,2022-02-22
Frank Lehmann,Analysis of pyrolyzates of polystyrene and poly (methyl methacrylate) by gas chromatography,1961.0,"['FA Lehmann', ' GM Brauer']",, Analytical Chemistry,,,193.0,,73.0,2022-02-22
Frank Lehmann,Bond strength of a new generation of universal bonding systems to zirconia ceramic,2016.0,"['N Passia', ' M Mitsias', ' F Lehmann', ' M Kern']",, Journal of the mechanical …,,,50.0,C,431.0,2022-02-22
Frank Lehmann,Polyspermy in in vitro fertilization of human oocytes: frequency and possible causes.,1985.0,"['HH van der Ven', ' S Al']",,Hasani,,,101.0,,,2022-02-22
Frank Lehmann,In situ correlation of cytokine secretion and  apoptosis in Helicobacter pylori-associated gastritis,2002.0,"['FS Lehmann', ' L Terracciano', ' I Carena…']",, American Journal …,,,108.0,k.R.,82.0,2022-02-22
Frank Lehmann,[HTML][HTML] The role of fibrosis in Duchenne muscular dystrophy,2012.0,"['W Klingler', ' K Jurkat']",,Rott,,,194.0,,,2022-02-22
Frank Lehmann,Tensile bond strength of so-called universal primers and universal multimode adhesives to zirconia and lithium disilicate ceramics,2017.0,"['A Elsayed', ' F Younes', ' F Lehmann', ' M Kern']",, J Adhes Dent,,,44.0,,,2022-02-22
Frank Lehmann,Ion channels and epilepsy,2001.0,"['H Lerche', ' K Jurkat‐Rott…']",, American journal of …,,,194.0,k.R.,299.0,2022-02-22
Frank Lehmann,[HTML][HTML] Sodium channelopathies of skeletal muscle result from gain or loss of function,2010.0,['K Jurkat'],,Rott,,,163.0,,,2022-02-22
Frank Lehmann,Multicomponent georadar data: Some important implications for data acquisition and processing,2000.0,"['F Lehmann', ' DE Boerner', ' K Holliger', ' AG Green']",, Geophysics,,,83.0,,172.0,2022-02-22
Frank Lehmann,Red laser-induced fluorescence energy transfer in an immunosystem,2000.0,"['B Oswald', ' F Lehmann', ' L Simon', ' E Terpetschnig…']",, Analytical …,,,86.0,,332.0,2022-02-22
Frank Lehmann,New molecular targets for treatment of peptic ulcer disease,2003.0,"['FS Lehmann', ' P Hildebrand', ' C Beglinger']",, Drugs,,,42.0,,164.0,2022-02-22
Frank Lehmann,ERK phosphorylation is RAF independent in naïve and activated B cells but RAF dependent in plasma cell differentiation,2021.0,"['L Scheffler', ' S Feicht', ' T Babushku', ' LB Kuhn…']",, Science …,,,2.0,A+,1186.0,2022-02-22
Frank Lehmann,Retention of zirconia on titanium in two-piece abutments with self-adhesive resin cements,2018.0,"['C Mehl', ' Q Zhang', ' F Lehmann', ' M Kern']",, The Journal of prosthetic dentistry,,,28.0,A+,60.0,2022-02-22
Frank Lehmann,Tensile bond strength of different universal adhesive systems to lithium disilicate ceramic,2015.0,"['N Passia', ' F Lehmann', ' S Freitag']",,Wolf,,,43.0,,,2022-02-22
Frank Lehmann,Membrane changes in cells from myotonia patients.,1985.0,"['R Rüdel', ' F Lehmann']",,,,,282.0,,,2022-02-22
Frank Lehmann,Monoclonal antibody testing for fecal calprotectin is superior to polyclonal testing of fecal calprotectin and lactoferrin to identify organic intestinal disease in patients …,2013.0,"['E Burri', ' M Manz', ' C Rothen', ' L Rossi', ' C Beglinger…']",, Clinica Chimica …,,,45.0,,142.0,2022-02-22
Frank Lehmann,Skeletal muscle channelopathies,2002.0,['K Jurkat'],,Rott,,,154.0,,,2022-02-22
Frank Lehmann,Complications of anaesthesia in neuromuscular disorders,2005.0,"['W Klingler', ' F Lehmann']",,Horn,,,137.0,,,2022-02-22
Frank Lehmann,Novel lead structures for p38 MAP kinase via FieldScreen virtual screening,2009.0,"['TJ Cheeseright', ' M Holm', ' F Lehmann…']",, Journal of medicinal …,,,56.0,D,299.0,2022-02-22
Frank Lehmann,Breast cancer resistance protein and P-glycoprotein expression in patients with newly diagnosed and therapy-refractory ulcerative colitis compared with healthy …,2008.0,"['H Gutmann', ' P Hruz', ' C Zimmermann', ' A Straumann…']",, Digestion,,,52.0,,75.0,2022-02-22
Frank Lehmann,Perfluoroalkyl end-functionalized oligoesters: correlation between wettability and end-group segregation,2007.0,"['A Synytska', ' D Appelhans', ' ZG Wang', ' F Simon…']",, …,,,61.0,,,2022-02-22
Frank Lehmann,Type D personality is associated with depressive symptoms and clinical activity in inflammatory bowel disease,2021.0,"['SBU Jordi', ' F Botte', ' BM Lang', ' T Greuter…']",, Alimentary …,,,4.0,,,2022-02-22
Frank Lehmann,Depressive symptoms predict clinical recurrence of inflammatory bowel disease,2021.0,"['SBU Jordi', ' BM Lang', ' B Auschra…']",, Inflammatory Bowel …,,,4.0,,146.0,2022-02-22
Frank Lehmann,Fatigue strengthening of steel bridges with adhesively bonded CFRP laminates: Case study,2020.0,"['S Chataigner', ' M Wahbeh…']",, … of Composites for …,,,11.0,,102.0,2022-02-22
Frank Lehmann,Small drones for geo-archaeology in the steppes: locating and documenting the archaeological heritage of the Orkhon Valley in Mongolia,2009.0,"['M Oczipka', ' J Bemmann', ' H Piezonka…']",, Remote Sensing for …,,,42.0,,124.0,2022-02-22
Frank Lehmann,[HTML][HTML] Muscle channelopathies and critical points in functional and genetic studies,2005.0,['K Jurkat'],,Rott,,,119.0,,,2022-02-22
Frank Lehmann,The skeletal muscle chloride channel in dominant and recessive human myotonia,1992.0,"['MC Koch', ' K Steinmeyer', ' C Lorenz', ' K Ricker', ' F Wolf…']",, Science,,,804.0,A+,1186.0,2022-02-22
Frank Lehmann,Physiological mechanisms of lysophosphatidylcholine‐induced de‐ramification of murine microglia,2004.0,"['T Schilling', ' F Lehmann', ' B Rückert…']",, The Journal of …,,,69.0,C,299.0,2022-02-22
Frank Lehmann,Interleukins 12 and 15 induce cytotoxicity and early NK-cell differentiation in type 3 innate lymphoid cells,2017.0,"['A Raykova', ' P Carrega', ' FM Lehmann', ' R Ivanek…']",, Blood …,,,23.0,,465.0,2022-02-22
Frank Lehmann,Fatigue in inflammatory bowel disease and its impact on daily activities,2021.0,"['P Schreiner', ' JB Rossel', ' L Biedermann…']",, Alimentary …,,,7.0,,,2022-02-22
Frank Lehmann,"Fluorescent ligands for optical sensing of alcohols: Synthesis and characterisation of pN, N-dialkylamino-trifluoroacetylstilbenes",1997.0,"['GJ Mohr', ' F Lehmann', ' UW Grummt…']",, Analytica chimica …,,,64.0,,203.0,2022-02-22
Frank Lehmann,Genotype-phenotype correlation and therapeutic rationale in hyperkalemic periodic paralysis,2007.0,['K Jurkat'],,Rott,,,93.0,,,2022-02-22
Frank Lehmann,[HTML][HTML] Clinical and histopathological correlations of fecal calprotectin release in colorectal carcinoma,2014.0,"['FS Lehmann', ' F Trapani', ' I Fueglistaler…']",, World journal of …,,,32.0,D,299.0,2022-02-22
Frank Lehmann,Core myopathies and risk of malignant hyperthermia,2009.0,"['W Klingler', ' H Rueffert', ' F Lehmann']",,,,,87.0,,,2022-02-22
Frank Lehmann,Desis (dlr earth sensing imaging spectrometer for the iss-muses platform),2015.0,"['A Eckardt', ' J Horack', ' F Lehmann', ' D Krutz…']",, … and remote sensing …,,,28.0,,31.0,2022-02-22
Frank Lehmann,[HTML][HTML] mTOR signaling mediates ILC3-driven immunopathology,2021.0,"['C Teufel', ' E Horvath', ' A Peter', ' C Ercan…']",, Mucosal …,,,,,101.0,2022-02-22
