AUTHOR_NAME,PUB_TITLE,PUB_YEAR,PUB_AUTHORS,PUB_PUBLISHER,PUB_CITATIONS,UPDATED
Peter Fischer,Emulsion drops in external flow fields—the role of liquid interfaces,2007.0,"['P Fischer', ' P Erni']",Current Opinion in Colloid & Interface Science,145.0,2022-03-19
Peter Fischer,The filariases,2013.0,"['PE Simonsen', ' PU Fischer', ' A Hoerauf', ' GJ Weil']",Manson's Tropical Diseases: Twenty-Third Edition,140.0,2022-03-19
Peter Fischer,Endosymbiont DNA in endobacteria-free filarial nematodes indicates ancient horizontal genetic transfer,2010.0,"['SN McNulty', ' JM Foster', ' M Mitreva', ' JC Dunning Hotopp', ' J Martin', ' ...']",PloS one,134.0,2022-03-19
Peter Fischer,Time-periodic flow induced structures and instabilities in a viscoelastic surfactant solution,1998.0,"['EK Wheeler', ' P Fischer', ' GG Fuller']",Journal of non-newtonian fluid mechanics,132.0,2022-03-19
Peter Fischer,Molecular cloning of an α-enolase from the human filarial parasite Onchocerca volvulus that binds human plasminogen,2003.0,"['A Jolodar', ' P Fischer', ' S Bergmann', ' DW Büttner', ' S Hammerschmidt', ' ...']",Biochimica et Biophysica Acta (BBA)-Gene Structure and Expression,128.0,2022-03-19
Peter Fischer,Nonlinear rheology of complex fluid–fluid interfaces,2014.0,"['LMC Sagis', ' P Fischer']",Current Opinion in Colloid & Interface Science,120.0,2022-03-19
Peter Fischer,Shear-banding structure orientated in the vorticity direction observed for equimolar micellar solution,2002.0,"['P Fischer', ' EK Wheeler', ' GG Fuller']",Rheologica Acta,119.0,2022-03-19
Peter Fischer,Diversionary role of hoofed game in the transmission of Lyme disease spirochetes.,1993.0,"['FR Matuschka', ' M Heiler', ' H Eiffert', ' P Fischer', ' H Lotter', ' A Spielman']",The American journal of tropical medicine and hygiene,116.0,2022-03-19
Peter Fischer,Polyphenol-binding amyloid fibrils self-assemble into reversible hydrogels with antibacterial activity,2018.0,"['B Hu', ' Y Shen', ' J Adamcik', ' P Fischer', ' M Schneider', ' MJ Loessner', ' ...']",ACS nano,115.0,2022-03-19
Peter Fischer,Hosts on which nymphal Ixodes ricinus most abundantly feed,1991.0,"['FR Matuschka', ' P Fischer', ' K Musgrave', ' D Richter', ' A Spielman']",Am J Trop Med Hyg,115.0,2022-03-19
Peter Fischer,A multicenter evaluation of diagnostic tools to define endpoints for programs to eliminate bancroftian filariasis,2012.0,"['K Gass', ' MVE Beau de Rochars', ' D Boakye', ' M Bradley', ' PU Fischer', ' ...']",PLoS neglected tropical diseases,112.0,2022-03-19
Peter Fischer,Interfacial rheology of surface-active biopolymers: Acacia senegal gum versus hydrophobically modifed starch,2007.0,"['P Erni', ' EJ Windhab', ' R Gunde', ' M Graber', ' B Pfister', ' A Parker', ' P Fischer']",Biomacromolecules,112.0,2022-03-19
Peter Fischer,Laboratory and field evaluation of a new rapid test for detecting Wuchereria bancrofti antigen in human blood,2013.0,"['GJ Weil', ' KC Curtis', ' L Fakoli', ' K Fischer', ' L Gankpala', ' PJ Lammie', ' ...']",The American journal of tropical medicine and hygiene,106.0,2022-03-19
Peter Fischer,Obligatory symbiotic Wolbachia endobacteria are absent from Loa loa,2003.0,"['DW Büttner', ' S Wanji', ' C Bazzocchi', ' O Bain', ' P Fischer']",Filaria Journal,102.0,2022-03-19
Peter Fischer,Mechanical properties of protein adsorption layers at the air/water and oil/water interface: A comparison in light of the thermodynamical stability of proteins,2014.0,"['V Mitropoulos', ' A Mütze', ' P Fischer']",Advances in colloid and interface science,100.0,2022-03-19
Peter Fischer,Determinants of success in national programs to eliminate lymphatic filariasis: a perspective identifying essential elements and research needs,2008.0,"['D Kyelem', ' G Biswas', ' MJ Bockarie', ' MH Bradley', ' M El-Setouhy', ' PU Fischer', ' ...']",The American journal of tropical medicine and hygiene,100.0,2022-03-19
Peter Fischer,Broad bandwidth optical and mechanical rheometry of wormlike micelle solutions,2007.0,"['N Willenbacher', ' C Oelschlaeger', ' M Schopferer', ' P Fischer', ' F Cardinaux', ' ...']",Physical Review Letters,99.0,2022-03-19
Peter Fischer,Time dependent flow in equimolar micellar solutions: transient behaviour of the shear stress and first normal stress difference in shear induced structures coupled with flow …,2000.0,['P Fischer'],Rheologica Acta,96.0,2022-03-19
Peter Fischer,Non-linear flow properties of viscoelastic surfactant solutions,1997.0,"['P Fischer', ' H Rehage']",Rheologica Acta,92.0,2022-03-19
Peter Fischer,Rheological behavior of fine and large particle suspensions,2003.0,"['M Schatzmann', ' P Fischer', ' GR Bezzola']",Journal of Hydraulic Engineering,90.0,2022-03-19
Peter Fischer,,2011.0,"['K Fischer', ' WL Beatty', ' D Jiang', ' GJ Weil', ' PU Fischer']",PLoS neglected tropical diseases,89.0,2022-03-19
Peter Fischer,Transmission assessment surveys (TAS) to define endpoints for lymphatic filariasis mass drug administration: a multicenter evaluation,2013.0,"['BK Chu', ' M Deming', ' NK Biritwum', ' WR Bougma', ' AM Dorkenoo', ' ...']",PLoS neglected tropical diseases,86.0,2022-03-19
Peter Fischer,Simulation and experiments of droplet deformation and orientation in simple shear flow with surfactants,2007.0,"['K Feigl', ' D Megias-Alguacil', ' P Fischer', ' EJ Windhab']",Chemical engineering science,85.0,2022-03-19
Peter Fischer,Shear and dilatational linear and nonlinear subphase controlled interfacial rheology of β-lactoglobulin fibrils and their derivatives,2013.0,"['PA Rühs', ' C Affolter', ' EJ Windhab', ' P Fischer']",Journal of Rheology,82.0,2022-03-19
Peter Fischer,"Effect of acidic, basic and fluoride-catalyzed sol-gel transitions on the preparation of sub-nanostructured silica",1995.0,"['IC Tilgner', ' P Fischer', ' FM Bohnen', ' H Rehage', ' WF Maier']",Microporous Materials,82.0,2022-03-19
Peter Fischer,Rheological approaches to food systems,2009.0,"['P Fischer', ' M Pollard', ' P Erni', ' I Marti', ' S Padar']",Comptes Rendus Physique,81.0,2022-03-19
Peter Fischer,,2017.0,"['SN McNulty', ' JF Tort', ' G Rinaldi', ' K Fischer', ' BA Rosa', ' P Smircich', ' ...']",PLoS genetics,79.0,2022-03-19
Peter Fischer,Simultaneous control of pH and ionic strength during interfacial rheology of β-lactoglobulin fibrils adsorbed at liquid/liquid interfaces,2012.0,"['PA Rühs', ' N Scheuble', ' EJ Windhab', ' R Mezzenga', ' P Fischer']",Langmuir,79.0,2022-03-19
Peter Fischer,"Development and standardization of a rapid, PCR-based method for the detection of Wuchereria bancrofti in mosquitoes, for xenomonitoring the human prevalence of bancroftian …",2002.0,"['SA Williams', ' SJ Laney', ' LA Bierwert', ' LJ Saunders', ' DA Boakye', ' P Fischer', ' ...']",Annals of tropical medicine and parasitology,79.0,2022-03-19
Peter Fischer,In-situ quantification of the interfacial rheological response of bacterial biofilms to environmental stimuli,2013.0,"['PA Rühs', ' L Böni', ' GG Fuller', ' RF Inglis', ' P Fischer']",PLoS One,78.0,2022-03-19
Peter Fischer,Differential human gut microbiome assemblages during soil-transmitted helminth infections in Indonesia and Liberia,2018.0,"['BA Rosa', ' T Supali', ' L Gankpala', ' Y Djuardi', ' E Sartono', ' Y Zhou', ' K Fischer', ' ...']",Microbiome,77.0,2022-03-19
Peter Fischer,Rheology of concentrated suspensions containing mixtures of spheres and fibres,2005.0,"['I Marti', ' O Höfler', ' P Fischer', ' EJ Windhab']",Rheologica acta,77.0,2022-03-19
Peter Fischer,Parasitological and clinical characterization of Simulium neavei-transmitted onchocerciasis in western Uganda,1993.0,"['P Fischer', ' W Kipp', ' J Bamuhiga', ' J Binta-Kahwa', ' A Kiefer', ' DW Buttner']",Tropical medicine and parasitology,77.0,2022-03-19
Peter Fischer,The effects of intermolecular interactions on the physical properties of organogels in edible oils,2016.0,"['FR Lupi', ' V Greco', ' N Baldino', ' B de Cindio', ' P Fischer', ' D Gabriele']",Journal of colloid and interface science,76.0,2022-03-19
Peter Fischer,A numerical procedure for calculating droplet deformation in dispersing flows and experimental verification,2003.0,"['K Feigl', ' SFM Kaufmann', ' P Fischer', ' EJ Windhab']",Chemical Engineering Science,76.0,2022-03-19
Peter Fischer,Sorbitan tristearate layers at the air/water interface studied by shear and dilatational interfacial rheology,2005.0,"['P Erni', ' P Fischer', ' EJ Windhab']",Langmuir,75.0,2022-03-19
Peter Fischer,"Stress driven shear bands and the effect of confinement on their structures a rheological, flow visualization, and rheo-sals study",2005.0,"['V Herle', ' P Fischer', ' EJ Windhab']",Langmuir,75.0,2022-03-19
Peter Fischer,Dilated FCN for multi-agent 2D/3D medical image registration,2018.0,"['S Miao', ' S Piat', ' P Fischer', ' A Tuysuzoglu', ' P Mewes', ' T Mansi', ' R Liao']",Proceedings of the AAAI Conference on Artificial Intelligence,73.0,2022-03-19
Peter Fischer,Stage-associated risk of transmission of the lyme disease spirochete by EuropeanIxodes ticks,1992.0,"['FR Matuschka', ' P Fischer', ' M Heiler', ' S Blümcke', ' A Spielman']",Parasitology research,70.0,2022-03-19
Peter Fischer,Studying bacterial hydrophobicity and biofilm formation at liquid–liquid interfaces through interfacial rheology and pendant drop tensiometry,2014.0,"['PA Rühs', ' L Böcker', ' RF Inglis', ' P Fischer']",Colloids and Surfaces B: Biointerfaces,69.0,2022-03-19
Peter Fischer,,2001.0,"['P Karen', ' PM Woodward', ' J Lindén', ' T Vogt', ' A Studer', ' P Fischer']",Physical Review B,69.0,2022-03-19
Peter Fischer,A multicenter evaluation of a new antibody test kit for lymphatic filariasis employing recombinant Brugia malayi antigen Bm-14,2011.0,"['GJ Weil', ' KC Curtis', ' PU Fischer', ' KY Won', ' PJ Lammie', ' H Joseph', ' ...']",Acta tropica,68.0,2022-03-19
Peter Fischer,,2006.0,"['RU Rao', ' GJ Weil', ' K Fischer', ' T Supali', ' P Fischer']",Journal of Clinical Microbiology,67.0,2022-03-19
Peter Fischer,"Using knowledge, attitudes and practice (KAP) surveys on lymphatic filariasis to prepare a health promotion campaign for mass drug administration in Alor District, Indonesia",2006.0,"['A Krentel', ' P Fischer', ' P Manoempil', ' T Supali', ' G Servais', ' P Rückert']",Tropical medicine & international health,66.0,2022-03-19
Peter Fischer,Deformation of single emulsion drops covered with a viscoelastic adsorbed protein layer in simple shear flow,2005.0,"['P Erni', ' P Fischer', ' EJ Windhab']",Applied Physics Letters,64.0,2022-03-19
Peter Fischer,Protein adsorption and interfacial rheology interfering in dilatational experiment,2013.0,"['PA Rühs', ' N Scheuble', ' EJ Windhab', ' P Fischer']",The European Physical Journal Special Topics,62.0,2022-03-19
Peter Fischer,"Acid phosphatase-11, a tightly linked molecular marker for root-knot nematode resistance in tomato: from protein to gene, using PCR and degenerate primers containing deoxyinosine",1991.0,"['JM Aarts', ' JGJ Hontelez', ' P Fischer', ' R Verkerk', ' A van Kammen', ' P Zabel']",Plant Molecular Biology,62.0,2022-03-19
Peter Fischer,"PCR-based detection and identification of the filarial parasite Brugia timori from Alor Island, Indonesia",2002.0,"['P Fischer', ' H Wibowo', ' S Pischke', ' P Ruckert', ' E Liebau', ' IS Ismid', ' T Supali']",Annals of tropical medicine and parasitology,61.0,2022-03-19
Peter Fischer,Molecular phylogeny of the filaria genus Onchocerca with special emphasis on Afrotropical human and bovine parasites,2007.0,"['A Krueger', ' P Fischer', ' R Morales-Hojas']",Acta Tropica,60.0,2022-03-19
Peter Fischer,Aerial LaneNet: Lane-marking semantic segmentation in aerial imagery using wavelet-enhanced cost-sensitive symmetric fully convolutional neural networks,2018.0,"['SM Azimi', ' P Fischer', ' M Körner', ' P Reinartz']",IEEE Transactions on Geoscience and Remote Sensing,59.0,2022-03-19
Peter Fischer,Diagnostic tools for onchocerciasis elimination programs,2015.0,"['J Vlaminck', ' PU Fischer', ' GJ Weil']",Trends in parasitology,58.0,2022-03-19
Peter Fischer,Filarial antigenemia and Loa loa night blood microfilaremia in an area without bancroftian filariasis in the Democratic Republic of Congo,2014.0,"['DK Bakajika', ' MM Nigo', ' JP Lotsima', ' GA Masikini', ' K Fischer', ' MM Lloyd', ' ...']",The American journal of tropical medicine and hygiene,58.0,2022-03-19
Peter Fischer,,1990.0,"['FR Matuschka', ' R Lange', ' A Spielman', ' D Richter', ' P Fischer']",Journal of medical entomology,58.0,2022-03-19
Peter Fischer,Single bubble deformation and breakup in simple shear flow,2008.0,"['N Müller-Fischer', ' P Tobler', ' M Dressler', ' P Fischer', ' EJ Windhab']",Experiments in fluids,57.0,2022-03-19
Peter Fischer,Investigation of equilibrium solubility of a carob galactomannan,2007.0,"['MA Pollard', ' R Kelly', ' C Wahl', ' P Fischer', ' E Windhab', ' B Eder', ' R Amado']",Food Hydrocolloids,57.0,2022-03-19
Peter Fischer,Rheometry for large-particulated fluids: analysis of the ball measuring system and comparison to debris flow rheometry,2009.0,"['M Schatzmann', ' GR Bezzola', ' HE Minor', ' EJ Windhab', ' P Fischer']",Rheologica Acta,56.0,2022-03-19
Peter Fischer,Extensional properties of hydroxypropyl ether guar gum solutions,2008.0,"['MR Duxenneuner', ' P Fischer', ' EJ Windhab', ' JJ Cooper-White']",Biomacromolecules,56.0,2022-03-19
Peter Fischer,Onchocerca volvulus: expression and immunolocalization of a nematode cathepsin D-like lysosomal aspartic protease,2004.0,"['A Jolodar', ' P Fischer', ' DW Büttner', ' DJ Miller', ' C Schmetz', ' NW Brattig']",Experimental parasitology,56.0,2022-03-19
Peter Fischer,Emulsion drops with complex interfaces: Globular versus flexible proteins,2011.0,"['P Erni', ' EJ Windhab', ' P Fischer']",Macromolecular materials and engineering,55.0,2022-03-19
Peter Fischer,"Potential value of triple drug therapy with ivermectin, diethylcarbamazine, and albendazole (IDA) to accelerate elimination of lymphatic filariasis and onchocerciasis in Africa",2017.0,"['PU Fischer', ' CL King', ' JA Jacobson', ' GJ Weil']",PLoS neglected tropical diseases,54.0,2022-03-19
Peter Fischer,Impact of six rounds of mass drug administration on Brugian filariasis and soil-transmitted helminth infections in eastern Indonesia,2013.0,"['T Supali', ' Y Djuardi', ' M Bradley', ' R Noordin', ' P Rückert', ' PU Fischer']",PLoS neglected tropical diseases,52.0,2022-03-19
Peter Fischer,Characterization of galactomannans isolated from legume endosperms of Caesalpinioideae and Faboideae subfamilies by multidetection aqueous SEC,2010.0,"['MA Pollard', ' B Eder', ' P Fischer', ' EJ Windhab']",Carbohydrate Polymers,52.0,2022-03-19
Peter Fischer,Mathematical models and lymphatic filariasis control: monitoring and evaluating interventions,2006.0,"['E Michael', ' MN Malecela-Lazaro', ' BTA Maegga', ' P Fischer', ' JW Kazura']",Trends in parasitology,52.0,2022-03-19
Peter Fischer,Ion-induced hydrogel formation and nematic ordering of nanocrystalline cellulose suspensions,2017.0,"['P Bertsch', ' S Isabettini', ' P Fischer']",Biomacromolecules,51.0,2022-03-19
Peter Fischer,,2015.0,"['S Wanji', ' N Amvongo-Adjia', ' B Koudou', ' AJ Njouendou', ' ...']",PLoS neglected tropical diseases,51.0,2022-03-19
Peter Fischer,Tailored interfacial rheology for gastric stable adsorption layers,2014.0,"['N Scheuble', ' T Geue', ' EJ Windhab', ' P Fischer']",Biomacromolecules,51.0,2022-03-19
Peter Fischer,,2003.0,"['A Sommer', ' R Rickert', ' P Fischer', ' H Steinhart', ' RD Walter', ' E Liebau']",Infection and Immunity,51.0,2022-03-19
Peter Fischer,Modeling the impact and costs of semiannual mass drug administration for accelerated elimination of lymphatic filariasis,2013.0,"['WA Stolk', ' QA ten Bosch', ' SJ De Vlas', ' PU Fischer', ' GJ Weil', ' AS Goldman']",PLoS neglected tropical diseases,50.0,2022-03-19
Peter Fischer,Neutron diffraction at SINQ,2000.0,"['P Fischer', ' L Keller', ' JÜU Schefer', ' J Kohlbrecher']",Neutron News,50.0,2022-03-19
Peter Fischer,Tailoring emulsions for controlled lipid release: establishing in vitro–in vivo correlation for digestion of lipids,2018.0,"['N Scheuble', ' J Schaffner', ' M Schumacher', ' EJ Windhab', ' D Liu', ' H Parker', ' ...']",ACS applied materials & interfaces,49.0,2022-03-19
Peter Fischer,Persistence of Brugia malayi DNA in vector and non-vector mosquitoes: implications for xenomonitoring and transmission monitoring of lymphatic filariasis,2007.0,"['P Fischer', ' SM Erickson', ' K Fischer', ' JF Fuchs', ' RU Rao', ' BM Christensen', ' ...']",The American journal of tropical medicine and hygiene,49.0,2022-03-19
Peter Fischer,Tunga penetrans: molecular identification of Wolbachia endobacteria and their recognition by antibodies against proteins of endobacteria from filarial parasites,2002.0,"['P Fischer', ' C Schmetz', ' C Bandi', ' I Bonow', ' S Mand', ' K Fischer', ' DW Büttner']",Experimental parasitology,49.0,2022-03-19
Peter Fischer,"High prevalence of Brugia timori infection in the highland of Alor Island, Indonesia.",2002.0,"['T Supali', ' H Wibowo', ' P RÃ¼ckert', ' K Fischer', ' IS Ismid', ' Y Djuardi', ' P Fischer']",The American journal of tropical medicine and hygiene,49.0,2022-03-19
Peter Fischer,Identification of a stress-responsive Onchocerca volvulus glutathione S-transferase (Ov-GST-3) by RT-PCR differential display,2000.0,"['E Liebau', ' ML Eschbach', ' W Tawe', ' A Sommer', ' P Fischer', ' RD Walter', ' ...']",Molecular and biochemical parasitology,49.0,2022-03-19
Peter Fischer,Impact of two rounds of mass drug administration using diethylcarbamazine combined with albendazole on the prevalence of Brugia timoriand of intestinal helminths on Alor Island …,2005.0,"['T Oqueka', ' T Supali', ' IS Ismid', ' P Rückert', ' M Bradley', ' P Fischer']",Filaria Journal,48.0,2022-03-19
Peter Fischer,Effect of oil hydrophobicity on the adsorption and rheology of β-lactoglobulin at oil–water interfaces,2018.0,"['J Bergfreund', ' P Bertsch', ' S Kuster', ' P Fischer']",Langmuir,47.0,2022-03-19
Peter Fischer,Application of a Polymerase Chain Reaction-ELISA to Detect Wuchereria bancrofti in Pools of Wild-Caught Anopheles punctualatus in a Filariasis Control Area in Papua New Guinea,2000.0,"['MJ Bockarie', ' PU Fischer', ' SA Williams', ' PA Zimmerman', ' L Griffin', ' ...']",The American journal of tropical medicine and hygiene,47.0,2022-03-19
Peter Fischer,Liquid jet stability in a laminar flow field,2002.0,"['C Cramer', ' B Berüter', ' P Fischer', ' EJ Windhab']",Chemical engineering & technology,46.0,2022-03-19
Peter Fischer,Detection of the filarial parasite Mansonella streptocerca in skin biopsies by a nested polymerase chain reaction-based assay,1998.0,"['PU Fischer', ' DW Büttner', ' J Bamuhiiga', ' SA Williams']",American Journal of Tropical Medicine and Hygiene,46.0,2022-03-19
Peter Fischer,Interfacial rheology of soy proteins–High methoxyl pectin films,2009.0,"['L Piazza', ' N Dürr-Auster', ' J Gigli', ' EJ Windhab', ' P Fischer']",Food hydrocolloids,45.0,2022-03-19
Peter Fischer,"The safety of double-and triple-drug community mass drug administration for lymphatic filariasis: A multicenter, open-label, cluster-randomized study",2019.0,"['GJ Weil', ' J Bogus', ' M Christian', ' C Dubray', ' Y Djuardi', ' PU Fischer', ' CW Goss', ' ...']",PLoS medicine,44.0,2022-03-19
Peter Fischer,Bridging the gap between the nanostructural organization and macroscopic interfacial rheology of amyloid fibrils at liquid interfaces,2014.0,"['S Jordens', ' PA Rühs', ' C Sieber', ' L Isa', ' P Fischer', ' R Mezzenga']",Langmuir,44.0,2022-03-19
Peter Fischer,Three-dimensional modeling of mechanical forces in the extracellular matrix during epithelial lumen formation,2006.0,"['D Zeng', ' A Ferrari', ' J Ulmer', ' A Veligodskiy', ' P Fischer', ' J Spatz', ' Y Ventikos', ' ...']",Biophysical journal,44.0,2022-03-19
Peter Fischer,,2002.0,"['T Supali', ' IS Ismid', ' P Rückert', ' P Fischer']",Tropical Medicine & International Health,44.0,2022-03-19
Peter Fischer,"Development of a quantitative, competitive polymerase chain reaction–enzyme-linked immunosorbent assay for the detection of Wuchereria bancrofti DNA",1999.0,"['P Fischer', ' X Liu', ' M Lizotte-Waniewski', ' IH Kamal', ' RMR Ramzy', ' ...']",Parasitology research,44.0,2022-03-19
Peter Fischer,Comparing the mitochondrial genomes of Wolbachia-dependent and independent filarial nematode species,2012.0,"['SN McNulty', ' AS Mullin', ' JA Vaughan', ' VV Tkach', ' GJ Weil', ' PU Fischer']",BMC genomics,43.0,2022-03-19
Peter Fischer,Continuous flow structuring of anisotropic biopolymer particles,2009.0,"['P Erni', ' C Cramer', ' I Marti', ' EJ Windhab', ' P Fischer']",Advances in colloid and interface science,43.0,2022-03-19
Peter Fischer,Partial aqueous solubility of low-galactose-content galactomannans—What is the quantitative basis?,2006.0,"['MA Pollard', ' P Fischer']",Current Opinion in Colloid & Interface Science,43.0,2022-03-19
Peter Fischer,Effect of 3 years of biannual mass drug administration with albendazole on lymphatic filariasis and soil-transmitted helminth infections: a community-based study in Republic of …,2017.0,"['SDS Pion', ' CB Chesnais', ' GJ Weil', ' PU Fischer', ' F Missamou', ' M Boussinesq']",The Lancet infectious diseases,42.0,2022-03-19
Peter Fischer,Genomic diversity in Onchocerca volvulus and its Wolbachia endosymbiont,2016.0,"['YJ Choi', ' R Tyagi', ' SN McNulty', ' BA Rosa', ' P Ozersky', ' J Martin', ' ...']",Nature microbiology,42.0,2022-03-19
Thomas Dietmüller,Ermittlung des wirtschaftlichen Nutzens präventiver Qualitätsmanagement-Methoden in Serienentwicklungsprojekten,2007.0,['T Dietmüller '],,10.0,2022-03-19
Thomas Dietmüller,Case Study-A Plan for the Master Plan,2009.0,"['T Dietmüller', ' B Spitler']", Six Sigma Forum Magazine,1.0,2022-03-19
Thomas Dietmüller,SCHRIFTENREIHE DER FAKULTÄT FÜR TECHNIK DER DUALEN HOCHSCHULE BADEN-WÜRTTEMBERG RAVENSBURG,,"['B Demmel', ' M Hölle', ' T Dietmüller', ' P Leber', ' IT Kibler ']",,,2022-03-19
Bodo Möslein-Tröppner,[BOOK][B] Produktionswirtschaftliche Flexibilität in Supply Chains mit hohen Absatzrisiken: strategische Konzepte und operative Erfolgspotenziale,2010.0,['B Möslein'],,8.0,2022-03-19
Bodo Möslein-Tröppner,Salesperson authenticity and gender-based perceptions: an international study,2020.0,"['M Stros', ' T Heinze', ' D Říha', ' B Möslein']",,1.0,2022-03-19
Bodo Möslein-Tröppner,THE ROLE OF GENDER IN SALESPERSON PERCEPTION.,2018.0,"['M Stros', ' D Říha…']", Marketing Science & …,3.0,2022-03-19
Bodo Möslein-Tröppner,Customer Loyalty-Related Marketing Measures in Fashion Markets,2020.0,['B Möslein'],Tröppner,1.0,2022-03-19
Bodo Möslein-Tröppner,Consumers´ Cross-Border Shopping Behaviour in the City of Konstanz,2019.0,"['M Stros', ' B Möslein']",Tröppner,1.0,2022-03-19
Bodo Möslein-Tröppner,Komponenten eines digitalen Gamebooks in der Bildung,2018.0,['B Möslein'],Tröppner,1.0,2022-03-19
Bodo Möslein-Tröppner,Bestandteile des Digital Learning,2021.0,['B Möslein'],Tröppner,,2022-03-19
Bodo Möslein-Tröppner,Praktische Gestaltungsformen des Digital Learning,2021.0,['B Möslein'],Tröppner,,2022-03-19
Bodo Möslein-Tröppner,Digital Learning–wie es sich entwickelt hat und was es ist,2021.0,['B Möslein'],Tröppner,,2022-03-19
Bodo Möslein-Tröppner,Praktische digitale Unterrichtsformen,2021.0,['B Möslein'],Tröppner,,2022-03-19
Bodo Möslein-Tröppner,Digital Learning,,['B Möslein'],Tröppner,1.0,2022-03-19
Bodo Möslein-Tröppner,Inhalte und Kompetenzen spielerisch mit digitalen Gamebooks erlernen,2018.0,['B Möslein'],Tröppner,,2022-03-19
Bodo Möslein-Tröppner,Schreib dein Gamebook–Handlungsanleitung zur Erstellung,2018.0,['B Möslein'],Tröppner,,2022-03-19
Bodo Möslein-Tröppner,Automatisierung der Gamebook-Erstellung mit Templates,2018.0,['B Möslein'],Tröppner,,2022-03-19
Bodo Möslein-Tröppner,[BOOK][B] Digitale Gamebooks in der Bildung,2018.0,['B Möslein'],Tröppner,7.0,2022-03-19
Stephan Sauter,Effect of parameter variations at chip and wafer level on clock skews,2000.0,"['S Sauter', ' D Schmitt']",,47.0,2022-03-19
Tobias Frank,Femtosecond photo-switching of interface polaritons in black phosphorus heterostructures,2017.0,"['MA Huber', ' F Mooshammer', ' M Plankl', ' L Viti', ' F Sandner', ' LZ Kastner', ' ...']",Nature Nanotechnology,168.0,2022-03-19
Tobias Frank,Excitonic valley effects in monolayer WS2 under high magnetic fields,2016.0,"['G Plechinger', ' P Nagler', ' A Arora', ' A Granados del Águila', ' MV Ballottin', ' ...']",Nano Letters,100.0,2022-03-19
Tobias Frank,Spin-orbit coupling in fluorinated graphene,2015.0,"['S Irmer', ' T Frank', ' S Putz', ' M Gmitra', ' D Kochan', ' J Fabian']",Physical Review B,69.0,2022-03-19
Tobias Frank,"Theory of proximity-induced exchange coupling in graphene on hBN/(Co, Ni)",2016.0,"['K Zollner', ' M Gmitra', ' T Frank', ' J Fabian']",Physical Review B,66.0,2022-03-19
Tobias Frank,,2016.0,"['B Scharf', ' T Frank', ' M Gmitra', ' J Fabian', ' I Žutić', ' V Perebeinos']",Physical Review B,50.0,2022-03-19
Tobias Frank,Protected Pseudohelical Edge States in  Z2 -Trivial Proximitized Graphene,2018.0,"['T Frank', ' P Högl', ' M Gmitra', ' D Kochan', ' J Fabian']",Phys. Rev. Lett.,46.0,2022-03-19
Tobias Frank,Theory of electronic and spin-orbit proximity effects in graphene on Cu (111),2016.0,"['T Frank', ' M Gmitra', ' J Fabian']",Physical Review B,35.0,2022-03-19
Tobias Frank,Many-body quantum Monte Carlo study of 2D materials: cohesion and band gap in single-layer phosphorene,2018.0,"['T Frank', ' R Derian', ' K Tokar', ' J Mitas', ' Lubos', ' Fabian', ' I Stich']",Physical Review X,28.0,2022-03-19
Tobias Frank,Quantum anomalous hall effects in graphene from proximity-induced uniform and staggered spin-orbit and exchange coupling,2020.0,"['P Högl', ' T Frank', ' K Zollner', ' D Kochan', ' M Gmitra', ' J Fabian']",Physical Review Letters,26.0,2022-03-19
